Original,Translate_de_1
 ecco le ’nsidie che dietro a pochi giri son nascose,"Hier sind die Fallstricke, die in ein paar Jahren auf dich warten."
" Non vo’ però ch’a’ tuoi vicini invidie, poscia che s’infutura la tua vita vie più là che ’l punir di lor perfidie»","Ich will aber nicht, daß du deinen Mitbürgern Groll gibst, denn dein Leben wird weit über die Strafe hinausgehen, die auf ihre Bosheit wartet."
" Poi che, tacendo, si mostrò spedita l’anima santa di metter la trama in quella tela ch’io le porsi ordita, ","Nachdem die heilige Seele stillgestanden hatte, bewies sie, daß sie die Handlung in dieser Leinwand vollendet hatte, deren Saiten sie hatte,"
" io cominciai, come colui che brama, dubitando, consiglio da persona che vede e vuol dirittamente e ama","Ich fing an wie der, der Zweifel hat und Rat von dem, der sieht, will und liebt nach Gerechtigkeit."
" «Ben veggio, padre mio, sì come sprona lo tempo verso me, per colpo darmi tal, ch’è più grave a chi più s’abbandona","Ich sehe gut, mein Vater, daß die Zeit schnell zu mir geht, um mir einen solchen Schlag zu geben, daß es um so schwerer ist, je mehr man sich ihm hingibt."
" per che di provedenza è buon ch’io m’armi, sì che, se loco m’è tolto più caro, io non perdessi li altri per miei carmi","Darum ist es notwendig, daß ich mich wehre mit Vernünftigkeit, damit ich, wenn ich von dem Ort, der mir am teuersten ist, weggehe, die andern nicht verliere um meiner Verse willen."
" Giù per lo mondo sanza fine amaro, e per lo monte del cui bel cacume li occhi de la mia donna mi levaro, ","Hinunter in die unendlich bittere Welt, und entlang des Berges, von dessen schöner Spitze die Augen meiner Frau hoben mich,"
" e poscia per lo ciel, di lume in lume, ho io appreso quel che s’io ridico, a molti fia sapor di forte agrume","und nachher im Paradies, vom Himmel im Himmel, habe ich Dinge erfahren, die, wenn ich es verkündige, für viele unangenehm schmecken werden."
" e s’io al vero son timido amico, temo di perder viver tra coloro che questo tempo chiameranno antico»","Und wenn ich ein schüchterner Freund der Wahrheit sein werde, fürchte ich, dass ich nicht die Möglichkeit habe, unter denen zu leben, die diese Zeit als alt bezeichnen werden."
" La luce in che rideva il mio tesoro ch’io trovai lì, si fé prima corusca, quale a raggio di sole specchio d’oro","Das Licht, in dem mein Schatz leuchtete, den ich daselbst fand, wurde zuerst leuchtend wie ein goldener Spiegel, der von der Sonne getroffen wurde."
 indi rispuose,Dann antwortete er.
 «Coscïenza fusca o de la propria o de l’altrui vergogna pur sentirà la tua parola brusca,Ein schlechtes Gewissen für die eigene Schuld oder für andere wird deine Worte sicher als unangenehm empfinden.
" Ma nondimen, rimossa ogne menzogna, tutta tua visïon fa manifesta","Aber nimm jede Lüge weg und zeige alles, was du gesehen hast."
 e lascia pur grattar dov’ è la rogna,und laß den Pöbel kratzen.
" Ché se la voce tua sarà molesta nel primo gusto, vital nodrimento lascerà poi, quando sarà digesta","Denn deine Stimme, wenn es unliebsam ist bei dem ersten Mahl, und wenn sie gleich ist, wird sie eine lebendige Nahrung hinterlassen."
" Questo tuo grido farà come vento, che le più alte cime più percuote","Dieses Schreien wird wie ein Wind sein, der die höchsten Gipfel trifft,"
 e ciò non fa d’onor poco argomento,Und das ist kein Grund zur Ehre.
" Però ti son mostrate in queste rote, nel monte e ne la valle dolorosa pur l’anime che son di fama note, ","Darum werden dir in diesen Himmeln, im Fegefeuer und im schmerzhaften Tal der Hölle nur die Seelen gezeigt, die sehr berühmt sind,"
" che l’animo di quel ch’ode, non posa né ferma fede per essempro ch’aia la sua radice incognita e ascosa, ","Denn die Seele dessen, der hört, hört nicht auf und glaubt nicht an ein Beispiel, das seine verborgene und unbekannte Wurzel hat,"
 né per altro argomento che non paia»,"Weder auf ein anderes Argument, das nicht ganz offensichtlich ist, noch auf ein anderes Argument."
" Già si godeva solo del suo verbo quello specchio beato, e io gustava lo mio, temprando col dolce l’acerbo","Und der Selige genoss nur seine Worte, und ich hörte von denen, die ich gehört hatte, und beugte die Zärtlichkeit mit der Sanftmut."
 e quella donna ch’a Dio mi menava disse,"Und die Frau, die mich zu Gott führte, sprach:"
 «Muta pensier,"""Du sollst dich nicht niederschlagen,"
 pensa ch’i’ sono presso a colui ch’ogne torto disgrava»,"denkt, daß ich nahe bin dem, der alles Unrecht wiedergutmacht"
 Io mi rivolsi a l’amoroso suono del mio conforto,"Und ich wandte mich an die, die mich tröstete mit dem lieblichen Klang ihrer Stimme."
" e qual io allor vidi ne li occhi santi amor, qui l’abbandono","Und ich kann hier nicht die Liebe beschreiben, die ich damals in seinen heiligen Augen sah."
" non perch’ io pur del mio parlar diffidi, ma per la mente che non può redire sovra sé tanto, s’altri non la guidi","nicht nur, weil ich nicht vertraue auf meine Ausdrucksfähigkeiten, sondern weil mein Gedächtnis nicht mehr erinnern kann, wenn sie nicht von Gott gestützt wird."
" Tanto poss’ io di quel punto ridire, che, rimirando lei, lo mio affetto libero fu da ogne altro disire, ","Von diesem Moment kann ich nur sagen, dass, wenn ich Beatrice anschaue, meine Zuneigung frei war von allen anderen Wünschen,"
" fin che ’l piacere etterno, che diretto raggiava in Bëatrice, dal bel viso mi contentava col secondo aspetto","bis die ewige Schönheit Gottes, die direkt in Beatrice strahlte, von ihrem schönen Angesicht zu mir kam."
" Vincendo me col lume d’un sorriso, ella mi disse","Als Beatrice mich mit dem Licht ihres Lächelns gewann, sagte sie zu mir:"
 «Volgiti e ascolta,. . . . . . . . . . . . . . . . . . . . . . . . . . . . . . . . . . . . . . . . . . . . . . . . . . . . . . . . . . . . . . . . . . . . . . . . . . . . . . . . . . . . . . . . . . . . . . . . . . . . . . . . . . . . . . . . . . . . . . . . . . . . . . . . . .
 ché non pur ne’ miei occhi è paradiso»,Denn das Paradies ist nicht allein in meinen Augen.
" Come si vede qui alcuna volta l’affetto ne la vista, s’elli è tanto, che da lui sia tutta l’anima tolta, ","Wie man manchmal auf der Erde die Zuneigung im Blick sieht, wenn das so ist, dass die ganze Seele von ihm genommen wird,"
" così nel fiammeggiar del folgór santo, a ch’io mi volsi, conobbi la voglia in lui di ragionarmi ancora alquanto","Also erkannte ich in dem Licht des heiligen Lichtes, zu dem ich mich wandte, wie sehr sich der Selige noch wünschte, mit mir ein wenig zu reden."
 El cominciò,Er begann
" «In questa quinta soglia de l’albero che vive de la cima e frutta sempre e mai non perde foglia, ","In diesem fünften Himmel des Baumes, der Leben von oben empfängt, fruchtet er immer und verliert nie die Blätter,"
" spiriti son beati, che giù, prima che venissero al ciel, fuor di gran voce, sì ch’ogne musa ne sarebbe opima","Es gibt selige Geister, die auf der Erde, bevor sie starben, sehr berühmt waren, so dass sie große Musen sein könnten."
 Però mira ne’ corni de la croce,So schaut er in die seitlichen Arme des Kreuzes
" quello ch’io nomerò, lì farà l’atto che fa in nube il suo foco veloce»","der Geist, den ich ernennen werde, wird die Tat vollbringen, die in der Wolke den Blitz macht."
" Io vidi per la croce un lume tratto dal nomar Iosuè, com’ el si feo","Ich sah, daß, als ich Josua nannte, ein Licht durch das Kreuz emporging,"
 né mi fu noto il dir prima che ’l fatto,so daß das Hören und Sehen zur gleichen Zeit geschah
" E al nome de l’alto Macabeo vidi moversi un altro roteando, e letizia era ferza del paleo","Und im Namen des edlen Makkabäus sah ich ein anderes Licht bewegen sich auf sich selbst, und die Freude war die Peitsche, die die Kratzer bewegte."
" Così per Carlo Magno e per Orlando due ne seguì lo mio attento sguardo, com’ occhio segue suo falcon volando","Und auf die Namen Karls des Großen und Orlando folgte mein Blick zwei weiteren, wie das Auge, das dem Fluge seines Jägers folgte."
" Poscia trasse Guiglielmo e Rinoardo e ’l duca Gottifredi la mia vista per quella croce, e Ruberto Guiscardo","Dann lockten Wilhelm von Orange und Rinoardo und Goffredo von Buglione meinen Blick an dieses Kreuz, und so Roberto Guiscardo"
" Indi, tra l’altre luci mota e mista, mostrommi l’alma che m’avea parlato qual era tra i cantor del cielo artista","Und die Seele, die zu mir geredet hatte, kam zu mir und ward beweglich zu den andern Lichtern. Und die Seele, die zu mir geredet hatte, erwies sich mir als würdiger Künstler unter den Sängern des Himmels."
" Io mi rivolsi dal mio destro lato per vedere in Beatrice il mio dovere, o per parlare o per atto, segnato","Und ich wandte mich zu meiner Rechten, daß Beatrice mir meine Pflicht kundtun sollte in ihren Worten und Taten."
" e vidi le sue luci tanto mere, tanto gioconde, che la sua sembianza vinceva li altri e l’ultimo solere","Und ich sah seine Augen so glänzend und mit Freuden erfüllt, daß sein Aussehen alles, was er sonst hatte, und das Letzte, das ich gesehen hatte, in Schönheit überstieg."
" E come, per sentir più dilettanza bene operando, l’uom di giorno in giorno s’accorge che la sua virtute avanza, ","Und wie der Mensch, der mehr Freude fühlt, wenn er Gutes tut, spürt er von Tag zu Tag, daß er seine Tugend erhöht,"
" sì m’accors’ io che ’l mio girare intorno col cielo insieme avea cresciuto l’arco, veggendo quel miracol più addorno","Also erkannte ich, daß meine Drehung mit dem Himmel größer geworden war, da ich sah, daß die Schönheit Beatrices größer war."
" E qual è ’l trasmutare in picciol varco di tempo in bianca donna, quando ’l volto suo si discarchi di vergogna il carco, ","Und wie eine blassfarbene Frau ihr Aussehen schnell wiedererlangt, wenn ihr Gesicht die Rötung der Scham verliert,"
" tal fu ne li occhi miei, quando fui vòlto, per lo candor de la temprata stella sesta, che dentro a sé m’avea ricolto","Also war es in meinen Augen, als ich mich umdrehte, durch die Hitze des gehärteten sechsten Sternes, der mich in sich aufgenommen hatte."
 Io vidi in quella giovïal facella lo sfavillar de l’amor che lì era segnare a li occhi miei nostra favella,"Und ich sah im Stern des Jupiters die Seelen, die darin wohnten und glühten, und bildete Briefe, die vor meinen Augen sichtbar waren."
" E come augelli surti di rivera, quasi congratulando a lor pasture, fanno di sé or tonda or altra schiera, ","Und wie Vögel, die aus einem Fluss fliegen und sich fast gegenseitig über das Essen freuen, gruppieren sie sich in Kreis oder in irgendeiner anderen Form,"
" sì dentro ai lumi sante creature volitando cantavano, e faciensi or D, or I, or L in sue figure","Also sangen die heiligen Seelen in diesen Lichtern und sahen jetzt wie ein ""D,"" jetzt wie ein ""I"" oder ""L"" aus."
" Prima, cantando, a sua nota moviensi","Als sie sangen, bewegten sie sich zuerst im Rhythmus ihres Gesangs."
" poi, diventando l’un di questi segni, un poco s’arrestavano e taciensi",Und sie verwandelten sich in eines dieser Zeichen und hielten an und schweigten ein wenig.
" O diva Pegasëa che li ’ngegni fai glorïosi e rendili longevi, ","O göttliche Pegasea, die du die Gaben herrlich machst und sie langweilst,"
" ed essi teco le cittadi e ’ regni, ","und sie tun dasselbe durch dich mit Städten und Königreichen,"
" illustrami di te, sì ch’io rilevi le lor figure com’ io l’ho concette","Gib mir deine Inspiration, damit ich mich an diese Figuren erinnere, so wie ich sie gesehen habe."
 paia tua possa in questi versi brevi,leuchte in diesen wenigen Versen deine ganze Kraft
 Mostrarsi dunque in cinque volte sette vocali e consonanti,"Also zeigten sie sich in insgesamt 35 Buchstaben, zwischen Vokalen und Konsonanten"
" e io notai le parti sì, come mi parver dette","Und ich schrieb die Briefe geistlich auf, wie ich dachte, sie seien geschrieben."
" ‘DILIGITE IUSTITIAM’, primai fur verbo e nome di tutto ’l dipinto","""Liebt die Gerechtigkeit"" war das Wort und der Name, der zuerst erschienen war in der ganzen Gestalt."
" ‘QUI IUDICATIS TERRAM’, fur sezzai","""Ihr urteilt über die Erde"" waren die letzten"
 Poscia ne l’emme del vocabol quinto rimasero ordinate,"Später hörten sie auf im Emmen des fünften Wortes,"
 sì che Giove pareva argento lì d’oro distinto,so daß Jupiter von silberner Farbe ihre goldene Pracht hervorhob
" E vidi scendere altre luci dove era il colmo de l’emme, e lì quetarsi cantando, credo, il ben ch’a sé le move","Und ich sah noch mehr Lichter in den oberen Teil des ""M"" fallen und dort stehen, während sie sangen, glaube ich, zu Ehren Gottes, der sie zu sich zieht."
" Poi, come nel percuoter d’i ciocchi arsi surgono innumerabili faville, onde li stolti sogliono agurarsi, ","Und wenn man die glühenden Schnürsenkel schlägt, so erheben sich viele Facetten, von denen sich die Narren gewöhnlich wünschen,"
" resurger parver quindi più di mille luci e salir, qual assai e qual poco, sì come ’l sol che l’accende sortille","Es schien, als würden mehr als tausend Lichter aufstehen, einige mehr und andere weniger, je nachdem, wie die Sonne sie erleuchtet hatte."
" e quïetata ciascuna in suo loco, la testa e ’l collo d’un’aguglia vidi rappresentare a quel distinto foco","Und ich sah, daß jede, wenn sie an der Stelle blieb, den Kopf und den Hals eines Adlers bildete in der Pracht, die sich abstreckte."
" Quei che dipinge lì, non ha chi ’l guidi","Der da malt, hat nicht, wer ihn führt,"
" ma esso guida, e da lui si rammenta quella virtù ch’è forma per li nidi","aber er selbst führt, und von ihm erkennt man jene Tugend, die für die Wesen in den Nestern geformt ist."
" L’altra bëatitudo, che contenta pareva prima d’ingigliarsi a l’emme, con poco moto seguitò la ’mprenta","Die anderen Lichter der Seligen, die vor schienen, die heraldische Lilie aus dem 'M' zu bilden, mit kleinen Bewegungen vervollständigten die Figur des Adlers"
" O dolce stella, quali e quante gemme mi dimostraro che nostra giustizia effetto sia del ciel che tu ingemme","O süßer Stern, welche und wie viele Edelsteine mir bewies, daß unsere menschliche Gerechtigkeit aus dem Himmel hervorging, den du verziert hast"
" Per ch’io prego la mente in che s’inizia tuo moto e tua virtute, che rimiri ond’ esce il fummo che ’l tuo raggio vizia","Darum bitte ich den Verstand, in dem deine Tugend und dein Motorrad beginnen, zu beobachten, woher der Rauch kommt, der deinen Strahl verdunkelt."
 sì ch’un’altra fïata omai s’adiri del comperare e vender dentro al templo che si murò di segni e di martìri,"auf daß er zornig werde ein andermal auf dem Markt im Tempel, der mit Wundern und Märtyrertaten gebaut war."
" O milizia del ciel cu’ io contemplo, adora per color che sono in terra tutti svïati dietro al malo essemplo","O himmlische Armee, die ich schaue, bete für diejenigen, die auf Erden vom schlechten Beispiel der Päpste irregeführt werden"
 Già si solea con le spade far guerra,Früher kämpfte man gewöhnlich mit Schwertern.
 ma or si fa togliendo or qui or quivi lo pan che ’l pïo Padre a nessun serra,"Nun aber tut er, indem er dies und jenes das Brot wegnimmt, das Gott niemand verleugnet."
" Ma tu che sol per cancellare scrivi, pensa che Pietro e Paulo, che moriro per la vigna che guasti, ancor son vivi","Du aber, der du nur schreibst, um auszutilgen, denkst, daß der hl. Petrus und Paulus, die um des Weinberges willen starben, den du verderbst, noch am Leben sind."
 Ben puoi tu dire,Natürlich kannst du das sagen.
" «I’ ho fermo ’l disiro sì a colui che volle viver solo e che per salti fu tratto al martiro, ","Ich will nur den, der in der Wüste leben wollte und mit einem Tanz zum Martyrium geführt wurde,"
 ch’io non conosco il pescator né Polo»,damit ich weder den Fischer noch Polo kenne.
 Parea dinanzi a me con l’ali aperte la bella image che nel dolce frui liete facevan l’anime conserte,"Das schöne Bild, das die Seelen in der sanften Vision Gottes gebildet hatten, erschien mir mit ausgebreiteten Flügeln vor Augen."
" parea ciascuna rubinetto in cui raggio di sole ardesse sì acceso, che ne’ miei occhi rifrangesse lui","jede Seele sah aus wie ein Rubin, der von einem Sonnenstrahl getroffen wurde, der so glänzend war, daß er sein Licht in meinen Augen reflektierte."
" E quel che mi convien ritrar testeso, non portò voce mai, né scrisse incostro, né fu per fantasia già mai compreso","Und was ich jetzt beschreiben soll, wurde nie mit der Stimme gesprochen, noch mit Tinte geschrieben, noch von der menschlichen Fantasie gezeugt."
" ch’io vidi e anche udi’ parlar lo rostro, e sonar ne la voce e «io» e «mio», quand’ era nel concetto e ‘noi’ e ‘nostro’","Denn ich sah und hörte auch den Schnabel des Adlers, der redete und mit seiner Stimme redete, und er sprach mit seiner Stimme, nämlich mit uns und mit uns."
 E cominciò,Und es begann
 «Per esser giusto e pio son io qui essaltato a quella gloria che non si lascia vincere a disio,"Um gerecht und gottesfürchtig zu sein, bin ich hier zu jener Herrlichkeit erhöht, die nicht von sterblichen Begierden besiegt wird."
" e in terra lasciai la mia memoria sì fatta, che le genti lì malvage commendan lei, ma non seguon la storia»","Und auf der Erde hinterließ ich eine solche Erinnerung, daß sogar die bösen Menschen ihn preisen, auch wenn sie ihm nicht folgen."
" Così un sol calor di molte brage si fa sentir, come di molti amori usciva solo un suon di quella image","Wie aus vielen Braten eine einzige Wärme hervorging, so kam aus den vielen Seelen dieser Fantasie ein einziger Klang hervor"
 Ond’ io appresso,Also sagte ich:
" «O perpetüi fiori de l’etterna letizia, che pur uno parer mi fate tutti vostri odori, ","Ewige Blumen der ewigen Seligkeit, die ihr mich alle, die sie ausstrahlen, zu einem einzigen Geruch macht,"
" solvetemi, spirando, il gran digiuno che lungamente m’ha tenuto in fame, non trovandoli in terra cibo alcuno","laßt mit dem Hauch eurer Stimme das schwere Fasten, das mich lange Zeit verhungert hat, und findet keine Speise auf der Erde, um sie zu sättigen."
" Ben so io che, se ’n cielo altro reame la divina giustizia fa suo specchio, che ’l vostro non l’apprende con velame","Ich weiß wohl, daß sich die göttliche Gerechtigkeit im Himmel in einer anderen Engelshierarchie spiegelt, aber euer Himmel sieht sie ohne Hindernisse."
 Sapete come attento io m’apparecchio ad ascoltar,"Ihr wisst, wie ich bereit bin, aufmerksam zuzuhören"
 sapete qual è quello dubbio che m’è digiun cotanto vecchio»,"Wisst ihr, was dieses lange Fasten in alter Zeit verursacht hat?"
" Quasi falcone ch’esce del cappello, move la testa e con l’ali si plaude, voglia mostrando e faccendosi bello, ","Wie ein Falke, wenn er sich von der Kapuze befreit, bewegt er seinen Kopf und schlägt seine Flügel und zeigt den Wunsch zu fliegen und macht sich schön,"
" vid’ io farsi quel segno, che di laude de la divina grazia era contesto, con canti quai si sa chi là sù gaude","Also sah ich den Adler tun, der aus dem Lob der göttlichen Gnade bestand, und sang, daß nur wer da oben ist, verstehen kann."
 Poi cominciò,Dann fing es an.
" «Colui che volse il sesto a lo stremo del mondo, e dentro ad esso distinse tanto occulto e manifesto, ","Der die Grenzen des Universums durchdrungen und darin die sichtbaren und unsichtbaren Dinge unterschieden hat,"
" non poté suo valor sì fare impresso in tutto l’universo, che ’l suo verbo non rimanesse in infinito eccesso","Er konnte seinen Wert nicht überall anlegen, ohne daß sein Wort unendlich über den menschlichen Fähigkeiten bliebe."
" E ciò fa certo che ’l primo superbo, che fu la somma d’ogne creatura, per non aspettar lume, cadde acerbo","Und das ist ein Beweis dafür, daß der erste Sünder des Hochmuts, der die vollkommenste aller Geschöpfe war, aus dem Himmel geworfen wurde, weil er nicht auf das Licht der göttlichen Gnade gewartet hatte."
 e quinci appar ch’ogne minor natura è corto recettacolo a quel bene che non ha fine e sé con sé misura,"Und von hier aus wird man verstehen, daß jedes Geschöpf, das ihm unterlegen ist, nicht in sich das Gute enthalten kann, das keine Grenzen hat, und es ist das einzige Maß an sich selbst."
" Dunque vostra veduta, che convene esser alcun de’ raggi de la mente di che tutte le cose son ripiene, ","Darum eure Sehkraft, die nichts anderes ist als eine der Strahlen des Verstandes Gottes, die in allen Dingen vorhanden ist,"
" non pò da sua natura esser possente tanto, che suo principio discerna molto di là da quel che l’è parvente","kann von Natur aus nicht so stark sein, sein Prinzip zu sehen, das weit über die Fähigkeiten seiner Sinne hinausgeht"
" Però ne la giustizia sempiterna la vista che riceve il vostro mondo, com’ occhio per lo mare, entro s’interna",Darum dringt das empfindliche Sehvermögen der Menschen in die göttliche Gerechtigkeit ein wie das Auge im Meer.
" che, ben che da la proda veggia il fondo, in pelago nol vede","und er, wenn er vom Ufer aus den Grund sieht, sieht ihn nicht mehr auf hoher See."
" e nondimeno è li, ma cela lui l’esser profondo","Und gewiß, er ist da, aber die Tiefe verbirgt ihn."
" Lume non è, se non vien dal sereno che non si turba mai","Es gibt kein wahres Licht für den menschlichen Verstand, wenn es nicht aus jener Ruhe kommt, die nie verschwommen ist"
 anzi è tenèbra od ombra de la carne o suo veleno,"jeder andere ist dunkel, oder verwöhnt von den Sinnen, oder lockt zum Irrtum"
" Assai t’è mo aperta la latebra che t’ascondeva la giustizia viva, di che facei question cotanto crebra","Nun ist dir die Höhle geöffnet, die die göttliche Gerechtigkeit vor dir verborgen hat, die in dir große Zweifel weckte."
 ché tu dicevi,Denn du hast gesagt:
" “Un uom nasce a la riva de l’Indo, e quivi non è chi ragioni di Cristo né chi legga né chi scriva","""Ein Mensch wird an den Ufern des Indus geboren, und hier spricht oder lehrt oder schreibt über Christus"
" e tutti suoi voleri e atti buoni sono, quanto ragione umana vede, sanza peccato in vita o in sermoni","aber alle seine Begierden und seine Gesten sind tugendhaft, so viel die menschliche Vernunft richten kann, ohne Sünde in Taten oder Worten."
 Muore non battezzato e sanza fede,Er stirbt ohne Taufe und ohne Glauben
 ov’ è questa giustizia che ’l condanna? ,Welche Gerechtigkeit verurteilt ihn?
" ov’ è la colpa sua, se ei non crede?”","Was ist Ihre Schuld, wenn Sie nicht glauben?"
" Or tu chi se’, che vuo’ sedere a scranna, per giudicar di lungi mille miglia con la veduta corta d’una spanna? ","""Wer bist du jetzt, der dich zum Richter erheben und tausend Meilen entfernt ein Urteil fällen will, mit dem Anblick, der kaum zu einer Spanne führt?"
" Certo a colui che meco s’assottiglia, se la Scrittura sovra voi non fosse, da dubitar sarebbe a maraviglia","Gewiß, der Unvernünftige, der über mich redet, mag auf erstaunliche Weise zweifeln, wenn die Heilige Schrift nicht über euch wäre."
 Oh terreni animali,"Oh, irdische Kreaturen"
 oh menti grosse,"Oh, du fetter Idiot."
" La prima volontà, ch’è da sé buona, da sé, ch’è sommo ben, mai non si mosse","Der erste Wille, der an sich gut ist, hat sich nie von sich selbst bewegt, der der höchste ist, der gut ist."
 Cotanto è giusto quanto a lei consuona,"Alles, was damit übereinstimmt, ist richtig."
" nullo creato bene a sé la tira, ma essa, radïando, lui cagiona»","kein erschaffenes Gut zieht es zu sich, aber es ist es, die Begnadigung, die es bestimmt,"
" Quale sovresso il nido si rigira poi c’ha pasciuti la cicogna i figli, e come quel ch’è pasto la rimira","Wie der Storch, nachdem er seine Jungen ernährt hatte, fliegt er über das Nest und wie die Storchs, die es gegessen haben, sie beobachten,"
" cotal si fece, e sì leväi i cigli, la benedetta imagine, che l’ali movea sospinte da tanti consigli","Also tat er das heilige Bild, das die Flügel bewegte von vielen Seligen, und ich schaute auf sie."
" Roteando cantava, e dicea",Er drehte sich um und sang und sagte:
" «Quali son le mie note a te, che non le ’ntendi, tal è il giudicio etterno a voi mortali»","Wie du den Gesang, den ich dir singe, nicht verstehst, so ist das göttliche Gericht euch Sterblichen nicht zu erkennen."
" Poi si quetaro quei lucenti incendi de lo Spirito Santo ancor nel segno che fé i Romani al mondo reverendi, esso ricominciò","Nachdem jene heiligen Lichter, voll des Heiligen Geistes, stehengeblieben waren und wiederkamen, um das Zeichen darzustellen, das die Römer der Welt würdig gemacht hatte, fing es wieder an."
" «A questo regno non salì mai chi non credette ’n Cristo, né pria né poi ch’el si chiavasse al legno","In diesem Königreich ist niemand aufgefahren, der nicht an Christus geglaubt hat vor oder nach seiner Kreuzigung."
 Ma vedi,Aber siehst du?
" molti gridan “Cristo, Cristo”, ","Viele schreien ""Christus, Christus,"""
"che saranno in giudicio assai men prope a lui, che tal che non conosce Cristo","Und der Tag des Gerichts wird ihm viel weniger nahe sein als denen, die ihn nie kennengelernt haben."
" e tai Cristian dannerà l’Etïòpe, quando si partiranno i due collegi, l’uno in etterno ricco e l’altro inòpe","und diese Christen werden von dem Äthiopier verdammt werden, wenn die zwei Heerscharen geteilt werden, eine ewiglich reich und die andere armselig."
