Original,Translate_de_1
" Troppo sarebbe larga la bigoncia che ricevesse il sangue ferrarese, e stanco chi ’l pesasse a oncia a oncia, ","Zu groß sollte das Gefäß sein, das das ganze Ferrarablut enthielt, und wer es genau wiegen würde, wäre müde."
 che donerà questo prete cortese per mostrarsi di parte,"das Blut, das dieser höfliche Priester vergießt, um seine Treue zu seiner Partei zu zeigen"
 e cotai doni conformi fieno al viver del paese,und diese Gaben sollen den Sitten der Erde entsprechen.
" Sù sono specchi, voi dicete Troni, onde refulge a noi Dio giudicante","Oben sind Spiegel, die ihr Throne nennt, von wo aus Gott, der richtet, uns leuchtet."
 sì che questi parlar ne paion buoni»,Diese Reden scheinen uns also gerecht zu sein.
 Qui si tacette,Zu diesem Zeitpunkt schwieg er.
" e fecemi sembiante che fosse ad altro volta, per la rota in che si mise com’ era davante","Und er zeigte mir, daß er sich zu einem andern wandte; denn er fing wieder an, zu tanzen, wie er zuvor getanzt hatte."
" L’altra letizia, che m’era già nota per cara cosa, mi si fece in vista qual fin balasso in che lo sol percuota","Der andere freudige Geist, der mir schon als eine kostbare Seele dargestellt worden war, zeigte sich mir wie ein feiner Rubin, der vom Licht der Sonne getroffen war."
" Per letiziar là sù fulgor s’acquista, sì come riso qui","Im Paradies wird man glänzen, wenn man glücklich ist, wie auf der Erde, wenn man lacht."
" ma giù s’abbuia l’ombra di fuor, come la mente è trista","Aber in der Hölle schwindet der Schatten draußen, gleichwie der Verstand betrübt ist."
" «Dio vede tutto, e tuo veder s’inluia», diss’ io, ","""Gott sieht alles, und dein Anblick wird in Ihm zusammenbrechen,"" sagte ich."
" «beato spirto, sì che nulla voglia di sé a te puot’ esser fuia","O seliger Geist, so daß dir kein Begehren entgehen kann."
" Dunque la voce tua, che ’l ciel trastulla sempre col canto di quei fuochi pii che di sei ali facen la coculla, ","Deine Stimme, die den Himmel immer mit dem Gesang jener Engel erfreut, die mit sechs Flügeln umgeben sind,"
 perché non satisface a’ miei disii? ,Warum erhören Sie nicht meine Wünsche?
" Già non attendere’ io tua dimanda, s’io m’intuassi, come tu t’inmii»","Ich würde nicht warten, bis du sprichst, wenn ich in dich eindringen könnte, so wie du es in mir tun könntest."
" «La maggior valle in che l’acqua si spanda», incominciaro allor le sue parole, ","""Die größte Beute, in die sich das Wasser ausgießt, fing an zu reden,"
" «fuor di quel mar che la terra inghirlanda, tra ’ discordanti liti contra ’l sole tanto sen va, ","aus dem Meer, das das Land umgibt, es breitet sich nach Osten zwischen den gegensätzlichen Gärten aus."
 che fa meridïano là dove l’orizzonte pria far suole,"die da, wo sie zuerst einen Horizont hat, Meridian machen"
" Di quella valle fu’ io litorano tra Ebro e Macra, che per cammin corto parte lo Genovese dal Toscano","Ich wurde an der Küste jener Überfahrt geboren, zwischen den Flüssen Ebro und Magra, die für einen kurzen Abschnitt Ligurien von der Toskana trennt"
" Ad un occaso quasi e ad un orto Buggea siede e la terra ond’ io fui, che fé del sangue suo già caldo il porto","Die Stadt Buggea und die Stadt, wo sie geboren wurde, die viel Blut in den Hafen goß, haben fast dieselbe Morgendämmerung und denselben Horizont."
 Folco mi disse quella gente a cui fu noto il nome mio,"Die mich kennenlernten, nannten mich Folco."
" e questo cielo di me s’imprenta, com’ io fe’ di lui","und dieser Himmel leuchtet von meinem Licht, wie ich leuchtete von seinem."
" ché più non arse la figlia di Belo, noiando e a Sicheo e a Creusa, di me, infin che si convenne al pelo","Denn die Tochter Belos, die Kreusa und Sichäus gekränkt hatte, brannte nicht mehr mit Liebe als ich, bis ich jung war."
" né quella Rodopëa che delusa fu da Demofoonte, né Alcide quando Iole nel core ebbe rinchiusa","Und sie brannten nicht mit Liebe die Rhodope Philide, die von Demophoon verlassen wurde, noch der Alkide, da er in Iole verliebt war."
" Non però qui si pente, ma si ride, ","Aber hier bereut man das nicht, sondern freut sich."
" non de la colpa, ch’a mente non torna, ma del valor ch’ordinò e provide","nicht der Schuld, deren Erinnerung in uns ausgelöscht ist, sondern der göttlichen Tugend, die er bestimmt und bereitete dies"
" Qui si rimira ne l’arte ch’addorna cotanto affetto, e discernesi ’l bene per che ’l mondo di sù quel di giù torna","Hier im Paradies wird die göttliche Schöpfungskunst betrachtet, die die Liebe Gottes verschönert und das Vorsehungsziel hervorhebt, für das der Himmel die irdische Welt formt"
" Ma perché tutte le tue voglie piene ten porti che son nate in questa spera, proceder ancor oltre mi convene","Damit aber alle Begierden des Wissens, die in dir geboren sind in diesem Himmel, vollkommen erfüllt werden, so muß ich dir noch etwas anderes sagen."
 Tu vuo’ saper chi è in questa lumera che qui appresso me così scintilla come raggio di sole in acqua mera,"Du willst wissen, wer in diesem Licht ist, das neben mir strahlt, so dass es wie ein Sonnenstrahl in einem kristallklaren Wasser aussieht."
 Or sappi che là entro si tranquilla Raab,"Jetzt sollst du wissen, dass Rahab dort Frieden genießt."
" e a nostr’ ordine congiunta, di lei nel sommo grado si sigilla",Und zusammen mit unserem Himmel empfängt er den Abdruck von ihr in höchstem Grade.
" Da questo cielo, in cui l’ombra s’appunta che ’l vostro mondo face, pria ch’altr’ alma del trïunfo di Cristo fu assunta","Und es ward angenommen von diesem Himmel, da der Schattenkegel, der von der Erde gesproßt wurde, vor allen anderen Seelen durch den Triumph Christi endete."
" Ben si convenne lei lasciar per palma in alcun cielo de l’alta vittoria che s’acquistò con l’una e l’altra palma, ","Es war gerecht, sie im Himmel als Symbol für den großen Sieg zu lassen, den man durch die Kreuzigung Christi erlangte,"
" perch’ ella favorò la prima gloria di Iosüè in su la Terra Santa, che poco tocca al papa la memoria","weil sie den ersten militärischen Sieg Josuas auf der Erde gewann, an den sich der Papst heute zu wenig erinnert"
" La tua città, che di colui è pianta che pria volse le spalle al suo fattore e di cui è la ’nvidia tanto pianta, ","deine Stadt, die von dem stammt, der zuerst gegen Gott rebellierte und deren Neid so viel Leid verursacht,"
" produce e spande il maladetto fiore c’ha disvïate le pecore e li agni, però che fatto ha lupo del pastore","und zerstreut den verdammten Blümchen, der das ganze christliche Volk irregeführt hat, indem er den Hirten in einen Wolf verwandelt hat."
" Per questo l’Evangelio e i dottor magni son derelitti, e solo ai Decretali si studia, sì che pare a’ lor vivagni","Deshalb werden das Evangelium und die Bücher der Kirchenväter vernachlässigt, und nur die Decretalen werden gelesen, wie es aus ihren schmalen Rändern hervorgeht."
 A questo intende il papa e ’ cardinali,Der Papst und die Kardinäle denken nur daran
" non vanno i lor pensieri a Nazarette, là dove Gabrïello aperse l’ali","Und ihre Gedanken gehen nicht nach Nazareth, da der Erzengel Gabriel seine Flügel öffnete."
" Ma Vaticano e l’altre parti elette di Roma che son state cimitero a la milizia che Pietro seguette, ","Doch der Vatikan und die anderen heiligen Stätten Roms, die das Martyrium der ersten Christen, die Petrus folgten, sahen,"
 tosto libere fien de l’avoltero»,Sie werden bald frei sein von dieser Entweihung.
" Guardando nel suo Figlio con l’Amore che l’uno e l’altro etternalmente spira, lo primo e ineffabile Valore quanto per mente e per loco si gira con tant’ ordine fé, ","Die erste und unsägliche Kraft, die den Sohn mit dem Heiligen Geist ansah, der von beiden ewig atmet, schuf die harmonische Bewegung des Himmels so vollkommen"
 ch’esser non puote sanza gustar di lui chi ciò rimira,"das man ihn nicht bewundern kann, ohne das göttliche Bild zu genießen"
" Leva dunque, lettore, a l’alte rote meco la vista, dritto a quella parte dove l’un moto e l’altro si percuote","Also, du Leser, hebe deinen Blick mit mir auf die himmlischen Sphären, auf diesen Punkt, wo sich die beiden entgegengesetzten Bewegungen schneiden."
" e lì comincia a vagheggiar ne l’arte di quel maestro che dentro a sé l’ama, tanto che mai da lei l’occhio non parte","und fängt an, dort das Kunstwerk des Künstlers zu bewundern, der es in sich liebt, bis daß er seinen Blick nie von ihm abwendet."
" Vedi come da indi si dirama l’oblico cerchio che i pianeti porta, per sodisfare al mondo che li chiama","Sehen Sie, wie sich der Zodiakus von dort unterscheidet, der die Planeten mit sich bringt, um die Anforderungen der Erde zu erfüllen, die sie anruft"
" Che se la strada lor non fosse torta, molta virtù nel ciel sarebbe in vano, e quasi ogne potenza qua giù morta","Denn wenn seine Bahn gegenüber dem himmlischen Äquator nicht schräg wäre, wären viele astrale Einflüsse nutzlos, und hier auf der Erde würde jedes Potential der Natur untätig bleiben."
" e se dal dritto più o men lontano fosse ’l partire, assai sarebbe manco e giù e sù de l’ordine mondano","und wenn die Divergenz größer oder kleiner wäre, wäre die Weltordnung in beiden Hemisphären sehr fehl am Platze."
" Or ti riman, lettor, sovra ’l tuo banco, dietro pensando a ciò che si preliba, s’esser vuoi lieto assai prima che stanco","Jetzt bleib, Leser, über deinen Tisch und denke an das, was ich dir sage und was er vorhersagt, wenn du dich freuen willst, bevor du müde bist."
 Messo t’ho innanzi,Ich hab dir die Speisen vor die Nase gelegt.
 omai per te ti ciba,Jetzt musst du allein essen.
 ché a sé torce tutta la mia cura quella materia ond’ io son fatto scriba,"Denn diese Materie, die ich zu transkribieren rufe, zieht meine ganze Aufmerksamkeit zu sich."
" Lo ministro maggior de la natura, che del valor del ciel lo mondo imprenta e col suo lume il tempo ne misura, ","Der größte Naturminister, der seinen wohltuenden Einfluss auf die Erde ausbreitet und mit seinem Licht die Zeit misst,"
" con quella parte che sù si rammenta congiunto, si girava per le spire in che più tosto ognora s’appresenta","Zusammen mit dem Punkt, den ich vorhin gesagt habe, drehte er sich in dieser Spirale, in der jeden Tag etwas früher aufsteigt"
 e io era con lui,Und ich war bei ihm.
" ma del salire non m’accors’ io, se non com’ uom s’accorge, anzi ’l primo pensier, del suo venire","Aber ich merkte nicht, daß ich aufgefahren war, es sei denn wie der, der einen plötzlichen Gedanken merkt, nachdem er erschienen ist."
" È Bëatrice quella che sì scorge di bene in meglio, sì subitamente che l’atto suo per tempo non si sporge","Beatrice führt von einem Himmel zum oberen so schnell, dass ihre Handlung praktisch sofort"
" Quant’ esser convenia da sé lucente quel ch’era dentro al sol dov’ io entra’mi, non per color, ma per lume parvente","Die Lichter der Seligen, die im Himmel der Sonne waren, sollten wirklich glänzend sein, denn ich habe sie unterschieden, obwohl sie nicht von einer anderen Farbe waren."
" Perch’ io lo ’ngegno e l’arte e l’uso chiami, sì nol direi che mai s’imaginasse","So sehr ich meinen Verstand, meine Kunst und meine Erfahrung anrufe, könnte ich das nicht beschreiben, um eine vollendete Idee daraus zu machen."
 ma creder puossi e di veder si brami,"Aber man kann glauben, und man muß ihn sehen wollen."
" E se le fantasie nostre son basse a tanta altezza, non è maraviglia","Und wenn unsere Sprache für so eine hohe Materie so ungeeignet ist, darf man sich nicht wundern"
 ché sopra ’l sol non fu occhio ch’andasse,Denn kein menschliches Auge hat je ein helleres Licht gesehen als das der Sonne.
" Tal era quivi la quarta famiglia de l’alto Padre, che sempre la sazia, mostrando come spira e come figlia","So erschien hier die vierte Schar der Seligen, die der Vater satt machte und ihm das Geheimnis der Dreifaltigkeit zeigte."
 E Bëatrice cominciò,Und Beatrice begann
" «Ringrazia, ringrazia il Sol de li angeli, ch’a questo sensibil t’ha levato per sua grazia»","""Danke, danke der Engelsonne, die dich durch ihre Gnade zu dieser materiellen Sonne erhoben hat."""
" Cor di mortal non fu mai sì digesto a divozione e a rendersi a Dio con tutto ’l suo gradir cotanto presto, ","Das Herz eines Menschen war noch nie so gut zur Hingabe bereit und so bereit, sich Gott mit all seiner Dankbarkeit zuzuwenden,"
 come a quelle parole mi fec’ io,wie ich zu diesen Worten war
" e sì tutto ’l mio amore in lui si mise, che Bëatrice eclissò ne l’oblio","Und meine Liebe wandte sich zu ihm so sehr, daß er die Beatrice völlig vergaß."
 Non le dispiacque,Es hat ihr nicht leid getan.
" ma sì se ne rise, che lo splendor de li occhi suoi ridenti mia mente unita in più cose divise","sondern er lächelte, bis daß die Pracht seiner freudigen Augen meinen Sinn verführte, sich zu teilen zwischen mehren Dingen."
" Io vidi più folgór vivi e vincenti far di noi centro e di sé far corona, più dolci in voce che in vista lucenti","Ich sah mehrere helle und strahlende Lichter mehr als die Sonne uns umgeben wie eine Krone, deren Mittelpunkt wir waren, die sangen sanfter, als sie leuchteten."
" così cinger la figlia di Latona vedem talvolta, quando l’aere è pregno, sì che ritenga il fil che fa la zona","So sehen wir manchmal den Mond umgeben von einem Flügel, wenn die Luft feucht ist und den Mondstrahl hält, der ein Band bildet."
" Ne la corte del cielo, ond’ io rivegno, si trovan molte gioie care e belle tanto che non si posson trar del regno","Am Hofe des Paradieses, von dem ich zurückkomme, sind viele schöne und kostbare Juwelen zu finden, so daß man sie nicht von diesem Königreich nehmen kann."
 e ’l canto di quei lumi era di quelle,Und das Gesang dieser Lichter war einer dieser Juwelen.
" chi non s’impenna sì che là sù voli, dal muto aspetti quindi le novelle","Wer nicht fliegen kann, der erwartet nicht, daß ich ihn beschreibe wie ein Stummkopf, der kann die Nachricht nicht bringen."
" Poi, sì cantando, quelli ardenti soli si fuor girati intorno a noi tre volte, ","Nachdem die glühenden Sonnen drei Runden gesungen hatten,"
" come stelle vicine a’ fermi poli, donne mi parver, non da ballo sciolte, ma che s’arrestin tacite, ","Als Sterne in der Nähe der Himmelspole schienen sie mir wie Frauen, die noch tanzen und schweigen,"
 ascoltando fin che le nove note hanno ricolte,"Zuhören, bis sie die Musik gehört haben, die den Ball filmt"
 E dentro a l’un senti’ cominciar,Und in einem dieser Lichter hörte ich sagen:
" «Quando lo raggio de la grazia, onde s’accende verace amore e che poi cresce amando, multiplicato in te tanto resplende, ","Denn der Strahl der göttlichen Gnade, aus dem sich die wahre Liebe entzündet, die dann, wenn sie liebt, weiter wächst und in dir leuchtet,"
 che ti conduce su per quella scala u’ sanza risalir nessun discende,"Denn er führt dich hinauf auf die Leiter, von der niemand hinabkommt, ohne daß er hinaufkommt."
" qual ti negasse il vin de la sua fiala per la tua sete, in libertà non fora se non com’ acqua ch’al mar non si cala","Wenn dir jemand den Wein seiner Ampulle verleugnet, um deinen Durst zu stillen, so würde er nicht in Freiheit handeln wie ein Wasser, das nicht vom Berge bis ans Meer hinabsteigen würde."
 Tu vuo’ saper di quai piante s’infiora questa ghirlanda che ’ntorno vagheggia la bella donna ch’al ciel t’avvalora,"Du willst wissen, aus welchen Blumen dieser Kranz gebildet ist, der um die schöne Frau schaut, die dich zum Himmel führt."
 Io fui de li agni de la santa greggia che Domenico mena per cammino u’ ben s’impingua se non si vaneggia,"Ich war einer der Lämmer der heiligen Herde, die der hl. Dominikus auf dem Weg führt, wo man sich mit geistiger Habe bereichert, wenn man nicht von der Regel abirrt."
" Questi che m’è a destra più vicino, frate e maestro fummi, ","Und er war ein Bruder zu meiner Rechten, und er war mein Meister."
" ed esso Alberto è di Cologna, e io Thomas d’Aquino","und das ist Alberto der Große von Köln, und ich bin Thomas von Aquin"
" Se sì di tutti li altri esser vuo’ certo, di retro al mio parlar ten vien col viso girando su per lo beato serto","Wenn du die Namen aller anderen wissen willst, so folge meinen Worten, indem du deinen Blick durch die Lichter dieser seligen Krone fliegst."
" Quell’ altro fiammeggiare esce del riso di Grazïan, che l’uno e l’altro foro aiutò sì che piace in paradiso","Das andere flammende Licht wird durch das Lächeln von Franz Grazian erzeugt, das dem einen und dem anderen Gesetz so half, daß es dem Paradies gefällt."
" L’altro ch’appresso addorna il nostro coro, quel Pietro fu che con la poverella offerse a Santa Chiesa suo tesoro","Der andere, der nach ihm unser Heer schmückte, war der Petrus Lombardo, der der Heiligen Kirche alles, was er hatte, als die Arme des Evangeliums darbrachte."
" La quinta luce, ch’è tra noi più bella, spira di tale amor, che tutto ’l mondo là giù ne gola di saper novella","Das fünfte Licht, das das schönste unter uns ist, atmet von einer solchen Liebe, daß die ganze Welt sein Schicksal kennenlernen möchte"
" entro v’è l’alta mente u’ sì profondo saver fu messo, che, se ’l vero è vero, a veder tanto non surse il secondo","darin ist der hohe Verstand, wo solch ein tiefes Wissen ward, daß, wenn die Schrift die Wahrheit sagt, es keinen weiseren Menschen gab als ihn."
 Appresso vedi il lume di quel cero che giù in carne più a dentro vide l’angelica natura e ’l ministero,"In der Nähe siehst du das Licht des Kerls, der, als er noch lebte, die Natur und die Funktion der Engel mehr sah als alle anderen."
 Ne l’altra piccioletta luce ride quello avvocato de’ tempi cristiani del cui latino Augustin si provide,"Im anderen kleinen Licht lacht jener Anwalt aus christlicher Zeit, dessen Werk in Latein der heilige Augustinus benutzte"
" Or se tu l’occhio de la mente trani di luce in luce dietro a le mie lode, già de l’ottava con sete rimani","Wenn du nun das Auge deines Sinnes nach meinen Worten aus Licht strömst, so sollst du herausfinden, wer das achte Licht ist."
 Per vedere ogne ben dentro vi gode l’anima santa che ’l mondo fallace fa manifesto a chi di lei ben ode,"In ihr ist die heilige Seele, die zeigt, daß die Welt dem, der seine Werke gut liest, missfällt; denn sie sieht nun den höchsten Guten."
 Lo corpo ond’ ella fu cacciata giace giuso in Cieldauro,"Der Körper, von dem sie zerrissen wurde, liegt auf der Erde in der Basilika San Pietro in Ciel d'Oro"
 ed essa da martiro e da essilio venne a questa pace,und seine Seele kam zu diesem Frieden vom Martyrium und vom irdischen Exil
" Vedi oltre fiammeggiar l’ardente spiro d’Isidoro, di Beda e di Riccardo, che a considerar fu più che viro","Und siehst du den brennenden Geist Isidors von Sevilla, des Ehrwürdigen Beda, des Heiligen Siegers von Riccardo, der in Gottes Kontemplation mehr war als ein Mensch?"
" Questi onde a me ritorna il tuo riguardo, è ’l lume d’uno spirto che ’n pensieri gravi a morir li parve venir tardo","Und diese, von welchem dein Blick auf mich zurückkehrt, ist das Licht eines Geistes, der von schweren Gedanken bedrückt war, so daß der Tod ihm zu spät schien."
" essa è la luce etterna di Sigieri, che, leggendo nel Vico de li Strami, silogizzò invidïosi veri»","Es ist das ewige Licht der Sieger von Brabant, die, indem sie lehrten auf dem ""Weg des Strohs"" in Paris, bewies die Wahrheiten der Lehre, die ihn beneiden."
" Indi, come orologio che ne chiami ne l’ora che la sposa di Dio surge a mattinar lo sposo perché l’ami, ","An diesem Punkt wie eine Uhr, die sie in der Stunde, in der sich die Kirche erhebt, aufruft, den Morgen Christus zu beten, damit er sie noch liebt,"
" che l’una parte e l’altra tira e urge, tin tin sonando con sì dolce nota, che ’l ben disposto spirto d’amor turge","in dem eine Seite zieht und die andere schiebt, so süß, dass sie füllt mit Liebe den Geist gut eingestellt"
 così vid’ ïo la gloriosa rota muoversi e render voce a voce in tempra e in dolcezza ch’esser non pò nota se non colà dove gioir s’insempra,"Also sah ich die herrliche Krone der Geister bewegen und singen mit einer Harmonie und einer Melodie so süß, daß man sie nicht verstehen kann, es sei denn im Paradies, wo die Freude ewig wird."
" O insensata cura de’ mortali, quanto son difettivi silogismi quei che ti fanno in basso batter l’ali","O verrücktes Verlangen der Menschen, wie fehl am Platze sind die Überlegungen, die dich veranlassen, dich nach unten zu wenden"
" Chi dietro a iura e chi ad amforismi sen giva, e chi seguendo sacerdozio, e chi regnar per forza o per sofismi, ","Wer das Recht studierte, wer die Mediziner, wer sich dem Priestertum widmete, wer versuchte, mit Gewalt oder Täuschung zu regieren,"
" e chi rubare e chi civil negozio, chi nel diletto de la carne involto s’affaticava e chi si dava a l’ozio, quando, ","Wer stiehlt, wer sich den politischen Angelegenheiten widmete, wer sich zu den fleischlichen Vergnügungen hingab, wer zu den Unvernünftigen, wenn ich,"
" da tutte queste cose sciolto, con Bëatrice m’era suso in cielo cotanto glorïosamente accolto","frei von all diesen Schmeicheleien, wurde ich mit Beatrice im Himmel auf so herrliche Weise aufgenommen"
" Poi che ciascuno fu tornato ne lo punto del cerchio in che avanti s’era, fermossi, come a candellier candelo","Und es geschah, da alles Licht wiederkam an der Stelle der Krone, da er zuvor ward, stand er still wie die Kerze eines Leuchters."
" E io senti’ dentro a quella lumera che pria m’avea parlato, sorridendo incominciar, faccendosi più mera","Und ich spürte, daß der Selige in dem Licht, das er zuvor zu mir geredet hatte, wieder redete, weil er lächelnd heller wurde."
" «Così com’ io del suo raggio resplendo, sì, riguardando ne la luce etterna, li tuoi pensieri onde cagioni apprendo","Denn ich leuchte vom Strahl des ewigen Lichts und sehe darin, woher deine Ungewissheit kommt."
" Tu dubbi, e hai voler che si ricerna in sì aperta e ’n sì distesa lingua lo dicer mio, ch’al tuo sentir si sterna, ove dinanzi dissi","Du hast Zweifel, und du möchtest, dass ich dir in einer offenen und klaren Rede erklärt habe, was ich vorhin gesagt habe, damit ich deinem Verstand verständlich bin, als ich vorhin sagte:"
" “U’ ben s’impingua”, e là u’ dissi","""Wo man sich mit spirituellen Gütern bereichert"" und als ich sagte,"
 “Non nacque il secondo”,"""Es wurde kein anderes Gleichgestelltes geboren"""
 e qui è uopo che ben si distingua,"und hier ist es notwendig, eine Unterscheidung zu treffen"
" La provedenza, che governa il mondo con quel consiglio nel quale ogne aspetto creato è vinto pria che vada al fondo, ","Die Vorsehung, die die Welt mit jener Weisheit leitet, in der die Sehkraft eines jeden Geschöpfes verloren geht, bevor sie den Boden erreicht,"
" però che andasse ver’ lo suo diletto la sposa di colui ch’ad alte grida disposò lei col sangue benedetto, ","auf daß die Braut dessen, der sie heiratete unter den hohen Schreien mit ihrem gesegneten Blut, zu ihrem geliebten Geliebten gehe,"
" in sé sicura e anche a lui più fida, due principi ordinò in suo favore, che quinci e quindi le fosser per guida","Und er war sich selbst sicher und treuer zu Ihm und stellte zwei Fürsten für ihn auf, die ihn auf der einen und auf der anderen Seite leiteten."
 L’un fu tutto serafico in ardore,Einer war voller Eifer wie die Seraphim
 l’altro per sapïenza in terra fue di cherubica luce uno splendore,der andere für seine Weisheit auf Erden war ein Glanz des Lichts wie die Cherubim
" De l’un dirò, però che d’amendue si dice l’un pregiando, qual ch’om prende, perch’ ad un fine fur l’opere sue","Ich will nur von dem Ersten reden; denn wenn man einen von beiden lobt, so ist es, als würde man von beiden reden; denn ihre Werke hatten dasselbe Ende."
" Intra Tupino e l’acqua che discende del colle eletto dal beato Ubaldo, ","Zwischen dem Topin und dem Chiascio, der vom Berge Ausciano fließt, wo der selige Ubaldo sein Einsiedelei setzte,"
" fertile costa d’alto monte pende, onde Perugia sente freddo e caldo da Porta Sole","abgradiert die fruchtbare Küste eines hohen Berges, von dem aus Perugia die Kälte und die Hitze auf der Seite von Porta Sole spürt"
 e di rietro le piange per grave giogo Nocera con Gualdo,"und auf der anderen Seite weinen sie, weil in der schlechtesten Lage, Nocera Umbra und Gualdo Tadino"
" Di questa costa, là dov’ ella frange più sua rattezza, nacque al mondo un sole, come fa questo talvolta di Gange","Von dieser Küste, an dem Ort, an dem sie weniger steil wird, wurde eine Sonne für die Welt geboren, wie dies manchmal aus dem Gange"
" Però chi d’esso loco fa parole, non dica Ascesi, ché direbbe corto, ma Orïente, se proprio dir vuole","Also, wer von diesem Ort spricht, der soll ihn nicht Assisi nennen, denn er würde wenig sagen, sondern den Osten nennen, wenn er darüber reden will."
" Non era ancor molto lontan da l’orto, ch’el cominciò a far sentir la terra de la sua gran virtute alcun conforto","Er war noch nicht weit von seiner Geburt entfernt, als Franziskus begann, in der Erde über seine leuchtende Tugend nachzudenken"
" ché per tal donna, giovinetto, in guerra del padre corse, a cui, come a la morte, la porta del piacer nessun diserra","Denn sie war noch jung und stritt mit ihrem Vater um eine Frau, zu der niemand kommen will, als wäre sie tot."
