Original,Translate_de_1
" ciascun di quei candori in sù si stese con la sua cima, sì che l’alto affetto ch’elli avieno a Maria mi fu palese","Und jeder von diesen Seligen streckte sich nach oben mit seinem Gipfel, daß mir klar wurde, wie sehr sie zu Maria empfingen."
" Indi rimaser lì nel mio cospetto, ‘Regina celi’ cantando sì dolce, che mai da me non si partì ’l diletto","Und sie blieben vor mir stehen und sangen ""Königin ledig"" so süß, daß mich dieses Vergnügen nie verließ."
 Oh quanta è l’ubertà che si soffolce in quelle arche ricchissime che fuoro a seminar qua giù buone bobolce,"Oh, wie groß ist der Reichtum, der in den reichen Archen ist, die auf Erden gute Bauern waren, die Gutes säen."
" Quivi si vive e gode del tesoro che s’acquistò piangendo ne lo essilio di Babillòn, ove si lasciò l’oro","Hier lebt man und genießt den Schatz, den man kaufte, indem man im babylonischen Exil weinte, wo man den materiellen Reichtum verließ."
" Quivi trïunfa, sotto l’alto Filio di Dio e di Maria, di sua vittoria, e con l’antico e col novo concilio, ","Hier, unter dem hohen Sohn Gottes und Marias, feiert er zusammen mit den Seelen des Alten und Neuen Testaments den Triumph seines eigenen Sieges,"
 colui che tien le chiavi di tal gloria,Wer die Schlüssel zu dieser Herrlichkeit hält
" «O sodalizio eletto a la gran cena del benedetto Agnello, il qual vi ciba sì, che la vostra voglia è sempre piena, ","ER lädt euch ein, am hohen Abendmahl des Lammes Gottes teilzuhaben, das euch so viel Speise gibt, daß er euch allezeit sättigen wird,"
" se per grazia di Dio questi preliba di quel che cade de la vostra mensa, prima che morte tempo li prescriba, ","Denn er ist göttliche Gnade, ehe der Tod seinen Tagen ein Ende macht, was von eurem Tisch fällt,"
 ponete mente a l’affezione immensa e roratelo alquanto,Betrachtet sein unermeßliches Verlangen nach Erkenntnis und dürstet es ein wenig.
 voi bevete sempre del fonte onde vien quel ch’ei pensa»,"ihr trinkt allezeit aus der Quelle, aus der er kommt, was er denkt."
 Così Beatrice,So sagte Beatrice
" e quelle anime liete si fero spere sopra fissi poli, fiammando, a volte, a guisa di comete",Und die freudigen Seelen bildeten Kreise mit festen Mitten und zündeten sich wie Kometen.
" E come cerchi in tempra d’orïuoli si giran sì, che ’l primo a chi pon mente quïeto pare, e l’ultimo che voli","Und wie die Zahnradkreise der Uhren so drehen, dass der erste still zu sein scheint, während der letzte sehr schnell ist,"
" così quelle carole, differente- mente danzando, de la sua ricchezza mi facieno stimar, veloci e lente","Also erlaubten mir die Räder, die im Kreis tanzten, mit unterschiedlichen Geschwindigkeiten, ihre größere oder kleinere Glückseligkeit zu beurteilen."
" Di quella ch’io notai di più carezza vid’ ïo uscire un foco sì felice, che nullo vi lasciò di più chiarezza","Aus dem Kreis, den ich kostbarer sah, sah ich ein Licht hervorkommen, das so fröhlich war, daß niemand, der heller war, darin war."
" e tre fïate intorno di Beatrice si volse con un canto tanto divo, che la mia fantasia nol mi ridice","Und dreimal drehte er sich um Beatrice und singte ein so himmlisches Lied, daß meine Fantasie es mir nicht erlaubte, es zu beschreiben."
 Però salta la penna e non lo scrivo,"Also, mein Stift überspringt diesen Teil und ich rede nicht darüber."
" ché l’imagine nostra a cotai pieghe, non che ’l parlare, è troppo color vivo","Denn unsere Fantasie ist zu lebendig, um bestimmte Falten darzustellen, und so unsere Worte"
" «O santa suora mia che sì ne prieghe divota, per lo tuo ardente affetto da quella bella spera mi disleghe»","O heilige Schwester, die so gottesfürchtig zu uns betet, du holst mich aus dieser schönen Krone heraus, dank deines glühenden Eifers der Liebe."
" Poscia fermato, il foco benedetto a la mia donna dirizzò lo spiro, che favellò così com’ i’ ho detto","Nachdem er verhaftet worden war, wandte sich das gesegnete Feuer an meine Frau und sprach, wie ich gerade gesagt habe."
 Ed ella,Und sie...
" «O luce etterna del gran viro a cui Nostro Segnor lasciò le chiavi, ch’ei portò giù, di questo gaudio miro, ","DAS ewige Licht des großen Menschen, dem Jesus die Schlüssel zu dieser wunderbaren Seligkeit hinterließ, die er hinabführte,"
" tenta costui di punti lievi e gravi, come ti piace, intorno de la fede, per la qual tu su per lo mare andavi","und prüfe ihn über das Nebensächliche und Wichtige, wie du willst, über das Thema des Glaubens, durch das du über den Wassern wandeltest."
" S’elli ama bene e bene spera e crede, non t’è occulto, perché ’l viso hai quivi dov’ ogne cosa dipinta si vede","Du weißt wohl, daß er im Besitz der drei theologischen Tugenden, der Liebe, der Hoffnung und des Glaubens ist; denn du schaust dahin, wo alles dargestellt wird."
" ma perché questo regno ha fatto civi per la verace fede, a glorïarla, di lei parlare è ben ch’a lui arrivi»","Da aber dieses Reich seine Bürger für den wahren Glauben erworben hat, ist es gerecht, daß Dante davon redet, um sie zu verherrlichen."
" Sì come il baccialier s’arma e non parla fin che ’l maestro la question propone, per approvarla, non per terminarla, ","Wie der Baccellier sich vorbereitet und nicht redet, bis der Meister die Sache vorschlug, um sie zu bestätigen und nicht, um sie zu vollenden,"
" così m’armava io d’ogne ragione mentre ch’ella dicea, per esser presto a tal querente e a tal professione","Also bereitete ich mich mit allen dialektischen Mitteln vor, während Beatrice redete, auf daß ich bereit wäre zu einem solchen Prüfer und zu einem solchen Beruf."
" «Dì, buon Cristiano, fatti manifesto","‹ Sag mir, guter Christ, lass dich kennenlernen"
 fede che è?»,Was ist Glaube?
 Ond’ io levai la fronte in quella luce onde spirava questo,"Da hob ich meine Stirn auf zu dem Licht, aus dem diese Worte kamen."
" poi mi volsi a Beatrice, ed essa pronte sembianze femmi perch’ ïo spandessi l’acqua di fuor del mio interno fonte","Und ich wandte mich zu Beatrice, und sie nickte mich sogleich, daß ich das Wasser meiner inneren Quelle ausgieße."
" «La Grazia che mi dà ch’io mi confessi», comincia’ io, ","Die Gnade, die mir erlaubt, mich zu bekennen, begann ich"
" «da l’alto primipilo, faccia li miei concetti bene espressi»","vor dem hohen Führer der Kirche , lassen Sie meine Konzepte in der richtigen Weise ausgedrückt werden"
 E seguitai,Dann ging ich weiter.
" «Come ’l verace stilo ne scrisse, padre, del tuo caro frate che mise teco Roma nel buon filo, ","Wie der wahre Stift deines lieben Bruders, der Rom mit dir auf den rechten Weg brachte, schrieb,"
 fede è sustanza di cose sperate e argomento de le non parventi,"der Glaube ist der Inhalt der erhofften Dinge und der Beweis der Dinge, die man nicht sieht."
 e questa pare a me sua quiditate»,"Und ich glaube, das ist sein Wesen."
 Allora udi’,Also hörte ich...
" «Dirittamente senti, se bene intendi perché la ripuose tra le sustanze, e poi tra li argomenti»","Du denkst gut, solange du verstehst, warum er den Glauben als Substanz und als Beweis bezeichnet hat."
 E io appresso,Und ich gleich danach
" «Le profonde cose che mi largiscon qui la lor parvenza, a li occhi di là giù son sì ascose, ","Die göttlichen Geheimnisse, die mir hier ihr Aussehen geben, sind so verborgen vor den Augen der Sterblichen auf der Erde,"
" che l’esser loro v’è in sola credenza, sopra la qual si fonda l’alta spene","daß es nur möglich ist, an ihr Dasein zu glauben, auf das die hohe Hoffnung gegründet ist."
 e però di sustanza prende intenza,Und so heißt er als Substanz.
" E da questa credenza ci convene silogizzar, sanz’ avere altra vista","Und aus diesem Glauben müssen wir logische Schlüsse ziehen, ohne konkrete Beweise zu haben."
 però intenza d’argomento tene»,Also nimmt er den Namen der Demonstration an.
 Allora udi’,Also hörte ich...
" «Se quantunque s’acquista giù per dottrina, fosse così ’nteso, non lì avria loco ingegno di sofista»","Wenn alles, was auf der Erde mit der Lehre gelernt wird, so verstanden würde, wie du es verstehst, gäbe es keinen Raum für eine schwierige Argumentation."
 Così spirò di quello amore acceso,"So sagte der selige, selige, glühenden Nächstenliebe."
 indi soggiunse,dann fügte er hinzu
 «Assai bene è trascorsa d’esta moneta già la lega e ’l peso,Die Legierung und das Gewicht dieser Münze ist in deinen Händen vorübergegangen.
 ma dimmi se tu l’hai ne la tua borsa»,"Aber sag mir, ob du sie in deiner Tasche hast."
 Ond’ io,Also sagte ich:
" «Sì ho, sì lucida e sì tonda, che nel suo conio nulla mi s’inforsa»","Ja, ich besitze diese Münze so glänzend und rund, dass ich keinen Zweifel an ihrem Wert habe."
 Appresso uscì de la luce profonda che lì splendeva,"Bald darauf kamen diese Worte aus dem tiefen Licht, das dort leuchtete."
" «Questa cara gioia sopra la quale ogne virtù si fonda, onde ti venne?»","Dieses kostbare Juwel, auf dem alle anderen Tugenden gegründet sind, woher kommst du?"
 E io,Und ich
" «La larga ploia de lo Spirito Santo, ch’è diffusa in su le vecchie e ’n su le nuove cuoia, ","Der große Regen des Heiligen Geistes, der sich über das Alte und das Neue Testament ausbreitet,"
" è silogismo che la m’ha conchiusa acutamente sì, che ’nverso d’ella ogne dimostrazion mi pare ottusa»","Es ist der Syllogismus, der mir so wirksam gezeigt hat, dass im Vergleich dazu jeder Beweis schwach zu sein scheint."
 Io udi’ poi,"Dann hörte ich, wie ich sagte:"
" «L’antica e la novella proposizion che così ti conchiude, perché l’hai tu per divina favella?»","Wieso bist du dir der göttlichen Inspiration des Alten und Neuen Testaments sicher, die dir den Glauben beweisen, wie du gesagt hast?"
 E io,Und ich
" «La prova che ’l ver mi dischiude, son l’opere seguite, a che natura non scalda ferro mai né batte incude»","Der Beweis dafür sind die dort berichteten Wunder, die die Natur nicht hervorbringen kann."
 Risposto fummi,Ich erhielt eine Antwort.
" «Dì, chi t’assicura che quell’ opere fosser? ","Wer versichert dir, dass diese Wunder tatsächlich geschehen sind?"
" Quel medesmo che vuol provarsi, non altri, il ti giura»","Das bezeugt nur die Heilige Schrift, die du noch beweisen mußt, wie du inspiriert bist."
" «Se ’l mondo si rivolse al cristianesmo», diss’ io, ","Wenn sich die Welt zum Christentum bekehrt hat, sagte ich:"
" «sanza miracoli, quest’ uno è tal, che li altri non sono il centesmo","ohne den Beweis der Wunder, diese einzige Tatsache ist ein Wunder, dass die anderen nur den Hundertsten Teil davon wert sind"
" ché tu intrasti povero e digiuno in campo, a seminar la buona pianta che fu già vite e ora è fatta pruno»","Denn du kamst arm und fastest auf dem Felde, um die gute Pflanze zu säen, die einst Weinstock war, und ist nun ein Dornbusch geworden."
" Finito questo, l’alta corte santa risonò per le spere un ‘Dio laudamo’ ne la melode che là sù si canta","Nachdem das Gespräch beendet war, ließ der hohe Hof des Paradieses für die himmlischen Sphären ein ""Te, Deum, laudamus"" in der Melodie erschallen, die dort oben gesungen wird."
" E quel baron che sì di ramo in ramo, essaminando, già tratto m’avea, che a l’ultime fronde appressavamo, ricominciò","Und der Baron, der mich geprüft hatte, hatte mich von Zweig zu Zweig genommen, so daß wir uns näherten zu den letzten Fronen, da fing er wieder an."
" «La Grazia, che donnea con la tua mente, la bocca t’aperse infino a qui come aprir si dovea, sì ch’io approvo ciò che fuori emerse","Die Gnade, die über deinen Sinn herrschte, öffnete dir den Mund bis hierher, wie es dir gefiel, so daß ich gutheiße, was du gesagt hast."
" ma or convien espremer quel che credi, e onde a la credenza tua s’offerse»","Nun aber ist es notwendig, daß du deinen Glauben bekennst und verkündigst, woher er zu dir gekommen ist."
" «O santo padre, e spirito che vedi ciò che credesti sì, che tu vincesti ver’ lo sepulcro più giovani piedi», ","O heiliger Vater und Geist, den du jetzt siehst, was du am Leben glaubst, mit so viel Eifer, daß du das Grab Christi besiegtest, als du jüngere Füße begehrtest,"
" comincia’ io, ",Ich fing an.
" «tu vuo’ ch’io manifesti la forma qui del pronto creder mio, e anche la cagion di lui chiedesti","du willst, daß ich nun verkündige das Wesen meines Glaubens, und du hast mich auch um seinen Ursprung gebeten."
 E io rispondo,Und ich antworte dir.
" Io credo in uno Dio solo ed etterno, che tutto ’l ciel move, non moto, con amore e con disio","Ich glaube an einen ewigen Gott, der den ganzen Himmel bewegt und unbeweglich bleibt, mit Liebe und Begierde."
" e a tal creder non ho io pur prove fisice e metafisice, ","Und ich habe keine physischen und metaphysischen Beweise für diesen Glauben,"
" ma dalmi anche la verità che quinci piove per Moïsè, ","aber sag mir auch die Wahrheit, daß es hier regnet vor Moses,"
" per profeti e per salmi, per l’Evangelio e per voi che scriveste poi che l’ardente Spirto vi fé almi","Für Propheten und Psalmen, für das Evangelium und für euch, die ihr dann schreibt, dass der Heilige Geist euch Seelen gemacht hat."
" e credo in tre persone etterne, e queste credo una essenza sì una e sì trina, che soffera congiunto ‘sono’ ed ‘este’","und ich glaube an drei ewige Menschen, und ich glaube, dass dieses Sein eins und dreieinig ist, so dass man von ihm zusammen sagen kann ""ich bin"" und ""ist"""
" De la profonda condizion divina ch’io tocco mo, la mente mi sigilla più volte l’evangelica dottrina","Das Wort des Evangeliums macht mich immer wieder von diesem tiefen Wesen Gottes überzeugt, von dem ich jetzt spreche."
" Quest’ è ’l principio, quest’ è la favilla che si dilata in fiamma poi vivace, e come stella in cielo in me scintilla»","Das ist der Anfang meines Glaubens, das ist der Funke, der sich dann in eine lebendige Flamme ausbreitet und in mir leuchtet wie ein Stern im Himmel."
" Come ’l segnor ch’ascolta quel che i piace, da indi abbraccia il servo, gratulando per la novella, tosto ch’el si tace","Wie der Herr, der hört, was er hören will, so umarmt er den Knecht und freut sich über die gute Botschaft, sobald er still ist."
" così, benedicendomi cantando, tre volte cinse me, sì com’ io tacqui, l’appostolico lume al cui comando io avea detto","und segnete mich und sang, und das apostolische Licht, zu dessen Gebot ich geredet hatte, wandte sich dreimal um mich, sobald ich stille."
 sì nel dir li piacqui,Und so gefielen ihm meine Worte.
" Se mai continga che ’l poema sacro al quale ha posto mano e cielo e terra, sì che m’ha fatto per molti anni macro, ","Wenn es jemals geschehen wird, dass das heilige Gedicht, mit dem sie zusammengearbeitet haben Himmel und Erde, und das hat mich körperlich für viele Jahre verbraucht,"
" vinca la crudeltà che fuor mi serra del bello ovile ov’ io dormi’ agnello, nimico ai lupi che li danno guerra","besiege die Grausamkeit, die mich verbannt von der Höhle, in der ich schlief wie ein Lamm, Feind der Wölfe, die ihn kriegen"
" con altra voce omai, con altro vello ritornerò poeta, e in sul fonte del mio battesmo prenderò ’l cappello","mit einer anderen Stimme, und die Haare singen zurück als Dichter, und ich werde die Bügel mit dem poetischen Lorbeer an der Quelle meiner Taufe gürten"
" però che ne la fede, che fa conte l’anime a Dio, quivi intra’ io, e poi Pietro per lei sì mi girò la fronte","Denn da kam ich in den Glauben und machte die Seelen Gott nahe, und danach wandte sich der hl. Petrus um meine Stirn, nachdem er mich auf diese Tugend geprüft hatte."
 Indi si mosse un lume verso noi di quella spera ond’ uscì la primizia che lasciò Cristo d’i vicari suoi,"Und ein anderer Geist begab sich zu uns von der Seelenkrone, aus der der erste der Stellvertreter, den Christus auf Erden hinterließ, herauskam."
" e la mia donna, piena di letizia, mi disse","Und mein Weib, voll Freude, sprach zu mir:"
" «Mira, mira",Sieh dir das an.
 ecco il barone per cui là giù si vicita Galizia»,"Hier ist der Heilige, für den man auf der Erde Pilgerfahrten nach Galicien macht."
" Sì come quando il colombo si pone presso al compagno, l’uno a l’altro pande, girando e mormorando, l’affezione","Wie wenn sich die Taube seinem Gefährten nähert und die beiden sich umdrehen und tuben und ihre gegenseitige Zuneigung offenbaren,"
" così vid’ ïo l’un da l’altro grande principe glorïoso essere accolto, laudando il cibo che là sù li prande","Also sah ich einen jeglichen der beiden herrlichen Seligen, die von dem andern angenommen wurden, und pries die geistige Speise, die sie daselbst nährte."
" Ma poi che ’l gratular si fu assolto, tacito coram me ciascun s’affisse, ignito sì che vincëa ’l mio volto","Aber nach dem Ende ihrer Glückseligkeit blieb jeder von ihnen still neben mir, so glänzend, daß mein Anblick seinen Blick nicht stützen konnte."
 Ridendo allora Beatrice disse,Und Beatrice lächelte und sprach:
" «Inclita vita per cui la larghezza de la nostra basilica si scrisse, fa risonar la spene in questa altezza",. . . . . . . . . . . . . . . . . . . . . . . . . . . . . . . . . . . . . . . . . . . . . . . . . . . . . . . . . . . . . . . . . . . . . . . . . . . . . . . . . . . . . . . . . . . . . . . . . . . . . . . . . . . . . . . . . . . . . . . . . . . . . . . . . . . . . . . . . . . . . . . . . . . . . . . . . . . . . . . . . . . . . . . . . . . . . . . . . . . . . . . . . . . . . . . . . . . . . . . . . . . . . .
" tu sai, che tante fiate la figuri, quante Iesù ai tre fé più carezza»","du kennst sie gut, denn du verrätst sie so oft, wie Jesus euch drei seine Vorliebe zeigte."
 «Leva la testa e fa che t’assicuri,"Erheben Sie Ihren Kopf und beruhigen Sie sich,"
" che ciò che vien qua sù del mortal mondo, convien ch’ai nostri raggi si maturi»","Denn was hier oben aus der irdischen Welt kommt, muß sich vervollkommnen in unser Licht."
 Questo conforto del foco secondo mi venne,Diese Ermunterung kam mir aus dem zweiten Licht
 ond’ io leväi li occhi a’ monti che li ’ncurvaron pria col troppo pondo,"Da hob ich meine Augen auf, auf die Berge zu schauen, die sie zuvor mit übermäßigem Gewicht beugten."
" «Poi che per grazia vuol che tu t’affronti lo nostro Imperadore, anzi la morte, ne l’aula più secreta co’ suoi conti, ","Da unser Kaiser durch seine Gnade will, daß du dich vor dem Tod in seinem geheimsten Zimmer mit seinen hohen Würdenträgern treffst,"
" sì che, veduto il ver di questa corte, la spene, che là giù bene innamora, ","So, wenn man die Wahrheit dieses Gerichts gesehen hat, die Hoffnung, die dort sehr fasziniert ist,"
" in te e in altrui di ciò conforte, ",tröste dich und die anderen in dieser Hinsicht
" di’ quel ch’ell’ è, di’ come se ne ’nfiora la mente tua, e dì onde a te venne»","und sag, wie dein Sinn blüht, und sag, woher du gekommen bist."
 Così seguì ’l secondo lume ancora,Und der zweite Selige sprach zu mir:
" E quella pïa che guidò le penne de le mie ali a così alto volo, a la risposta così mi prevenne","Und die herrliche Frau, die die Federn meiner Flügel zu einem so hohen Flug führte, ging mir also voraus in der Antwort."
" «La Chiesa militante alcun figliuolo non ha con più speranza, com’ è scritto nel Sol che raggia tutto nostro stuolo","Die militante Kirche hat kein anderes Kind mit größerer Hoffnung als Dante, wie es in der Sonne geschrieben steht, die unser ganzes Heer erleuchtet"
" però li è conceduto che d’Egitto vegna in Ierusalemme per vedere, anzi che ’l militar li sia prescritto","Darum ist es ihm erlaubt, aus Ägypten in das himmlische Jerusalem zu kommen, um zu sehen, ehe der Tod sein Heer erlöst."
" Li altri due punti, che non per sapere son dimandati, ma perch’ ei rapporti quanto questa virtù t’è in piacere, a lui lasc’ io, ","Ich überlasse ihm die beiden andern Fragen, die ihm nicht gestellt wurden, um zu erfahren, sondern damit er der Welt berichtet, wie sehr dir diese Tugend gefällt."
 ché non li saran forti né di iattanza,"daß sie ihm nicht schwer werden noch ihm die Gelegenheit geben, sich zu rühmen."
" ed elli a ciò risponda, e la grazia di Dio ciò li comporti»","Darum erhöre allein, und die göttliche Gnade helfe ihm darin."
" Come discente ch’a dottor seconda pronto e libente in quel ch’elli è esperto, ","Wie ein Schüler, der dem Lehrer mit Bereitwilligkeit und gutem Willen in dem, worin er erfahren ist, antwortet,"
" perché la sua bontà si disasconda, «Spene», diss’ io, ","Um seine Erkenntnis kundzutun, da sagte ich:"
" «è uno attender certo de la gloria futura, il qual produce grazia divina e precedente merto","Es ist die sichere Erwartung der künftigen Seligkeit, die von der göttlichen Gnade und von den erworbenen Verdiensten hervorgebracht wird."
 Da molte stelle mi vien questa luce,Dieses Licht kommt von vielen Sternen
 ma quei la distillò nel mio cor pria che fu sommo cantor del sommo duce,"Aber der sie zuerst in mein Herz brachte, war der höchste Sänger Gottes."
" ‘Sperino in te’, ne la sua tëodia dice, ‘color che sanno il nome tuo’","""Serviere auf Tee,"" sagte er in seinem Gesang, ""die deinen Namen kennen."""
" e chi nol sa, s’elli ha la fede mia? ","Und wer weiß es nicht, wenn er meinen Glauben besitzt?"
" Tu mi stillasti, con lo stillar suo, ne la pistola poi","Du hast mir mit deinem Brief Hoffnung gegeben,"
" sì ch’io son pieno, e in altrui vostra pioggia repluo»",damit ich mit dieser Tugend erfüllt bin und sie auch über die anderen verbreiten kann.
" Mentr’ io diceva, dentro al vivo seno di quello incendio tremolava un lampo sùbito e spesso a guisa di baleno","Und da ich das sagte, zitterte in der tiefen Tiefe des Lichtes ein heftiger Blitz wie ein Blitz des Lichtes."
 Indi spirò,Dann sagte er zu mir:
" «L’amore ond’ ïo avvampo ancor ver’ la virtù che mi seguette infin la palma e a l’uscir del campo, ","""Die Liebe, die ich noch habe für die Hoffnung, die mir bis zum Martyrium und bis zum Ende meines irdischen Lebens folgte,"
 vuol ch’io respiri a te che ti dilette di lei,"Er will, dass ich mich an dich richte, dass du mit ihr gefüllt bist."
 ed emmi a grato che tu diche quello che la speranza ti ’mpromette»,"Und es ist mir wohlgefallen, daß du sagst, was die Hoffnung dir verheißt."
 E io,Und ich
" «Le nove e le scritture antiche pongon lo segno, ed esso lo mi addita, de l’anime che Dio s’ha fatte amiche","Das Alte und das Neue Testament weisen auf das Ende der Seelen hin, die die Seligkeit erreicht haben."
 Dice Isaia che ciascuna vestita ne la sua terra fia di doppia vesta,"Jesaja sagt, dass jede von ihnen ein doppeltes Kleid in seinem Land tragen wird,"
 e la sua terra è questa dolce vita,und sein Land ist dieses selige Leben.
" e ’l tuo fratello assai vie più digesta, là dove tratta de le bianche stole, questa revelazion ci manifesta»","Und dein Bruder offenbart uns diese Offenbarung noch deutlicher, da er mit weißen Stöcken umgeht."
" E prima, appresso al fin d’este parole, ‘Sperent in te’ di sopr’ a noi s’udì","Und zuerst, kurz nach dem Ende dieser Worte, hörte man über uns ""Sperino auf Tee,"""
 a che rispuoser tutte le carole,mit allen Kronen
" Poscia tra esse un lume si schiarì sì che, se ’l Cancro avesse un tal cristallo, l’inverno avrebbe un mese d’un sol dì","Und unter ihnen glühte ein Licht, so daß, wenn das Sternbild des Krebses so hell wäre, der Winter einen Tag hätte von einem Monat."
" E come surge e va ed entra in ballo vergine lieta, sol per fare onore a la novizia, non per alcun fallo, ","Und wie ein glückliches Mädchen aufsteht und in den Tanz tritt, nur um der jungen Braut Ehre zu erweisen, und nicht um der Hochmut willen,"
 così vid’ io lo schiarato splendore venire a’ due che si volgieno a nota qual conveniesi al loro ardente amore,"Also sah ich das helle Licht nahe an die beiden andern, die sich drehten und sangen, auf eine Weise, die ihrem Eifer der Liebe entsprach."
 Misesi lì nel canto e ne la rota,Und er ging hinein in ihren Tanz und schloß sich ihrem Gesang an.
" e la mia donna in lor tenea l’aspetto, pur come sposa tacita e immota","und meine Frau schaute auf sie wie eine stille, stille Braut."
" «Questi è colui che giacque sopra ’l petto del nostro pellicano, e questi fue di su la croce al grande officio eletto»","Er ist es, der seinen Kopf auf die Brust Christi legte, und er wurde vom Kreuz zur höchsten Aufgabe erwählt."
 La donna mia così,Also meine Frau
 né però più e mosser la vista sua di stare attenta poscia che prima le parole sue,Doch vor und nach dem Reden ließ er den Blick nicht von den drei Lichtern ablenken.
" Qual è colui ch’adocchia e s’argomenta di vedere eclissar lo sole un poco, che, per veder, non vedente diventa","Wie derjenige, der in jeder Hinsicht eine teilweise Sonnenfinsternis sieht und versucht, und der, um zu sehen, blind wird"
 tal mi fec’ ïo a quell’ ultimo foco mentre che detto fu,"so bin ich geworden, da ich das dritte Licht ansah, und der Selige sprach zu mir:"
 «Perché t’abbagli per veder cosa che qui non ha loco? ,"Warum bluffst du, um etwas zu sehen, das nicht hier ist?"
" In terra è terra il mio corpo, e saragli tanto con li altri, che ’l numero nostro con l’etterno proposito s’agguagli","Mein Körper zerfällt auf der Erde, und er bleibt bei allen anderen, bis die Zahl der Seligen die Grenze erreicht, die der göttliche Wille gesetzt hat."
