,Purgatorio,Parafrasi
1090,"cominciò ella, «se novella vera",cominciò a dire «se sai notizie vere 
1091,di Val di Magra o di parte vicina,"della Val di Magra e dei paesi vicini, "
1092,"sai, dillo a me, che già grande là era.","riferiscilo a me, che in vita  fui potente in quel luogo."
1093,Fui chiamato Currado Malaspina;,Ebbi nome Corrado Malaspina; 
1094,"non son l’antico, ma di lui discesi;","non sono il vecchio , ma un suo discendente;"
1095,a’ miei portai l’amor che qui raffina».,portai ai miei familiari quell’amore che qui si purifica ». 
1096,"«Oh!», diss’ io lui, «per li vostri paesi",«Oh!» dissi io a lui «non sono
1097,già mai non fui; ma dove si dimora,mai stato nei vostri paesi; ma c’è un luogo
1098,per tutta Europa ch’ei non sien palesi?,in tutta l’Europa abitata in cui essi non siano noti?
1099,"La fama che la vostra casa onora,","La fama che dà onore alla vostra casata, "
1100,"grida i segnori e grida la contrada,","celebra a gran voce  i signori e la regione , "
1101,sì che ne sa chi non vi fu ancora;,tanto che è nota  anche a chi non vi è ancora stato; 
1102,"e io vi giuro, s’io di sopra vada,",e vi giuro – così possa giungere alla sommità del monte  – 
1103,che vostra gente onrata non si sfregia,che la vostra onorata famiglia non cessa di fregiarsi  
1104,del pregio de la borsa e de la spada.,del merito  della liberalità  e della virtù militare .
1105,"Uso e natura sì la privilegia,","L’uso alla virtù e la disposizione naturale  la privilegiano tanto che,"
1106,"che, perché il capo reo il mondo torca,","benché la guida rea  travii  il mondo,"
1107,sola va dritta e ’l mal cammin dispregia».,essa sola va per la giusta strada e disprezza la via malvagia». 
1108,Ed elli: «Or va; che ’l sol non si ricorca,Ed egli: «Ora va’; il sole non tornerà a tramontare sette volte 
1109,sette volte nel letto che ’l Montone,in quella parte del cielo che l’Ariete  
1110,"con tutti e quattro i piè cuopre e inforca,","copre e tiene tra la forca delle sue quattro zampe, "
1111,che cotesta cortese oppinïone,che questa gentile opinione ti sarà fissata  
1112,ti fia chiavata in mezzo de la testa,nella mente con argomenti  più convincenti 
1113,"con maggior chiovi che d’altrui sermone,","delle parole  altrui, a meno che "
1114,se corso di giudicio non s’arresta».,non si arresti il corso del giudizio divino». 
1115,La concubina di Titone antico,"L’Aurora, compagna  del vecchio  Titone "
1116,"già s’imbiancava al balco d’orïente,",già biancheggiava all’orizzonte 
1117,fuor de le braccia del suo dolce amico;,lontana dalle braccia del suo dolce amico;
1118,"di gemme la sua fronte era lucente,","la sua fronte era lucente di stelle, "
1119,poste in figura del freddo animale,disposte a formare la figura del freddo animale  
1120,che con la coda percuote la gente;,che ferisce  la gente con la sua coda;
1121,"e la notte, de’ passi con che sale,","e nel luogo dove eravamo, la notte aveva percorso"
1122,"fatti avea due nel loco ov’ eravamo,","due passi di quelli con cui essa sale, "
1123,e ’l terzo già chinava in giuso l’ale;,mentre si apprestava a compiere anche il terzo  ; 
1124,"quand’ io, che meco avea di quel d’Adamo,","quando io, che avevo un corpo come Adamo, "
1125,"vinto dal sonno, in su l’erba inchinai","vinto dal sonno, mi coricai  sull’erba "
1126,là ’ve già tutti e cinque sedavamo.,là dove già stavamo seduti tutti e cinque. 
1127,Ne l’ora che comincia i tristi lai,"Nell’ora in cui, all’approssimarsi dell’alba, "
1128,"la rondinella presso a la mattina,","la rondinella comincia il suo lamentevole canto , "
1129,"forse a memoria de’ suo’ primi guai,","forse in ricordo delle sue prime sventure,"
1130,"e che la mente nostra, peregrina","e in cui la nostra mente, più distaccata "
1131,"più da la carne e men da’ pensier presa,","dal peso della carne e meno presa dalle preoccupazioni, "
1132,"a le sue visïon quasi è divina,","nelle sue visioni è quasi profetica , "
1133,in sogno mi parea veder sospesa,mi sembrava di vedere in sogno un’aquila  
1134,"un’aguglia nel ciel con penne d’oro,","dalle penne d’oro librata  nel cielo, "
1135,con l’ali aperte e a calare intesa;,con le ali distese e in procinto di scendere; 
1136,ed esser mi parea là dove fuoro,e mi sembrava di essere là dove 
1137,"abbandonati i suoi da Ganimede,","Ganimede  abbandonò i suoi compagni, "
1138,quando fu ratto al sommo consistoro.,quando fu rapito  per essere condotto al concilio degli dei . 
1139,Fra me pensava: ‘Forse questa fiede,Pensavo tra me: «Forse quest’aquila colpisce  
1140,"pur qui per uso, e forse d’altro loco","solo  qui per abitudine , e forse di sdegna di prendere "
1141,disdegna di portarne suso in piede’.,prede  da un altro luogo per portarle in alto fra gli artigli ». 
1142,"Poi mi parea che, poi rotata un poco,","Poi mi sembrava che, dopo aver compiuto alcuni voli concentrici , "
1143,"terribil come folgor discendesse,","scendesse terribile come la folgore,"
1144,e me rapisse suso infino al foco.,e mi rapisse su fino alla sfera del fuoco.
1145,Ivi parea che ella e io ardesse;,"Qui sembrava che lei e io bruciassimo, "
1146,"e sì lo ’ncendio imaginato cosse,","e l’incendio sognato fu così ardente , "
1147,che convenne che ’l sonno si rompesse.,che necessariamente il sonno si interruppe. 
1148,"Non altrimenti Achille si riscosse,","Non diversamente si svegliò  Achille, "
1149,li occhi svegliati rivolgendo in giro,volgendo gli occhi aperti  in giro 
1150,"e non sappiendo là dove si fosse,","e non sapendo in che luogo si trovasse,"
1151,quando la madre da Chirón a Schiro,"quando la madre  fra le sue braccia mentre dormiva,"
1152,"trafuggò lui dormendo in le sue braccia,","sottraendolo alla custodia di Chirone, lo trasportò  nell’isola di Schiro,"
1153,là onde poi li Greci il dipartiro;,da dove poi i Greci lo fecero partire ; 
1154,"che mi scoss’ io, sì come da la faccia","da come  mi destai io, non appena il sonno sparì "
1155,"mi fuggì ’l sonno, e diventa’ ismorto,","dal mio viso, e diventai pallido  "
1156,"come fa l’uom che, spaventato, agghiaccia.",come chi per lo spavento si sente gelare il sangue.
1157,"Dallato m’era solo il mio conforto,","Al mio fianco c’era solo Virgilio ,"
1158,"e ’l sole er’ alto già più che due ore,","e il sole era ormai alto da più di due ore, "
1159,e ’l viso m’era a la marina torto.,e il mio sguardo si era rivolto verso il mare. 
1160,"«Non aver tema», disse il mio segnore;",«Non avere paura » disse la mia guida; 
1161,"«fatti sicur, ché noi semo a buon punto;","«rassicurati, perché noi siamo a buon punto; "
1162,"non stringer, ma rallarga ogne vigore.","non diminuire  le tue forze, ma rinvigoriscile ."
1163,Tu se’ omai al purgatorio giunto:,Tu sei ormai arrivato al Purgatorio:
1164,vedi là il balzo che ’l chiude dintorno;,vedi laggiù il pendio  che lo circonda; 
1165,vedi l’entrata là ’ve par digiunto.,vedi l’ingresso laggiù dove il balzo sembra interrotto . 
1166,"Dianzi, ne l’alba che procede al giorno,","Poco fa , nei primi albori che precedono il sorgere del sole, "
1167,"quando l’anima tua dentro dormia,",quando la tua anima dormiva in te disteso 
1168,sovra li fiori ond’ è là giù addorno,"sui fiori che adornano la valletta laggiù, "
1169,"venne una donna, e disse: “I’ son Lucia;",venne una donna e disse: ‘Io sono Lucia: 
1170,lasciatemi pigliar costui che dorme;,"permettetemi di prendere costui che dorme, "
1171,sì l’agevolerò per la sua via”.,così potrò aiutarlo a continuare il suo cammino’.
1172,Sordel rimase e l’altre genti forme;,Sordello e le altre nobili anime  rimasero;
1173,"ella ti tolse, e come ’l dì fu chiaro,","Lucia ti prese  e appena si fece giorno,"
1174,sen venne suso; e io per le sue orme.,se ne venne su; e io seguii i suoi passi. 
1175,"Qui ti posò, ma pria mi dimostraro","Ti depose qui, ma prima i suoi begli occhi "
1176,li occhi suoi belli quella intrata aperta;,mi indicarono quella fessura nel balzo; 
1177,poi ella e ’l sonno ad una se n’andaro».,poi lei e il tuo sonno se ne andarono insieme ».
1178,A guisa d’uom che ’n dubbio si raccerta,"Come un uomo che si rassicura  dopo un’incertezza, "
1179,"e che muta in conforto sua paura,","e che trasforma il suo timore in fiducia , "
1180,"poi che la verità li è discoperta,","dopo che gli si è svelata la vera realtà, "
1181,mi cambia’ io; e come sanza cura,così mi trasformai io; e non appena la mia guida 
1182,"vide me ’l duca mio, su per lo balzo","mi vide senza alcun timore , "
1183,"si mosse, e io di rietro inver’ l’altura.",si diresse su per la roccia ; e io dietro a lui verso l’alto. 
1184,"Lettor, tu vedi ben com’ io innalzo","O lettore, considera con attenzione come io porti più in alto "
1185,"la mia matera, e però con più arte","il mio soggetto, e perciò non meravigliarti "
1186,non ti maravigliar s’io la rincalzo.,se io lo rafforzo  con più elevato stile. 
1187,"Noi ci appressammo, ed eravamo in parte","Noi ci avvicinammo  e ci trovammo in un luogo tale che,"
1188,"che là dove pareami prima rotto,","dove prima mi pareva di vedere una spaccatura , "
1189,"pur come un fesso che muro diparte,","proprio come una fenditura  che divide un muro, "
1190,"vidi una porta, e tre gradi di sotto","vidi una porta, e sotto di essa tre gradini"
1191,"per gire ad essa, di color diversi,",di colore diverso per raggiungerla 
1192,e un portier ch’ancor non facea motto.,e un portinaio che per il momento non pronunciava parola . 
1193,"E come l’occhio più e più v’apersi,","E quando fissai con attenzione  l’occhio su lui , "
1194,"vidil seder sovra ’l grado sovrano,","lo vidi sedere sul gradino più alto , "
1195,tal ne la faccia ch’io non lo soffersi;,così splendente in volto che non riuscii a guardarlo ; 
1196,"e una spada nuda avëa in mano,","e teneva in mano una spada sguainata , "
1197,"che reflettëa i raggi sì ver’ noi,",che rimandava a noi i raggi del suo splendore 
1198,ch’io drizzava spesso il viso in vano.,così che spesso tentavo invano di volgere lo sguardo a lui. 
1199,"«Dite costinci: che volete voi?»,","«Dite, dal luogo dove siete : che cosa volete?»"
1200,"cominciò elli a dire, «ov’ è la scorta?",egli cominciò a dire: «dov’è la guida ? 
1201,Guardate che ’l venir sù non vi nòi».,Badate che la vostra salita non vi rechi danno ». 
1202,"«Donna del ciel, di queste cose accorta»,","«Una donna venuta dal cielo, esperta  di queste cose»,"
1203,"rispuose ’l mio maestro a lui, «pur dianzi","gli rispose il mio maestro, «proprio poco fa ci disse:"
1204,ne disse: “Andate là: quivi è la porta”».,‘Andate là: questa è la porta’».
1205,"«Ed ella i passi vostri in bene avanzi»,","«Ed ella faccia progredire  i vostri passi nella via del bene»,"
1206,ricominciò il cortese portinaio:,riprese il cortese portinaio: 
1207,«Venite dunque a’ nostri gradi innanzi».,«Venite dunque davanti ai nostri gradini». 
1208,Là ne venimmo; e lo scaglion primaio,Ci portammo là; e il primo scalino  
1209,"bianco marmo era sì pulito e terso,","era di marmo bianco così nitido  e lucente,"
1210,ch’io mi specchiai in esso qual io paio.,che io mi specchiai in esso come appaio  in realtà.
1211,"Era il secondo tinto più che perso,","Il secondo era scuro più del color perso ,"
1212,"d’una petrina ruvida e arsiccia,","fatto di una pietra poco compatta ruvida e arida,"
1213,crepata per lo lungo e per traverso.,incrinata sia per lungo che per traverso. 
1214,"Lo terzo, che di sopra s’ammassiccia,","Il terzo, che si posa con la sua massa compatta "
1215,"porfido mi parea, sì fiammeggiante","sopra il secondo, mi sembrava porfido, "
1216,come sangue che fuor di vena spiccia.,di un rosso così acceso come il sangue che sprizza  fuori da una vena. 
1217,Sovra questo tenëa ambo le piante,"Sopra questo gradino teneva entrambi i piedi l’angelo di Dio, "
1218,l’angel di Dio sedendo in su la soglia,"il quale sedeva sulla soglia della porta, "
1219,che mi sembiava pietra di diamante.,che mi sembrava dura come il diamante.
1220,Per li tre gradi sù di buona voglia,"La mia guida trasse su per i tre gradini  me, "
1221,"mi trasse il duca mio, dicendo: «Chiedi","che lo seguivo di buona voglia, dicendo: "
1222,umilemente che ’l serrame scioglia».,"«Chiedi con umiltà, che apra la serratura della porta »."
1223,Divoto mi gittai a’ santi piedi;,Devotamente mi gettai ai piedi dell’angelo;
1224,"misericordia chiesi e ch’el m’aprisse,",gli chiesi misericordia e che mi aprisse la porta; 
1225,ma tre volte nel petto pria mi diedi.,ma prima mi battei tre volte il petto. 
1226,Sette P ne la fronte mi descrisse,Con la punta della spada mi incise 
1227,"col punton de la spada, e «Fa che lavi,","sulla fronte sette P e disse: «Quando sarai dentro,"
1228,"quando se’ dentro, queste piaghe» disse.",fa’ in modo di lavarti queste ferite». 
1229,"Cenere, o terra che secca si cavi,",La cenere o la terra che si scava  da un terreno arido  
1230,d’un color fora col suo vestimento;,sarebbe  di un colore simile al vestito dell’angelo; 
1231,e di sotto da quel trasse due chiavi.,e da sotto a quella tonaca tirò fuori due chiavi. 
1232,L’una era d’oro e l’altra era d’argento;,Una era d’oro e l’altra d’argento;
1233,pria con la bianca e poscia con la gialla,"prima con la bianca e poi con la gialla agì  sulla porta,"
1234,"fece a la porta sì, ch’i’ fu’ contento.","per aprirla, in modo da accontentarmi."
1235,"«Quandunque l’una d’este chiavi falla,","«Ogni volta che una di queste chiavi sbaglia ,"
1236,"che non si volga dritta per la toppa»,",in quanto non si gira nel senso giusto nella toppa»
1237,"diss’ elli a noi, «non s’apre questa calla.","ci disse l’angelo, «questo varco  non si apre."
1238,Più cara è l’una; ma l’altra vuol troppa,Una è più preziosa ; ma l’altra 
1239,"d’arte e d’ingegno avanti che diserri,",ha bisogno di molta esperienza e intelligenza 
1240,perch’ ella è quella che ’l nodo digroppa.,"prima che possa aprire, perché essa è quella che scioglie  il nodo . "
1241,Da Pier le tegno; e dissemi ch’i’ erri,Le ho avute da san Pietro; e mi disse che mi sbagliassi
1242,"anzi ad aprir ch’a tenerla serrata,","piuttosto nell’aprirla che nel tenerla chiusa, "
1243,pur che la gente a’ piedi mi s’atterri».,purché la gente si inginocchi ai miei piedi». 
1244,"Poi pinse l’uscio a la porta sacrata,","Poi spinse il battente della porta sacra, "
1245,dicendo: «Intrate; ma facciovi accorti,dicendo: «Entrate; ma vi avverto  
1246,che di fuor torna chi ’n dietro si guata».,che chi si guarda  indietro deve tornare fuori».
1247,E quando fuor ne’ cardini distorti,"E quando i battenti  di quella porta  sacra, "
1248,"li spigoli di quella regge sacra,","che sono di metallo sonante e robusto, "
1249,"che di metallo son sonanti e forti,","girarono  sui cardini, "
1250,non rugghiò sì né si mostrò sì acra,"non stridette  così, né si mostrò così dura "
1251,"Tarpëa, come tolto le fu il buono","la rupe Tarpea, quando fu estromesso il valoroso Metello, "
1252,"Metello, per che poi rimase macra.","che la custodiva, per cui poi rimase impoverita . "
1253,"Io mi rivolsi attento al primo tuono,",Mi rivolsi attento al primo forte rumore  
1254,e ‘Te Deum laudamus’ mi parea,e mi sembrò di udire cantato da voci mescolate 
1255,udire in voce mista al dolce suono.,a una dolce musica il ‘Te Deum laudamus’.
1256,Tale imagine a punto mi rendea,Ciò che io udivo mi riproduceva fedelmente  
1257,"ciò ch’io udiva, qual prender si suole",la stessa impressione  che di solito si riceve  
1258,quando a cantar con organi si stea;,"quando si assiste a un canto accompagnato dagli organi, "
1259,ch’or sì or no s’intendon le parole.,"per cui le parole ora si comprendono, ora no. "
1260,Poi fummo dentro al soglio de la porta,"Dopo che oltrepassammo la soglia della porta , "
1261,"che ’l mal amor de l’anime disusa,","che l’amore degli uomini rivolto al male  lascia in disuso, "
1262,"perché fa parer dritta la via torta,","perché fa sembrare retta la via errata, "
1263,sonando la senti’ esser richiusa;,avvertii che si era richiusa dal suono che aveva provocato;
1264,"e s’io avesse li occhi vòlti ad essa,","e se io avessi rivolto a essa lo sguardo, "
1265,qual fora stata al fallo degna scusa?,quale scusa sarebbe stata sufficiente a giustificare la mia trasgressione ? 
1266,"Noi salavam per una pietra fessa,","Noi salivamo  attraverso una fenditura nella roccia ,"
1267,"che si moveva e d’una e d’altra parte,","che procedeva tortuosamente piegando ora a destra, ora a sinistra, "
1268,sì come l’onda che fugge e s’appressa.,come l’onda che si ritrae e si avvicina.
1269,"«Qui si conviene usare un poco d’arte»,","«Qui è necessario usare un po’ d’accortezza », "
1270,"cominciò ’l duca mio, «in accostarsi","iniziò a dire la mia guida, «nell’avvicinarsi ora da una parte , "
1271,"or quinci, or quindi al lato che si parte».",ora dall’altra  al fianco della parete che rientra ». 
1272,"E questo fece i nostri passi scarsi,","E questo rese i nostri passi lenti ,"
1273,tanto che pria lo scemo de la luna,tanto che la luna calante  
1274,"rigiunse al letto suo per ricorcarsi,","era ritornata all’orizzonte per tramontare , "
1275,che noi fossimo fuor di quella cruna;,prima che noi fossimo fuori da quello scavato sentiero ; 
1276,ma quando fummo liberi e aperti,"ma quando ci liberammo e fummo in luogo aperto,"
1277,"sù dove il monte in dietro si rauna,","in alto dove il monte si ritrae  indietro, "
1278,ïo stancato e amendue incerti,essendo io stanco e ambedue incerti sulla strada
1279,"di nostra via, restammo in su un piano","da seguire, sostammo su un ripiano, "
1280,solingo più che strade per diserti.,più solitario delle strade che attraversano i deserti. 
1281,"Da la sua sponda, ove confina il vano,","Dalla parte esterna , dove confina con il vuoto ,"
1282,"al piè de l’alta ripa che pur sale,","fino alla base della parete che continua  a salire, "
1283,misurrebbe in tre volte un corpo umano;,misurerebbe circa tre volte la lunghezza del corpo umano; 
1284,"e quanto l’occhio mio potea trar d’ale,","e, fino a quanto il mio sguardo poteva spaziare , "
1285,"or dal sinistro e or dal destro fianco,","ora dalla parte sinistra, ora dalla destra,"
1286,questa cornice mi parea cotale.,questa cornice mi pareva della stessa misura . 
1287,"Là sù non eran mossi i piè nostri anco,","Lassù non avevamo ancora fatto un passo, "
1288,quand’ io conobbi quella ripa intorno,quando io mi accorsi che quella parte della ripa 
1289,"che dritto di salita aveva manco,","che era meno  ripida, "
1290,esser di marmo candido e addorno,era di marmo candido e decorata 
1291,"d’intagli sì, che non pur Policleto,","di bassorilievi  tali che non solo Policleto , "
1292,ma la natura lì avrebbe scorno.,ma la natura stessa sarebbe sconfitta . 
1293,L’angel che venne in terra col decreto,L’angelo  che scese in terra portando 
1294,"de la molt’ anni lagrimata pace,","con sé il decreto della pace , sospirata per lunghi secoli, "
1295,"ch’aperse il ciel del suo lungo divieto,","che aprì le porte del cielo sciogliendo il lungo divieto ,"
1296,dinanzi a noi pareva sì verace,"appariva lì davanti a noi così verosimile, "
1297,"quivi intagliato in un atto soave,","scolpito qui in un atteggiamento dolce,"
1298,che non sembiava imagine che tace.,da non sembrare una muta raffigurazione. 
1299,Giurato si saria ch’el dicesse ‘Ave!’;,Si sarebbe giurato che egli dicesse ‘Ave!’; 
1300,perché iv’ era imaginata quella,infatti vi era scolpita colei  
1301,ch’ad aprir l’alto amor volse la chiave;,che girò la chiave per aprire le porte all’amore divino ; 
1302,e avea in atto impressa esta favella,e nel suo atteggiamento  sembrava veramente dire : 
1303,"‘Ecce ancilla Deï’, propriamente","‘Ecco l’ancella di Dio’, in modo preciso "
1304,come figura in cera si suggella.,come nella cera si imprime la figura del sigillo . 
1305,"«Non tener pur ad un loco la mente»,","«Non rivolgere la tua attenzione sempre a un’unica scena », "
1306,"disse ’l dolce maestro, che m’avea","disse il caro maestro, rispetto al quale io"
1307,da quella parte onde ’l cuore ha la gente.,ero dalla parte del cuore . 
1308,"Per ch’i’ mi mossi col viso, e vedea","Perciò io mi spostai con lo sguardo, e vidi "
1309,"di retro da Maria, da quella costa","dietro  Maria, dalla parte "
1310,"onde m’era colui che mi movea,","in cui era colui che mi guidava , "
1311,un’altra storia ne la roccia imposta;,un’altra storia scolpita  nella roccia;
1312,"per ch’io varcai Virgilio, e fe’mi presso,",allora oltrepassai  Virgilio e mi avvicinai  
1313,acciò che fosse a li occhi miei disposta.,in modo che si offrisse ai miei occhi nella sua ampiezza .
1314,Era intagliato lì nel marmo stesso,"Erano scolpiti lì, sempre nel marmo, "
1315,"lo carro e ’ buoi, traendo l’arca santa,","il carro e i buoi che tiravano  l’Arca santa,"
1316,per che si teme officio non commesso.,per la quale l’uomo teme di svolgere un compito  che non gli è stato affidato . 
1317,"Dinanzi parea gente; e tutta quanta,","Davanti al carro appariva una folla; e tutta quanta,"
1318,"partita in sette cori, a’ due mie’ sensi","suddivisa in sette schiere , ai miei due sensi "
1319,"faceva dir l’un ‘No’, l’altro ‘Sì, canta’.","faceva dire all’uno  ‘No, non canta’, all’altro  ‘Sì, canta’. "
1320,Similemente al fummo de li ’ncensi,Allo stesso modo di fronte al fumo degli incensi 
1321,"che v’era imaginato, li occhi e ’l naso","che vi erano raffigurati, gli occhi e il naso  "
1322,e al sì e al no discordi fensi.,si fecero discordi  nell’affermare e nel negare. 
1323,"Lì precedeva al benedetto vaso,","Lì davanti all’Arca santa  avanzava Davide, "
1324,"trescando alzato, l’umile salmista,","l’umile cantore di salmi, danzando  con vesti succinte , "
1325,e più e men che re era in quel caso.,e in quell’occasione era più che re  e meno che un re .
1326,"Di contra, effigïata ad una vista","Di fronte a lui, scolpita alla finestra di un grande palazzo, "
1327,"d’un gran palazzo, Micòl ammirava","la moglie Micòl guardava stupita, "
1328,sì come donna dispettosa e trista.,come una donna sprezzante  e crucciata. 
1329,"I’ mossi i piè del loco dov’ io stava,","Io mossi i passi dal luogo dove mi ero fermato,"
1330,"per avvisar da presso un’altra istoria,","per osservare da vicino un’altra scena, "
1331,che di dietro a Micòl mi biancheggiava.,che risaltava sul marmo bianco  dopo la raffigurazione di Micòl. 
1332,Quiv’ era storïata l’alta gloria,Qui era scolpita  la storia dell’azione più gloriosa  
1333,"del roman principato, il cui valore","dell’imperatore  romano, la cui virtù fece sì "
1334,mosse Gregorio a la sua gran vittoria;,che Gregorio Magno si muovesse verso la sua grande vittoria;
1335,i’ dico di Traiano imperadore;,io parlo dell’imperatore Traiano; 
1336,"e una vedovella li era al freno,","e una vedovella era raffigurata mentre teneva le briglie del suo cavallo , "
1337,di lagrime atteggiata e di dolore.,in atteggiamento di pianto e di dolore. 
1338,Intorno a lui parea calcato e pieno,"Intorno a lui lo spazio era gemito  e pieno di una folla di cavalieri,"
1339,"di cavalieri, e l’aguglie ne l’oro",e gli stemmi delle aquile  ricamate nell’oro 
1340,sovr’ essi in vista al vento si movieno.,sembravano  muoversi al vento sopra di loro.
1341,La miserella intra tutti costoro,La povera donna in mezzo a tutta questa gente 
1342,"pareva dir: «Segnor, fammi vendetta","sembrava dire: «O Signore, rendimi giustizia "
1343,"di mio figliuol ch’è morto, ond’ io m’accoro»;","per mio figlio che è stato ucciso, e per il quale io piango disperata »;"
1344,ed elli a lei rispondere: «Or aspetta,e l’imperatore pareva risponderle: «Aspetta finché io torni». 
1345,"tanto ch’i’ torni»; e quella: «Segnor mio»,","E quella: «Mio Signore», con l’atteggiamento di una persona"
1346,"come persona in cui dolor s’affretta,","nel cui animo urge  il dolore,"
1347,"«se tu non torni?»; ed ei: «Chi fia dov’ io,","«se tu non tornassi?»; ed egli: «Chi occuperà  il mio posto , "
1348,la ti farà»; ed ella: «L’altrui bene,"ti renderà giustizia»; ed ella: «Il bene fatto da un altro a che ti gioverà , "
1349,"a te che fia, se ’l tuo metti in oblio?»;",se trascurerai  di farlo tu stesso?»; 
1350,ond’ elli: «Or ti conforta; ch’ei convene,per cui egli: «Fatti ora coraggio; 
1351,ch’i’ solva il mio dovere anzi ch’i’ mova:,ché è giusto  che io compia il mio dovere prima che io parta:
1352,giustizia vuole e pietà mi ritene».,"lo vuole la giustizia, e la pietà mi impedisce di partire »."
1353,Colui che mai non vide cosa nova,"Dio, per il quale nessuna cosa è nuova,"
1354,"produsse esto visibile parlare,",fu l’artefice  di questo linguaggio 
1355,novello a noi perché qui non si trova.,"che diventa immagine , meraviglioso  per noi perché sulla terra non si trova. "
1356,Mentr’ io mi dilettava di guardare,Mentre io godevo ad ammirare le raffigurazioni 
1357,"l’imagini di tante umilitadi,","di così celebri atti di umiltà, preziose  a vedersi "
1358,"e per lo fabbro loro a veder care,","e per via del loro artefice ,"
