,Purgatorio,Parafrasi
0,Per correr miglior acque alza le vele,alza le vele per percorrere acque più tranquille
1,"omai la navicella del mio ingegno,","ormai la piccola nave del mio ingegno ,"
2,che lascia dietro a sé mar sì crudele;,"che lascia alle proprie spalle un mare così crudele,"
3,e canterò di quel secondo regno,"e tratterò in versi  del secondo regno , "
4,dove l’umano spirito si purga,dove l’anima umana si purifica  
5,e di salire al ciel diventa degno.,e diventa degna di salire in Paradiso . 
6,"Ma qui la morta poesì resurga,","Ma qui la poesia, che cantava il regno dei morti , risorga, "
7,"o sante Muse, poi che vostro sono;","o sante Muse, poiché sono vostro, "
8,"e qui Calïopè alquanto surga,",e Calliope alzi un po’ il tono della poesia  
9,seguitando il mio canto con quel suono,accompagnando  il mio canto con quell’armonia  
10,di cui le Piche misere sentiro,da cui le Piche disgraziate  ricevettero 
11,"lo colpo tal, che disperar perdono.",un colpo tale che disperarono di trovare perdono. 
12,"Dolce color d’orïental zaffiro,","Un gradito  colore azzurro simile a uno zaffiro orientale, "
13,che s’accoglieva nel sereno aspetto,che si concentrava diffondendosi  nell’aspetto sereno 
14,"del mezzo, puro infino al primo giro,","dell’aria , tersa fino all’orizzonte , "
15,"a li occhi miei ricominciò diletto,","ricominciò a dare ai miei occhi la gioia, "
16,tosto ch’io usci’ fuor de l’aura morta,"non appena io uscii dalle tenebre  infernali , "
17,che m’avea contristati li occhi e ’l petto.,che mi avevano rattristato  gli occhi e il petto.
18,Lo bel pianeto che d’amar conforta,Il bel pianeta  che invita  ad amare
19,"faceva tutto rider l’orïente,","faceva risplendere  tutta la parte orientale del cielo, "
20,velando i Pesci ch’erano in sua scorta.,"offuscando la costellazione dei Pesci, che era in congiunzione  con esso. "
21,"I’ mi volsi a man destra, e puosi mente","Io mi girai dalla parte destra, e guardai con attenzione "
22,"a l’altro polo, e vidi quattro stelle","l’altro polo , e vidi quattro stelle "
23,non viste mai fuor ch’a la prima gente.,che non furono mai viste da nessuno fuorché dai primi uomini . 
24,Goder pareva ’l ciel di lor fiammelle:,Il cielo sembrava godere delle loro fiamme: 
25,"oh settentrïonal vedovo sito,","oh, terre settentrionali impoverite , "
26,poi che privato se’ di mirar quelle!,poiché non vi è concesso di vederle!  
27,"Com’ io da loro sguardo fui partito,","Appena io mi distolsi  dal guardarle, "
28,"un poco me volgendo a l ’altro polo,","rivolgendomi un poco verso l’altro polo, "
29,"là onde ’l Carro già era sparito,","dalla parte in cui la costellazione dell’Orsa maggiore  era già tramontata, "
30,"vidi presso di me un veglio solo,","vidi accanto a me un vecchio  solitario,"
31,"degno di tanta reverenza in vista,","dall’aspetto  degno di tanta venerazione ,"
32,che più non dee a padre alcun figliuolo.,che nessun figliuolo ne deve una maggiore al padre. 
33,Lunga la barba e di pel bianco mista,"Aveva la barba lunga e brizzolata , "
34,"portava, a’ suoi capelli simigliante,","come  i capelli, che gli scendevano"
35,de’ quai cadeva al petto doppia lista.,sul petto in due bande . 
36,Li raggi de le quattro luci sante,I raggi delle quattro sante stelle  adornavano  
37,"fregiavan sì la sua faccia di lume,","talmente il suo viso di luce, "
38,ch’i’ ’l vedea come ’l sol fosse davante.,che io lo vedevo come se il sole fosse davanti a lui. 
39,«Chi siete voi che contro al cieco fiume,«Chi siete voi che risalendo a ritroso 
40,"fuggita avete la pregione etterna?»,","il fiume sotterraneo siete fuggiti dall’eterno carcere ?»,"
41,"diss’ el, movendo quelle oneste piume.",disse facendo ondeggiare la veneranda barba .
42,"«Chi v’ha guidati, o che vi fu lucerna,","«Chi vi ha guidati, o che cosa vi fece luce , "
43,uscendo fuor de la profonda notte,per uscire fuori dalla tenebra  profonda 
44,che sempre nera fa la valle inferna?,che rende sempre buia la voragine dell’Inferno? 
45,Son le leggi d’abisso così rotte?,Le leggi infernali sono quindi da voi violate ? 
46,"o è mutato in ciel novo consiglio,","oppure in cielo è stata fatta una nuova legge ,"
47,"che, dannati, venite a le mie grotte?».",che permette a voi dannati di venire alle rocce  che custodisco ?».
48,"Lo duca mio allor mi diè di piglio,",A questo punto la mia guida mi afferrò  
49,e con parole e con mani e con cenni,e con parole e con le mani e con cenni 
50,reverenti mi fé le gambe e ’l ciglio.,mi fece inginocchiare e chinare gli occhi in segno di reverenza . 
51,Poscia rispuose lui: «Da me non venni:,Dopo  rispose a lui: «Non sono venuto di mia iniziativa : 
52,"donna scese del ciel, per li cui prieghi",una donna scese dal cielo e per le sue preghiere  
53,de la mia compagnia costui sovvenni.,aiutai  costui con la mia compagnia. 
54,Ma da ch’è tuo voler che più si spieghi,Ma poiché  è tuo desiderio che si dichiari meglio  
55,"di nostra condizion com’ ell’ è vera,","quale sia veramente  la nostra condizione, "
56,esser non puote il mio che a te si nieghi.,non può essere che il mio volere  si neghi a te. 
57,Questi non vide mai l’ultima sera;,Questi non vide mai la sera che precede la morte ; 
58,"ma per la sua follia le fu sì presso,","però a causa del suo traviamento  le fu così vicino ,"
59,che molto poco tempo a volger era.,che sarebbe bastato poco perché la raggiungesse. 
60,"Sì com’ io dissi, fui mandato ad esso","Così, come ho detto, sono stato mandato in suo soccorso "
61,per lui campare; e non lì era altra via,per salvarlo ; e non vi era nessun’altra strada 
62,che questa per la quale i’ mi son messo.,da seguire se non questa che ho intrapreso.
63,Mostrata ho lui tutta la gente ria;,Ho fatto vedere a lui tutti i dannati dell’Inferno ; 
64,e ora intendo mostrar quelli spirti,e adesso ho intenzione di fargli vedere quelle anime 
65,che purgan sé sotto la tua balìa.,che si purgano sotto la tua custodia . 
66,"Com’ io l’ho tratto, saria lungo a dirti;","Come io abbia fatto a guidarlo  fin qui, sarebbe  troppo lungo da raccontare; "
67,de l’alto scende virtù che m’aiuta,dal cielo scende una virtù che mi aiuta 
68,conducerlo a vederti e a udirti.,a condurlo alla tua presenza e ad ascoltarti.
69,Or ti piaccia gradir la sua venuta:,Ora ti prego di approvare  il suo arrivo: 
70,"libertà va cercando, ch’è sì cara,","egli è alla ricerca della libertà, che è così preziosa, "
71,come sa chi per lei vita rifiuta.,come sa bene chi per lei rinuncia alla vita.
72,"Tu ’l sai, ché non ti fu per lei amara","Tu lo sai bene, perché la morte non ti fu amara "
73,"in Utica la morte, ove lasciasti","in Utica, dove lasciasti il corpo  che nel giorno"
74,la vesta ch’al gran dì sarà sì chiara.,del Giudizio universale  sarà così luminoso . 
75,"Non son li editti etterni per noi guasti,","Le leggi  eterne non sono violate  a causa nostra , "
76,ché questi vive e Minòs me non lega;,perché questi è vivo e io non sono legato dalla giurisdizione  di Minosse; 
77,ma son del cerchio ove son li occhi casti,ma sono del cerchio  in cui si trovano gli occhi casti 
78,"di Marzia tua, che ’n vista ancor ti priega,","della tua Marzia, che nell’aspetto  ti prega ancora, "
79,"o santo petto, che per tua la tegni:","o anima  santa, che la consideri  tua moglie: "
80,per lo suo amore adunque a noi ti piega.,"per il suo amore, dunque, accogli la nostra preghiera . "
81,Lasciane andar per li tuoi sette regni;,Lasciaci andare per le sette cornici da te custodite ;
82,"grazie riporterò di te a lei,","io riferirò a lei della tua gentilezza, "
83,se d’esser mentovato là giù degni».,se ti degni di essere ricordato  laggiù nell’Inferno».
84,«Marzïa piacque tanto a li occhi miei,«Marzia fu così gradita ai miei occhi fino a quando 
85,"mentre ch’i’ fu’ di là», diss’ elli allora,","io fui sulla terra», egli disse allora, «che le concessi  "
86,"«che quante grazie volse da me, fei.",tutte le cose gradite  che ella volle  da me. 
87,"Or che di là dal mal fiume dimora,","Ora che dimora al di là del fiume infernale , "
88,"più muover non mi può, per quella legge","non può più commuovermi , per quella legge "
89,che fatta fu quando me n’usci’ fora.,che fu fatta quando uscii fuori . 
90,"Ma se donna del ciel ti move e regge,","Ma se, come tu dici, una donna del cielo ti permette di andare  e ti guida , "
91,"come tu di’, non c’è mestier lusinghe:",queste lusinghe non sono necessarie :
92,bastisi ben che per lei mi richegge.,è pienamente sufficiente che me lo chieda nel suo nome . 
93,"Va dunque, e fa che tu costui ricinghe","Va’ pure, dunque, bada di cingere costui "
94,"d’un giunco schietto e che li lavi ’l viso,","con un giunco liscio  e di lavargli il viso,"
95,sì ch’ogne sucidume quindi stinghe;,in modo da cancellare  da esso  ogni traccia di sporcizia ; 
96,"ché non si converria, l’occhio sorpriso",perché sarebbe sconveniente  presentarsi con gli occhi offuscati  
97,"d’alcuna nebbia, andar dinanzi al primo","da qualche nebbia davanti al primo angelo , "
98,"ministro, ch’è di quei di paradiso.",che è di quelli che stanno in Paradiso.
99,"Questa isoletta intorno ad imo ad imo,","Questa piccola isola tutt’intorno, nel punto più basso ,"
100,"là giù colà dove la batte l’onda,","laggiù dove si infrange l’onda,"
101,porta di giunchi sovra ’l molle limo:,produce  giunchi sul molle terreno fangoso :
102,null’ altra pianta che facesse fronda,nessun’altra pianta che mettesse rami con foglie  
103,"o indurasse, vi puote aver vita,","o avesse un fusto rigido , vi potrebbe crescere, "
104,però ch’a le percosse non seconda.,perché non si piega ai colpi  delle onde. 
105,Poscia non sia di qua vostra reddita;,Poi non ritornate  per questa strada; 
106,"lo sol vi mosterrà, che surge omai,","il sole, che ora sta sorgendo, vi farà vedere  dove affrontare  "
107,prendere il monte a più lieve salita».,il monte per una più facile ascensione ».
108,Così sparì; e io sù mi levai,Quindi scomparve; e io mi alzai in piedi 
109,"sanza parlare, e tutto mi ritrassi","senza dir nulla, e mi accostai tutto stretto "
110,"al duca mio, e li occhi a lui drizzai.","alla mia guida, e rivolsi i miei occhi a lui. "
111,"El cominciò: «Figliuol, segui i miei passi:","Egli cominciò: «Figliuolo, segui i miei passi: "
112,"volgianci in dietro, ché di qua dichina","volgiamoci  indietro, perché da questa parte la pianura discende "
113,questa pianura a’ suoi termini bassi».,fino al suo punto  più basso».
114,L’alba vinceva l’ora mattutina,L’alba spingeva via vittoriosamente  l’ultima ora della notte  
115,"che fuggia innanzi, sì che di lontano","che fuggiva innanzi a essa, tanto che in lontananza "
116,conobbi il tremolar de la marina.,riconobbi il tremito delle onde del mare . 
117,Noi andavam per lo solingo piano,"Noi andavamo attraverso il solitario  pianoro, "
118,"com’ om che torna a la perduta strada,","come un uomo che ritorna verso la via smarrita e a cui,"
119,che ’nfino ad essa li pare ire in vano.,"finché non la raggiunge, sembra di fare un cammino  inutile. "
120,Quando noi fummo là ’ve la rugiada,Quando noi giungemmo là dove la rugiada resiste  
121,"pugna col sole, per essere in parte","al calore del sole, perché sta in un luogo  in cui, "
122,"dove, ad orezza, poco si dirada,","all’ombra , evapora  lentamente,"
123,ambo le mani in su l’erbetta sparte,il mio maestro pose dolcemente ambedue le mani aperte  
124,soavemente ’l mio maestro pose:,"sull’erba tenera: per cui io, che compresi subito "
125,"ond’ io, che fui accorto di sua arte,","il significato  della sua operazione , "
126,porsi ver’ lui le guance lagrimose;,rivolsi verso di lui le mie guance segnate di lacrime ;
127,ivi mi fece tutto discoverto,lì mi rese interamente visibile  
128,quel color che l’inferno mi nascose.,quel colore che l’Inferno aveva offuscato. 
129,"Venimmo poi in sul lito diserto,","Andammo poi sulla spiaggia  deserta, "
130,che mai non vide navicar sue acque,"che non vide mai essere vivente  navigare le sue acque,"
131,"omo, che di tornar sia poscia esperto.",che sia poi stato in grado  di fare l’esperienza del ritorno. 
132,Quivi mi cinse sì com’ altrui piacque:,In questo luogo  mi cinse  nel modo desiderato dalla volontà divina : 
133,oh maraviglia! ché qual elli scelse,oh meraviglia! perché come egli scelse 
134,"l’umile pianta, cotal si rinacque","l’umile pianta, essa rinacque tale e quale all’istante  "
135,subitamente là onde l’avelse.,nel luogo dove l’aveva strappata . 
136,Già era ’l sole a l’orizzonte giunto,Il sole aveva già raggiunto l’orizzonte
137,lo cui meridïan cerchio coverchia,il cui  meridiano sovrasta  
138,Ierusalèm col suo più alto punto;,col suo punto più  alto Gerusalemme; 
139,"e la notte, che opposita a lui cerchia,","e la notte, che gira   opposta al sole,"
140,"uscia di Gange fuor con le Bilance,","spuntava dalle foci   del Gange nella costellazione delle Bilance, "
141,che le caggion di man quando soverchia;,che le  cadono di mano quando supera la durata del giorno  ;
142,"sì che le bianche e le vermiglie guance,","in modo che, là dove io mi trovavo, le  gote, prima bianche, "
143,"là dov’ i’ era, de la bella Aurora","poi vermiglie, della leggiadra  Aurora, "
144,per troppa etate divenivan rance.,"col passare del tempo ,  trascoloravano in dorato . "
145,"Noi eravam lunghesso mare ancora,","Noi eravamo ancora presso  la  riva del mare, "
146,"come gente che pensa a suo cammino,",come coloro che pensano al proprio  viaggio 
147,che va col cuore e col corpo dimora.,e procedono con il desiderio  mentre  stanno fermi con il corpo.  
148,"Ed ecco, qual, sorpreso dal mattino,","Ed ecco, come colto dall’alba, Marte,"
149,per li grossi vapor Marte rosseggia,"abbassandosi sulla superficie  del mare, "
150,"giù nel ponente sovra ’l suol marino,","verso  ponente, si colora di rosso, a causa dei vapori densi  che lo avvolgono,"
151,"cotal m’apparve, s’io ancor lo veggia,","così mi apparve, e possa io   vederla  ancora, "
152,"un lume per lo mar venir sì ratto,",una luce avanzare sul mare  così rapidamente  
153,che ’l muover suo nessun volar pareggia.,che nessun volo può uguagliare  il suo modo di muoversi. 
154,Dal qual com’ io un poco ebbi ritratto,Dopo aver distolto  per un attimo 
155,"l’occhio per domandar lo duca mio,","lo  sguardo da essa  per interrogare  la mia guida, "
156,rividil più lucente e maggior fatto.,la rividi divenuta più luminosa e  più grande.  
157,Poi d’ogne lato ad esso m’appario,Poi da ogni parte di questa luce mi apparve   
158,"un non sapeva che bianco, e di sotto","un’indistinta  forma  bianca, e più in basso "
159,a poco a poco un altro a lui uscìo.,si delineò  a poco a  poco un’altra forma bianca.  
160,"Lo mio maestro ancor non facea motto,","Il mio maestro tacque   ancora, "
161,mentre che i primi bianchi apparver ali;,finché  le prime forme bianche  non si rivelarono come ali;
162,"allor che ben conobbe il galeotto,","appena fu ben certo di  riconoscere il nocchiero ,"
163,"gridò: «Fa, fa che le ginocchia cali.","gridò: «Presto,  piega le ginocchia . "
164,Ecco l’angel di Dio: piega le mani;,Ecco l’angelo  di Dio: congiungi  le mani; 
165,omai vedrai di sì fatti officiali.,da ora in poi vedrai  solo ministri  come questo. 
166,"Vedi che sdegna li argomenti umani,","Vedi che non adopera  mezzi  umani,"
167,"sì che remo non vuol, né altro velo",tanto che non necessita  né  di remi né di vele 
168,"che l’ali sue, tra liti sì lontani.","che non siano le sue ali, per  muoversi da luoghi così lontani.  "
169,"Vedi come l’ha dritte verso ’l cielo,","Vedi come le tiene rivolte  al cielo, "
170,"trattando l’aere con l’etterne penne,","fendendo  l’aria con le piume incorruttibili  , "
171,che non si mutan come mortal pelo».,che non si trasformano come il pelo dei  mortali».
172,"Poi, come più e più verso noi venne","Poi, a mano a mano che  la creatura  alata  "
173,"l’uccel divino, più chiaro appariva:","si avvicinava a noi, appariva  sempre più luminosa: "
174,"per che l’occhio da presso nol sostenne,","perciò gli occhi non riuscivano  a fissarla  da vicino, "
175,ma chinail giuso; e quei sen venne a riva,tanto che li chinai  verso il basso; intanto essa raggiunse la riva 
176,"con un vasello snelletto e leggero,","con una  barchetta leggera , "
177,tanto che l’acqua nulla ne ’nghiottiva.,che non si immergeva  nell’acqua neppure in parte. 
178,"Da poppa stava il celestial nocchiero,","Il nocchiero celestiale stava a poppa, "
179,tal che faria beato pur descripto;,in  tale atteggiamento che la sola descrizione  darebbe  beatitudine; 
180,e più di cento spirti entro sediero.,e molte anime  sedevano dentro.  
181,‘In exitu Isräel de Aegypto’,«In exitu Isräel de Aegypto»  
182,cantavan tutti insieme ad una voce,"cantavano tutti in coro, "
183,con quanto di quel salmo è poscia scripto.,proseguendo il salmo con quanto è scritto dopo.  
184,Poi fece il segno lor di santa croce;,Poi li benedisse col segno della santa croce;  
185,ond’ ei si gittar tutti in su la piaggia:,allora essi si precipitarono tutti sulla spiaggia;
186,"ed el sen gì, come venne, veloce.","ed egli  se ne andò , velocemente come era venuto."
187,"La turba che rimase lì, selvaggia",La moltitudine rimasta lì sembrava inesperta   
188,"parea del loco, rimirando intorno","del luogo, si guardava intorno, "
189,come colui che nove cose assaggia.,come  colui che sperimenta per la prima volta cose sconosciute .
190,Da tutte parti saettava il giorno,"Il sole lampeggiava  la luce diurna  in tutte le parti del cielo, "
191,"lo sol, ch’avea con le saette conte",dopo avere con le sue  saette infallibili 
192,"di mezzo ’l ciel cacciato Capricorno,","cacciato il Capricorno  dal  punto più alto  del cielo, "
193,quando la nova gente alzò la fronte,allorché la gente  appena arrivata  alzò lo sguardo 
194,"ver’ noi, dicendo a noi: «Se voi sapete,","verso di noi, dicendoci: «Se la conoscete,"
195,mostratene la via di gire al monte».,indicateci la via per  raggiungere  il monte».
196,E Virgilio rispuose: «Voi credete,E Virgilio rispose: «Voi forse pensate 
197,forse che siamo esperti d’esto loco;,che  siamo pratici  di questo luogo;
198,ma noi siam peregrin come voi siete.,ma noi  siamo forestieri  come voi.
199,"Dianzi venimmo, innanzi a voi un poco,","Giungemmo  poco fa, appena prima di voi,"
200,"per altra via, che fu sì aspra e forte,","attraverso una strada  diversa, che fu talmente penosa e opprimente,"
201,che lo salire omai ne parrà gioco».,che  adesso la salita ci sembrerà un gioco».
202,"L’anime, che si fuor di me accorte,","Le anime, che si erano accorte, "
203,"per lo spirare, ch’i’ era ancor vivo,","dal mio  respirare, che ero ancora vivo,"
204,maravigliando diventaro smorte.,impallidirono per la  meraviglia . 
205,E come a messagger che porta ulivo,E come la gente accorre  intorno  a un messaggero 
206,"tragge la gente per udir novelle,","che reca un ramoscello d’ulivo,  per sentire notizie  "
207,"e di calcar nessun si mostra schivo,","e nessuno si sottrae  alla calca, "
208,così al viso mio s’affisar quelle,così tutte quelle anime destinate alla salvezza 
209,"anime fortunate tutte quante,","puntarono su di me  i loro sguardi ,"
210,quasi oblïando d’ire a farsi belle.,quasi scordando   di andare a purificarsi .  
211,Io vidi una di lor trarresi avante,Io vidi una di loro farsi avanti   
212,"per abbracciarmi con sì grande affetto,","per abbracciarmi, con tanto affetto "
213,che mosse me a far lo somigliante.,che mi spinse a  ricambiare . 
214,"Ohi ombre vane, fuor che ne l’aspetto!","Ohi ombre inconsistenti, fuorché nell’aspetto!"
215,"tre volte dietro a lei le mani avvinsi,","Tre volte la strinsi  con le mani in  un abbraccio,"
216,e tante mi tornai con esse al petto.,e altrettante  volte esse mi tornarono al petto.  
217,"Di maraviglia, credo, mi dipinsi;","Credo di aver mostrato il mio stupore , "
218,"per che l’ombra sorrise e si ritrasse,","poiché l’ombra sorrise e  si tirò indietro,"
219,"e io, seguendo lei, oltre mi pinsi.","e io, seguendola, avanzai ."
220,Soavemente disse ch’io posasse;,Con voce soave mi chiese di fermarmi ;
221,"allor conobbi chi era, e pregai",in quel momento lo riconobbi e pregai
222,"che, per parlarmi, un poco s’arrestasse.",che si fermasse un poco per parlarmi.  
223,Rispuosemi: «Così com’ io t’amai,Egli mi rispose: «Così come io ti amai 
224,"nel mortal corpo, così t’amo sciolta:","quando avevo il corpo mortale, così ti amo ora che ne  sono slegato : "
225,però m’arresto; ma tu perché vai?».,perciò  mi fermo; ma tu perché fai questo cammino?».  
226,"«Casella mio, per tornar altra volta","«Casella mio, io faccio  questo viaggio  "
227,"là dov’ io son, fo io questo vïaggio»,","per poter tornare ancora in questo luogo»,"
228,diss’ io; «ma a te com’ è tanta ora tolta?».,"dissi io,  «ma come mai a te è stato tolto tanto tempo ?»."
229,"Ed elli a me: «Nessun m’è fatto oltraggio,","Ed egli a me: «Nessun torto  mi è  stato fatto, "
230,"se quei che leva quando e cui li piace,","se colui che preleva  quando e chi   egli preferisce , "
231,più volte m’ha negato esto passaggio;,ha rifiutato diverse volte di  trasportarmi qui ;
232,ché di giusto voler lo suo si face:,perché la sua volontà procede  dalla giustizia : 
233,veramente da tre mesi elli ha tolto,tuttavia  da tre mesi egli ha preso  
234,"chi ha voluto intrar, con tutta pace.","tutti coloro che hanno chiesto di imbarcarsi, senza alcuna difficoltà .  "
235,"Ond’ io, ch’era ora a la marina vòlto","Per cui io, che ero allora giunto  sulla  spiaggia  "
236,"dove l’acqua di Tevero s’insala,","nel punto in cui l’acqua del Tevere  sfocia in mare , "
237,benignamente fu’ da lui ricolto.,fui accolto  da lui  con benevolenza. 
238,"A quella foce ha elli or dritta l’ala,","Ora egli  ha diretto le sue ali in direzione di quella foce, "
239,però che sempre quivi si ricoglie,poiché  lì si continuano  a raccogliere  
240,qual verso Acheronte non si cala».,coloro che non devono  scendere  verso l’Acheronte». 
241,E io: «Se nuova legge non ti toglie,E io: «Se la nuova legge non ti impedisce  di ricordare  
242,memoria o uso a l’amoroso canto,"o di eseguire   il canto d’amore, "
243,"che mi solea quetar tutte mie doglie,","che era solito dar quiete  a  tutti i miei affanni, "
244,di ciò ti piaccia consolare alquanto,ti piaccia con questo consolare  un poco
245,"l’anima mia, che, con la sua persona","il mio spirito, che, giungendo qui "
246,"venendo qui, è affannata tanto!».","con il  peso del corpo , è tanto affaticato!».  "
247,‘Amor che ne la mente mi ragiona’,‘Amor che ne la mente mi ragiona’ 
248,"cominciò elli allor sì dolcemente,","egli  allora cominciò così dolcemente,"
249,che la dolcezza ancor dentro mi suona.,che la dolcezza  mi risuona ancora nel cuore .  
250,Lo mio maestro e io e quella gente,Il mio maestro e io e quelle anime 
251,"ch’eran con lui parevan sì contenti,","che  erano con lui apparivamo così rasserenati,"
252,come a nessun toccasse altro la mente.,come  se a nessuno altri pensieri  sfiorassero la mente.  
253,Noi eravam tutti fissi e attenti,Noi eravamo tutti concentrati  e attenti 
254,a le sue note; ed ecco il veglio onesto,al suo canto; quando il venerabile  vecchio  giunse
255,"gridando: «Che è ciò, spiriti lenti?","gridando: «Che cosa significa  questo, spiriti pigri ? "
256,"qual negligenza, quale stare è questo?","Quale negligenza, quale  indugio  è questo?"
257,Correte al monte a spogliarvi lo scoglio,Correte verso il monte per  liberarvi  dalla scorza  
258,ch’esser non lascia a voi Dio manifesto».,che non  vi permette di vedere  Dio». 
259,"Come quando, cogliendo biado o loglio,","Come i colombi radunati per il pasto  , "
260,"li colombi adunati a la pastura,","mentre beccano  semi di  biada o di zizzania ,"
261,"queti, sanza mostrar l’usato orgoglio,","quieti, senza mostrare  la consueta  baldanza ,"
262,"se cosa appare ond’ elli abbian paura,",lasciano  improvvisamente  il cibo  
263,"subitamente lasciano star l’esca,","se si  manifesta qualcosa che li spaventa,"
264,perch’ assaliti son da maggior cura;,perché sono  assaliti da una preoccupazione  maggiore; 
265,così vid’ io quella masnada fresca,"così io vidi quella compagnia di anime   giunta da poco ,"
266,"lasciar lo canto, e fuggir ver’ la costa,","abbandonare il canto, e  fuggire verso la salita, "
267,"com’ om che va, né sa dove rïesca;",come un uomo che fugge  senza sapere dove andrà a finire ; 
268,né la nostra partita fu men tosta.,né la  nostra partenza  fu meno precipitosa .
269,Avvegna che la subitana fuga,Benché  la fuga improvvisa 
270,"dispergesse color per la campagna,","disperdesse  per la pianura le anime ,"
271,"rivolti al monte ove ragion ne fruga,","in direzione  del monte verso il quale la giustizia divina  ci stimola ,"
272,i’ mi ristrinsi a la fida compagna:,io mi accostai  alla fidata compagnia :
273,e come sare’ io sanza lui corso?,e come avrei potuto correre  senza di lui?
274,chi m’avria tratto su per la montagna?,chi mi avrebbe condotto  su per la montagna?
275,El mi parea da sé stesso rimorso:,Egli mi pareva assalito da un personale  rimorso:
276,"o dignitosa coscïenza e netta,","o nobile e pura coscienza,"
