Original,Translate_de_1
" e io temëa ’l foco quinci, e quindi temeva cader giuso","Und ich fürchtete das Feuer auf der einen Seite, daß ich in die Leere falle auf der anderen Seite."
 Lo duca mio dicea,Mein Meister sagte:
" «Per questo loco si vuol tenere a li occhi stretto il freno, però ch’errar potrebbesi per poco»","An diesem Ort müssen wir unseren Blick auf unsere Schritte konzentrieren, denn man könnte leicht einen Fuß ins Wanken stecken."
" ‘Summae Deus clementïae’ nel seno al grande ardore allora udi’ cantando, che di volger mi fé caler non meno","Da spürte ich, daß jemand in der großen Flamme sang ""O Herr der Gnade,"" was mir große Sehnsucht machte, mich umzudrehen."
 e vidi spirti per la fiamma andando,"Und ich sah Seelen, die im Feuer wandelten."
 per ch’io guardava a loro e a’ miei passi compartendo la vista a quando a quando,Da schaute ich auf sie und auf meine Schritte und teilte meinen Blick auf die einen und auf die anderen.
" Appresso il fine ch’a quell’ inno fassi, gridavano alto","Nachdem die Seelen die Hymne gesungen hatten, schrieen sie laut."
 ‘Virum non cognosco’,"""Ich kenne keinen Mann"""
 indi ricominciavan l’inno bassi,"Dann fingen die Hymne an, leise zu reden."
" Finitolo, anco gridavano","Nachdem die Hymne beendet war, schrieen sie wieder."
" «Al bosco si tenne Diana, ed Elice caccionne che di Venere avea sentito il tòsco»","Diana lebte in den Wäldern, und sie vertrieb die Nymphe Callistus, der das Gift der Venus ausprobiert hatte."
 Indi al cantar tornavano,Also kehrten sie zurück zur Hymne
 indi donne gridavano e mariti che fuor casti come virtute e matrimonio imponne,"und schrieen nach Weibern und Ehemännern, die keusch waren, wie ihnen das Eheband auferlegt."
 E questo modo credo che lor basti per tutto il tempo che ’l foco li abbruscia,"Und ich glaube, dass diese Art und Weise von ihnen gehalten wird, solange das Feuer sie brennt."
 con tal cura conviene e con tai pasti che la piaga da sezzo si ricuscia,Mit dieser Medizin und solchen Lebensmitteln müssen sie schließlich ihre Plage beseitigen.
" Mentre che sì per l’orlo, uno innanzi altro, ce n’andavamo, e spesso il buon maestro diceami","Während wir so weitergingen am Rand des Rahmen hintereinander, und oft sagte Virgil zu mir:"
 «Guarda,Seien Sie vorsichtig.
 giovi ch’io ti scaltro»,"Es ist nützlich, dass ich dir den Weg zeige."
" feriami il sole in su l’omero destro, che già, raggiando, tutto l’occidente mutava in bianco aspetto di cilestro","meine rechte Schulter war von der Sonne geschlagen, die nun mit ihren Strahlen den ganzen Westen von blau zu weiß verwandelte."
 e io facea con l’ombra più rovente parer la fiamma,Und ich ließ mit meinem Schatten die Flamme roter werden.
" e pur a tanto indizio vidi molt’ ombre, andando, poner mente","Und ich sah viele Seelen, während sie gingen, und merkten diesen Hinweis."
 Questa fu la cagion che diede inizio loro a parlar di me,"Das war der Grund, warum er sie dazu brachte, über mich zu sprechen."
 e cominciarsi a dir,und fingen an zu sagen
 «Colui non par corpo fittizio»,Die scheinen keinen umbratenen Körper zu haben.
" poi verso me, quanto potëan farsi, certi si fero, sempre con riguardo di non uscir dove non fosser arsi","Und es kamen etliche zu mir, so viel es ihm erlaubt war, und hielten acht, daß sie nicht aus der Flamme herausgingen, die sie verbrannte."
" «O tu che vai, non per esser più tardo, ma forse reverente, a li altri dopo, rispondi a me che ’n sete e ’n foco ardo","""Du aber, der du nach den andern zwei machst, um nicht langsamer zu sein, sondern vielleicht aus Vergnügung, erhöre mich, daß ich nach dem Feuer und nach dem Durst nach dem Wissen harre."""
 Né solo a me la tua risposta è uopo,Deine Antwort ist nicht nur für mich notwendig
 ché tutti questi n’hanno maggior sete che d’acqua fredda Indo o Etïopo,Denn alle diese Büßer sind dürstiger als die Einwohner Indiens oder Äthiopiens mit kaltem Wasser.
" Dinne com’ è che fai di te parete al sol, pur come tu non fossi ancora di morte intrato dentro da la rete»","Sag uns, wie es möglich ist, dass du einen Schatten schießt, als ob du noch nicht in das Netz des Todes gekommen wärst."
 Sì mi parlava un d’essi,So sprach einer der Büßer zu mir:
" e io mi fora già manifesto, s’io non fossi atteso ad altra novità ch’apparve allora","und ich hätte mich bereits offenbart, wenn ich mich nicht zu einem anderen Neuen gewandt hätte, das gerade in diesem Augenblick erschien."
" ché per lo mezzo del cammino acceso venne gente col viso incontro a questa, la qual mi fece a rimirar sospeso","Denn mitten in der Feuermauer kam ein Heer, das sein Angesicht zu ihr wandte, und verführte mich, verwundert zu sehen."
" Lì veggio d’ogne parte farsi presta ciascun’ ombra e basciarsi una con una sanza restar, contente a brieve festa","Da sah ich jede Seele beider Heerscharen, den Schritt zu beschleunigen und sich zu küssen mit einander, ohne zu still zu stehen, freudig über diesen schnellen, festlichen Gruß."
" così per entro loro schiera bruna s’ammusa l’una con l’altra formica, forse a spïar lor via e lor fortuna","so berühren sich die Ameisen in ihrem dunklen Heer miteinander, daß sie sich fragen, wie sie gehen und welche Früchte ihre Arbeit hat."
" Tosto che parton l’accoglienza amica, prima che ’l primo passo lì trascorra, sopragridar ciascuna s’affatica","Sobald diese fröhlichen Gastfreundschaften unterbrochen wurden, noch bevor die Seelen einen Schritt nach vorn gingen, schrie jede von ihnen so viel, wie sie konnte."
 la nova gente,Die Neuankömmlinge schrieen
 «Soddoma e Gomorra»,"""Sodom"" und ""Gomorra"""
 e l’altra,und die anderen
" «Ne la vacca entra Pasife, perché ’l torello a sua lussuria corra»","""Pasifae tritt in die hölzerne Kuh ein, denn der Stier läuft, um seine Lust zu befriedigen."""
" Poi, come grue ch’a le montagne Rife volasser parte, e parte inver’ l’arene, queste del gel, quelle del sole schife, ","Dann, wie ein Kran, der sich absurd trennte, indem er einige in die Rife-Berge und andere in die Wüsten flog,"
" l’una gente sen va, l’altra sen vene","eine Schar geht weg, und die andere geht in die entgegengesetzte Richtung."
" e tornan, lagrimando, a’ primi canti e al gridar che più lor si convene","und weinend kehren sie zurück zu dem, was sie zuvor gesungen haben, und zu den Schreien, die ihnen am meisten zugefallen sind."
" e raccostansi a me, come davanti, essi medesmi che m’avean pregato, attenti ad ascoltar ne’ lor sembianti","Und die Reueigen, die zu mir gebetet hatten, kamen zu mir wie zuvor und sahen zu, daß sie auf mich hörten."
" Io, che due volte avea visto lor grato, incominciai","Ich, die ich zweimal gesehen hatte, was sie wollten, begann"
" «O anime sicure d’aver, quando che sia, di pace stato, non son rimase acerbe né mature le membra mie di là, ","O Seelen, die sicher sind, wenn es sein wird, ewigen Frieden zu erlangen, sind meine Glieder auf der Erde weder sauer noch reif geblieben,"
 ma son qui meco col sangue suo e con le sue giunture,"aber ich bin hier mit mir, mit ihrem Blut und ihren Gelenken."
 Quinci sù vo per non esser più cieco,"Von hier aus gehe ich nach oben, damit ich nicht länger blind bin."
" donna è di sopra che m’acquista grazia, per che ’l mortal per vostro mondo reco","mehr ist eine Frau, die mir göttliche Gnade schenkt; darum trage ich meinen Leib durch eure Welt."
" Ma se la vostra maggior voglia sazia tosto divegna, sì che ’l ciel v’alberghi ch’è pien d’amore e più ampio si spazia, ","Doch möge euer größter Wunsch so schnell wie möglich erfüllt werden, so daß der Himmel, voller unendlicher Liebe, euch beherbergt,"
" ditemi, acciò ch’ancor carte ne verghi, chi siete voi, e chi è quella turba che se ne va di retro a’ vostri terghi»","Sagt mir, auf daß ich schreibe, wenn ich wieder in die Welt komme, wer seid ihr, und wer ist das Heer, das hinter euren Schultern geht?"
" Non altrimenti stupido si turba lo montanaro, e rimirando ammuta, quando rozzo e salvatico s’inurba, che ciascun’ ombra fece in sua paruta","Der Bergmann, wenn er in die rauhe und wilde Stadt geht und bewundert stumm , ist nicht verblüfft und verdunkelt anders als jede dieser Seelen in ihrem eigenen Aussehen"
" ma poi che furon di stupore scarche, lo qual ne li alti cuor tosto s’attuta, ","aber nachdem sie das Erstaunen hinterließen, daß sie in den edlen Herzen schnell nachließen,"
" «Beato te, che de le nostre marche», ricominciò colei che pria m’inchiese, «per morir meglio, esperïenza imbarche","""Glücklich bist du, daß du, um besser zu sterben, Erfahrung aus unserer Welt erwirbst, jene Seele, die zuvor ihre Frage an mich gerichtet hatte, begann wieder"
" La gente che non vien con noi, offese di ciò per che già Cesar, trïunfando, “Regina” contra sé chiamar s’intese","Die Schar, die nicht mit uns kam, beging dieselbe Sünde, für die sich Cäsar während des Triumphs den Namen ""Königin"" wandte."
" però si parton “Soddoma” gridando, rimproverando a sé com’ hai udito, e aiutan l’arsura vergognando","Darum gehen sie hin und rufen ""Sodom"" und schimpfen, wie du gehört hast, und erhöhen die Strafe des Feuers mit Scham."
 Nostro peccato fu ermafrodito,Unsere Sünde war heterosexuell
" ma perché non servammo umana legge, seguendo come bestie l’appetito, ","sondern weil wir das Gesetz des Menschen nicht hielten und wie Tiere dem Appetit der Sinne folgten,"
" in obbrobrio di noi, per noi si legge, quando partinci, il nome di colei che s’imbestiò ne le ’mbestiate schegge","Wir schämen uns, wenn wir uns trennen, und rufen den Namen des Tieres, das in der falschen hölzernen Kuh ward."
 Or sai nostri atti e di che fummo rei,"Jetzt weißt du, was wir taten und was wir schuldig waren."
" se forse a nome vuo’ saper chi semo, tempo non è di dire, e non saprei","Wenn du vielleicht die Namen von uns allen kennen willst, gibt es keine Zeit, sie dir zu sagen, und ich weiß es nicht."
 Farotti ben di me volere scemo,Ich erfülle deinen Wunsch nur über mich selbst.
" son Guido Guinizzelli, e già mi purgo per ben dolermi prima ch’a lo stremo»","Ich bin Guido Guinizelli, und Rabatt schon hier die Strafe für mich bereuen vor dem Ende meines Lebens"
" Quali ne la tristizia di Ligurgo si fer due figli a riveder la madre, tal mi fec’ io, ","Wie die beiden Söhne, wegen der Grausamkeit des Tyrannen Lycurgo, kamen sie herzu, um ihre Mutter wiederzusehen, also fand ich mich,"
" ma non a tanto insurgo, quand’ io odo nomar sé stesso il padre mio e de li altri miei miglior che mai rime d’amore usar dolci e leggiadre","Aber ich wagte es nicht, als ich hörte, daß mein Vater und andere Dichter, die besser waren als ich, vorkamen, daß sie nie süße Gedichte der Liebe und Lesezeichen schrieben."
" e sanza udire e dir pensoso andai lunga fïata rimirando lui, né, per lo foco, in là più m’appressai","Und ich ging ein Stück lang und sah ihn mit Bewunderung und hörte und hörte nichts und wagte es nicht, mir mehr zu nahen um des Feuers willen."
" Poi che di riguardar pasciuto fui, tutto m’offersi pronto al suo servigio con l’affermar che fa credere altrui","Nachdem ich mich über ihn gefreut hatte, gab ich mir alles bereit, ihm zu dienen, mit einem Eid, der die Leute veranlaßte, an die Worte zu glauben."
 Ed elli a me,Und er zu mir
" «Tu lasci tal vestigio, per quel ch’i’ odo, in me, e tanto chiaro, che Letè nol può tòrre né far bigio","""Du vergisst eine solche Erinnerung in mir für das, was ich höre, und so hell, daß der Lete sie nicht auslöschen noch verblassen kann"
" Ma se le tue parole or ver giuraro, dimmi che è cagion per che dimostri nel dire e nel guardar d’avermi caro»","Aber wenn deine Worte vor kurzem die Wahrheit schwören, dann sag mir, warum du mir lieb hast zu reden und mich anzusehen."
 E io a lui,Und ich ihm
" «Li dolci detti vostri, che, quanto durerà l’uso moderno, faranno cari ancora i loro incostri»","Der Grund dafür sind eure süßen Verse, die, solange man die vulgäre Sprache benutzt, die Handschriften, die sie bewahren, immer kostbar machen."
" «O frate», disse, «questi ch’io ti cerno col dito», ","Er sagte: ""Bruder, der ich dir mit dem Finger verrate,"
" e additò un spirto innanzi, ","und bewies einen Geist vor ihm,"
 «fu miglior fabbro del parlar materno,Er war ein besserer Baumeister als seine mütterliche Herrin.
 Versi d’amore e prose di romanzi soverchiò tutti,Er überlebte alle auf dem Gebiet des okzitanischen Liebesgedichts und in der oitanischen Erzählungsliteratur.
 e lascia dir li stolti che quel di Lemosì credon ch’avanzi,"und laß die Narren reden, die glauben, sie seien von Limousin übertroffen."
" A voce più ch’al ver drizzan li volti, e così ferman sua oppinïone prima ch’arte o ragion per lor s’ascolti","Sie richten ihre Blicke auf die Stimmen mehr als auf die Wahrheit, und so bilden sie ihre Meinung, bevor sie auf die Kunst oder Vernünftigkeit hören."
" Così fer molti antichi di Guittone, di grido in grido pur lui dando pregio, fin che l’ha vinto il ver con più persone","Und viele der Ältesten taten mit Guittone und schätzten ihn, daß er die Stimmen hörte, bis die Wahrheit ihn überwand durch das Werk vieler Schreiber."
" Or se tu hai sì ampio privilegio, che licito ti sia l’andare al chiostro nel quale è Cristo abate del collegio, ","Wenn du nun das außergewöhnliche Privileg hast, in den Kreuzgang zu gehen, wo Christus der Abt des Internats ist,"
" falli per me un dir d’un paternostro, quanto bisogna a noi di questo mondo, dove poter peccar non è più nostro»","sprich vor ihm für mich ein ""Vater von uns,"" zumindest soweit es uns im Fegefeuer notwendig ist, wo wir nicht mehr die Macht haben zu sündigen."
" Poi, forse per dar luogo altrui secondo che presso avea, disparve per lo foco, come per l’acqua il pesce andando al fondo","Und vielleicht, um dem, der neben ihm war, Raum zu lassen, verschwand er ins Feuer wie ein Fisch im Wasser, wenn er nach unten geht."
" Io mi fei al mostrato innanzi un poco, e dissi ch’al suo nome il mio disire apparecchiava grazïoso loco","Und ich näherte mich ein wenig dem Geist, den er zuvor geredet hatte, und sprach: Mein Wunsch bereitete seinem Namen einen angenehmen Empfang."
 El cominciò liberamente a dire,Er fing gerne an zu sagen
" «Tan m’abellis vostre cortes deman, qu’ieu no me puesc ni voill a vos cobrire","Ihre freundliche Frage gefällt mir so sehr, dass ich meine Identität nicht verbergen kann und will."
" Ieu sui Arnaut, que plor e vau cantan","Ich bin Arnaut, der weint und singt."
" consiros vei la passada folor, e vei jausen lo joi qu’esper, denan","besorgt sehe ich meine vergangene Verrücktheit der Liebe, und ich sehe freudig die Freude, die ich hoffe, vor mir"
" Ara vos prec, per aquella valor que vos guida al som de l’escalina, sovenha vos a temps de ma dolor»","Nun bitte ich euch, durch diese Tugend, die euch zum Gipfel dieser Leiter führt, euch zur rechten Zeit an meinen Schmerz zu erinnern."
 Poi s’ascose nel foco che li affina,"Und er verbarg sich in dem Feuer, das sie reinigte."
" Sì come quando i primi raggi vibra là dove il suo fattor lo sangue sparse, cadendo Ibero sotto l’alta Libra, ","Die Sonne war in jener Lage, wo sie sich befindet, wenn sie ihre ersten Strahlen vibriert, wo ihr Schöpfer getötet wurde, während das Hebro unter der Konstellation der Waage steht,"
" e l’onde in Gange da nona rïarse, sì stava il sole",und die Wellen des Ganges brennen von Mittag an.
" onde ’l giorno sen giva, come l’angel di Dio lieto ci apparse","darum daß der Tag vorüber war, da uns der Engel Gottes fröhlich erschien."
" Fuor de la fiamma stava in su la riva, e cantava ‘Beati mundo corde’ ","Er stand am Rand des Rahmens, außerhalb der Flamme, und sang ""Selig die reinen Herzens,"""
in voce assai più che la nostra viva,"mit einer Stimme, die viel intensiver ist als unsere"
" Poscia «Più non si va, se pria non morde, anime sante, il foco","Und die heiligen Seelen gehen nicht weiter nach oben, wenn das Feuer nicht zuerst dort brennt."
" intrate in esso, e al cantar di là non siate sorde», ","Eingänge darin und achte auf das Lied, das du auf der anderen Seite hören wirst."
 ci disse come noi li fummo presso,"Er sagte uns, als wir uns näherten."
" per ch’io divenni tal, quando lo ’ntesi, qual è colui che ne la fossa è messo","Da ich ihn hörte, ward ich wie der, der in die Grube gelegt ist."
" In su le man commesse mi protesi, guardando il foco e imaginando forte umani corpi già veduti accesi","Ich schüttelte meine Hände nach vorn und sah das Feuer und dachte mit Schrecken an menschliche Körper, die ich bereits verbrannt sah."
 Volsersi verso me le buone scorte,Die guten Führer wandten sich zu mir
 e Virgilio mi disse,Und Virgil sprach zu mir:
" «Figliuol mio, qui può esser tormento, ma non morte","Mein Sohn, hier kann es Qualen geben, aber nicht den Tod."
" Ricorditi, ricorditi","Vergiss nicht, vergiss nicht."
" E se io sovresso Gerïon ti guidai salvo, che farò ora presso più a Dio? ","Und wenn ich dich mit Sicherheit auf Jerion geleitet habe, was soll ich dann tun, wenn ich Gott näher bin?"
" Credi per certo che se dentro a l’alvo di questa fiamma stessi ben mille anni, non ti potrebbe far d’un capel calvo","Zweifeln Sie nicht, dass, wenn auch Sie sich in diesen Flammen für tausend Jahre, Sie nicht ein Haar fallen lassen könnten"
" E se tu forse credi ch’io t’inganni, fatti ver’ lei, e fatti far credenza con le tue mani al lembo d’i tuoi panni","Und wenn du glaubst, daß ich dich täuschen will, so wende dich dem Feuer zu und prüfe es, daß du ihm ein Ende deines Gewandes nahst."
" Pon giù omai, pon giù ogne temenza","Komm schon, mach dir keine Sorgen."
 volgiti in qua e vieni,Dreh dich um und komm her.
 entra sicuro»,Betritt sicheres Feuer
 E io pur fermo e contra coscïenza,"Und ich stand still, taub bei jedem Anruf"
" Quando mi vide star pur fermo e duro, turbato un poco disse","Als er sah, dass ich mich nicht überredete, sagte er etwas verärgert zu mir."
" «Or vedi, figlio","Jetzt denk nach, Sohn."
 tra Bëatrice e te è questo muro»,Diese Mauer teilt dich von Beatrice
" Come al nome di Tisbe aperse il ciglio Piramo in su la morte, e riguardolla, allor che ’l gelso diventò vermiglio","Wie Piramus, nach Tisbes Namen, öffnete er seine Augen vor dem Tod und sah sie an, als der Maulbeerbaum rot wurde,"
" così, la mia durezza fatta solla, mi volsi al savio duca, udendo il nome che ne la mente sempre mi rampolla","Also wandte ich mich zu dem weisen Lehrer, nachdem meine Härte gemildert war, und hörte den Namen, der immer in meinem Sinn ist."
 Ond’ ei crollò la fronte e disse,Da schüttelte er den Häuptling und sagte:
 «Come volenci star di qua?»,Wie wollen wir hier bleiben?
 indi sorrise come al fanciul si fa ch’è vinto al pome,"und lächelte wie ein Kind, das von der Verheißung einer Frucht besiegt war."
" Poi dentro al foco innanzi mi si mise, pregando Stazio che venisse retro, che pria per lunga strada ci divise","Und er setzte sich ins Feuer und betete zu Stazio, daß er mir nachfolgte, und zuvor war er lange Zeit zu uns zerbrochen."
" Sì com’ fui dentro, in un bogliente vetro gittato mi sarei per rinfrescarmi, tant’ era ivi lo ’ncendio sanza metro","Sobald ich drinnen war, würde ich mich in ein glühendes Glas werfen, um mich zu erfrischen, und die Hitze dort war unvergleichlich."
" Lo dolce padre mio, per confortarmi, pur di Beatrice ragionando andava, dicendo","Mein süßer Vater sprach immer über Beatrice, um mich zu trösten."
 «Li occhi suoi già veder parmi»,"Ich habe das Gefühl, seine Augen zu sehen."
 Guidavaci una voce che cantava di là,"Eine Stimme, die auf der anderen Seite sang, führte uns an."
" e noi, attenti pur a lei, venimmo fuor là ove si montava","Und wir gingen aus den Flammen, da sie hinaufgingen, und wir hüteten uns vor ihr."
" ‘Venite, benedicti Patris mei’, ","""Kommt her, ihr Gesegneten meines Vaters"""
" sonò dentro a un lume che lì era, tal che mi vinse e guardar nol potei","Eine Stimme erklang in einem Licht, das da war, so lebendig, daß ich es nicht sehen konnte."
" «Lo sol sen va», soggiunse, «e vien la sera","Er fügte hinzu: ""Die Sonne geht und die Nacht kommt."""
" non v’arrestate, ma studiate il passo, mentre che l’occidente non si annera»","ihr bleibt nicht stehen, sondern beeilt euch, bis sich der Westen verdunkelt."
 Dritta salia la via per entro ’l sasso verso tal parte ch’io toglieva i raggi dinanzi a me del sol ch’era già basso,"Der Weg, der in den Felsen gehauen war, ging geradeaus nach Osten, so daß ich vor mir die Strahlen der Sonne unterbrach."
" E di pochi scaglion levammo i saggi, che ’l sol corcar, per l’ombra che si spense, sentimmo dietro e io e li miei saggi","Und wir konnten ein paar Stufen hinaufsteigen, da merkten meine Führer und ich, daß die Sonne untergegangen war, weil mein Schatten verschwand."
" E pria che ’n tutte le sue parti immense fosse orizzonte fatto d’uno aspetto, ","Und bevor der Horizont einen einzigen Aspekt in all seinen immensen Teilen annahm,"
" e notte avesse tutte sue dispense, ciascun di noi d’un grado fece letto","und daß die Nacht alles Land verdunkelte, machte ein jeglicher von uns ein Bett von einer Stufe."
 ché la natura del monte ci affranse la possa del salir più e ’l diletto,"Denn die Natur des Berges löschte uns die Fähigkeit und die Freude, weiter zu steigen"
" Quali si stanno ruminando manse le capre, state rapide e proterve sovra le cime avante che sien pranse, tacite a l’ombra, ","Wie die Ziegen, nachdem sie schnell und ungehorsam über den Gipfeln waren, bevor sie gegessen haben, sind sie sanft und leise, im Schatten zu brüllen,"
" mentre che ’l sol ferve, guardate dal pastor, che ’n su la verga poggiato s’è e lor di posa serve","da die Sonne schlägt, behütet den Hirten, der sich auf den Stab gelegt hat und ihnen Ruhe gibt."
" e quale il mandrïan che fori alberga, lungo il pecuglio suo queto pernotta, guardando perché fiera non lo sperga","und wie der Viehhalter, der die Nacht draußen und übernachtet neben seinem stillen Vieh, daß kein Vieh ihn zerstreue."
" tali eravamo tutti e tre allotta, io come capra, ed ei come pastori, fasciati quinci e quindi d’alta grotta","Also waren wir alle drei, ich gleich der Ziege und sie gleich den Hirten, die beide Seiten miteinander verbunden waren vom hohen Felsen."
 Poco parer potea lì del di fori,"Von dort konnte man wenig von dem sehen, was draußen war,"
" ma, per quel poco, vedea io le stelle di lor solere e più chiare e maggiori",Aber ich sah die größten und hellsten Sterne des Gewöhnlichen.
" Sì ruminando e sì mirando in quelle, mi prese il sonno","Als ich über die Sterne nachdachte und sie beobachtete, wurde ich vom Schlaf erwischt,"
" il sonno che sovente, anzi che ’l fatto sia, sa le novelle","Schlaf, der oft mit wahren Prophezeiungen erfüllt wird"
" Ne l’ora, credo, che de l’orïente prima raggiò nel monte Citerea, che di foco d’amor par sempre ardente, ","In der Stunde, in der die Venus am Morgen aus dem Osten auf dem Berg erschien,"
 giovane e bella in sogno mi parea donna vedere andar per una landa cogliendo fiori,"Es schien mir, als ob ich im Traum eine schöne junge Frau sah, die in einer Ebene wanderte und Blumen pflückte."
 e cantando dicea,und singend sagte er:
" «Sappia qualunque il mio nome dimanda ch’i’ mi son Lia, e vo movendo intorno le belle mani a farmi una ghirlanda","Wer meinen Namen will, der soll wissen, daß ich Lia bin, und ich gehe um die schönen Hände und mache mir einen Kranz."
" Per piacermi a lo specchio, qui m’addorno","Hier bin ich schön, um mich im Spiegel zu bewundern."
" ma mia suora Rachel mai non si smaga dal suo miraglio, e siede tutto giorno","Meine Schwester Rachel hingegen wird nie müde, sich zu spiegeln, und sie sitzt den ganzen Tag."
 Ell’ è d’i suoi belli occhi veder vaga com’ io de l’addornarmi con le mani,"Sie sehnt sich danach, ihre schönen Augen zu sehen, so sehr ich es bin, mich mit den Händen zu klammern."
" lei lo vedere, e me l’ovrare appaga»","Sie ist zufrieden mit dem Anblick, ich bin zufrieden damit, es zu tun."
" E già per li splendori antelucani, che tanto a’ pellegrin surgon più grati, ","Und die Finsternis zerstreute sich von allen Seiten in den frühen Morgengrauen,"
" quanto, tornando, albergan men lontani, le tenebre fuggian da tutti lati, ","die den Reisenden um so mehr gefallen, je näher sie bei ihrer Rückkehr zu Hause sind"
 e ’l sonno mio con esse,"Und mein Schlaf ging mit ihnen fort,"
" ond’ io leva’mi, veggendo i gran maestri già levati",Also stand ich auf und sah die großen Lehrer stehen.
" «Quel dolce pome che per tanti rami cercando va la cura de’ mortali, oggi porrà in pace le tue fami»","Diese süße Frucht, die die Leiden der Sterblichen durch so viele Zweige suchen, wird heute alle deine Begierden sättigen."
 Virgilio inverso me queste cotali parole usò,Virgil sprach diese Worte zu mir
 e mai non furo strenne che fosser di piacere a queste iguali,"und es gab nie frohe Ankündigungen, dass sie mehr Freude als diese schenkten."
" Tanto voler sopra voler mi venne de l’esser sù, ch’ad ogne passo poi al volo mi sentia crescer le penne","Er nahm mir den Wunsch, hoch zu sein, außer dem, was ich hatte, und dann fühlte ich mich mit jedem Schritt, als würde ich meine Federn wachsen."
