Original,Translate_de_1
" Mentre ch’elli è nel primo ben diretto, e ne’ secondi sé stesso misura, esser non può cagion di mal diletto","Solange die Liebe zum ersten Guten gerichtet ist und gegenüber anderen ausgeglichen ist, kann es keine sündige Freude geben"
" ma quando al mal si torce, o con più cura o con men che non dee corre nel bene, contra ’l fattore adovra sua fattura","Aber wenn er sich zum Bösen wendet oder mit weniger oder größerem Eifer zum Guten läuft, als er sollte, dann wirkt das Geschöpf gegen seinen Schöpfer."
 Quinci comprender puoi ch’esser convene amor sementa in voi d’ogne virtute e d’ogne operazion che merta pene,"Daraus kannst du erkennen, daß die Liebe in dir zwangsläufig Ursache aller Tugenden und aller Handlungen ist, die es verdienen, bestraft zu werden."
" Or, perché mai non può da la salute amor del suo subietto volger viso, da l’odio proprio son le cose tute","Nun, da die Liebe niemals gegen die Rettung ihres Gegenstandes handeln kann, sind die Geschöpfe in bezug auf den Haß gegen sich selbst sicher."
" e perché intender non si può diviso, e per sé stante, alcuno esser dal primo, da quello odiare ogne effetto è deciso","und da kein Geschöpf von Gott getrennt werden kann und nicht für sich selbst stehen kann, ist es unmöglich, Gott zu hassen."
" Resta, se dividendo bene stimo, che ’l mal che s’ama è del prossimo","Bleibt, wenn meine Klassifizierung richtig ist, dass schlechte Liebe will das Böse des Nächsten"
 ed esso amor nasce in tre modi in vostro limo,und diese Liebe in eurer Natur entsteht auf drei verschiedene Weisen
" È chi, per esser suo vicin soppresso, spera eccellenza, e sol per questo brama ch’el sia di sua grandezza in basso messo","Es ist jemand, der hofft, daß er seinen Nachbarn mit Füßen tritt, und nur darum will er, daß er seine Größe verliert."
" è chi podere, grazia, onore e fama teme di perder perch’ altri sormonti, onde s’attrista sì che ’l contrario ama","Es ist jemand, der sich fürchtet, Macht, Gunst, Ehre und Ruhm zu verlieren, wenn ein anderer ihn überwindet, so betrübt er sich, daß er das Gegenteil wünscht."
" ed è chi per ingiuria par ch’aonti, sì che si fa de la vendetta ghiotto, e tal convien che ’l male altrui impronti","und es ist jemand, der sich zu schmücken scheint, weil er eine Beleidigung empfangen hat, so daß er Rache wünscht, und dann das Böse der andern bereitet."
 Questo triforme amor qua giù di sotto si piange,Diese dreifache Liebe wird in den darunter liegenden Rahmen bestraft
" or vo’ che tu de l’altro intende, che corre al ben con ordine corrotto","Jetzt will ich, dass du an den anderen denkst, der zum Guten läuft falsch"
" Ciascun confusamente un bene apprende nel qual si queti l’animo, e disira","Jeder versteht verwirrend ein höchstes Gut, daß er die Seele erfülle, und begehre es."
 per che di giugner lui ciascun contende,"Also versucht jeder, ihn zu erreichen."
" Se lento amore a lui veder vi tira o a lui acquistar, questa cornice, dopo giusto penter, ve ne martira","Wenn ihr verleitet werdet, nach ihm zu suchen oder ihn mit einer zu schwachen Liebe zu erreichen, so läßt dieser Rahmen euch die rechte Strafe verbüßen, nach Reue"
 Altro ben è che non fa l’uom felice,"Es gibt andere Güter, die den Menschen nicht glücklich machen"
" non è felicità, non è la buona essenza, d’ogne ben frutto e radice","ist nicht das wahre Glück, nicht das gute Wesen, das Frucht und Wurzel alles Guten ist."
" L’amor ch’ad esso troppo s’abbandona, di sovr’ a noi si piange per tre cerchi","Die Liebe, die sich zu sehr diesen Gütern hingibt, wird in den drei oberen Rahmen bestraft"
" ma come tripartito si ragiona, tacciolo, acciò che tu per te ne cerchi»","aber ich sage dir nicht, wie er dreiseitig ist, damit du ihn von dir aus suchst."
" Posto avea fine al suo ragionamento l’alto dottore, e attento guardava ne la mia vista s’io parea contento","Der berühmte Meister hatte seine Argumentation beendet und sah mich aufmerksam an, um zu sehen, ob ich zufrieden war."
" e io, cui nova sete ancor frugava, di fuor tacea, e dentro dicea","Und ich, der ich noch gequält war von dem Durst zu wissen, außen stumm und in mir sagte ich:"
 ‘Forse lo troppo dimandar ch’io fo li grava’,"""Vielleicht wird Virgilio durch meine zu viele Fragen geärgert werden"""
" Ma quel padre verace, che s’accorse del timido voler che non s’apriva, parlando, di parlare ardir mi porse","Aber der Vater der Wahrheit, der meine Sehnsucht erkannte, die sich nicht aus Furcht offenbarte, ermahnte mich mit seinen Worten, zu reden."
 Ond’ io,Also sagte ich:
" «Maestro, il mio veder s’avviva sì nel tuo lume, ch’io discerno chiaro quanto la tua ragion parta o descriva","Meister, mein Sehvermögen ist so stark von deinem Licht bedroht, dass ich alles sehe, was deine Argumentation trennt und analytisch ausdrückt."
" Però ti prego, dolce padre caro, che mi dimostri amore, a cui reduci ogne buono operare e ’l suo contraro»","Deshalb bitte ich dich, lieber Vater, mir zu erklären, was die Liebe ist, zu der du alle tugendhaften Taten und ihr Gegenteil zurückbringst."
" «Drizza», disse, «ver’ me l’agute luci de lo ’ntelletto, e fieti manifesto l’error de’ ciechi che si fanno duci","Und er sprach zu mir: Führe die scharfen Augen des Intellekts zu mir, und du wirst den Irrtum der Blinden erkennen, die vorgeben, zu führen."
" L’animo, ch’è creato ad amar presto, ad ogne cosa è mobile che piace, tosto che dal piacere in atto è desto","Die Seele, die mit Liebe geschaffen wird, bewegt sich zu allem, was ihr gefällt, sobald sie von der angenehmen Sache erfüllt wird."
" Vostra apprensiva da esser verace tragge intenzione, e dentro a voi la spiega, sì che l’animo ad essa volger face","Eure kognitive Fähigkeit zieht das Bild aus einer realen Sache und verarbeitet es in euch, so daß die Seele sich zu ihr hinleitet."
" e se, rivolto, inver’ di lei si piega, quel piegare è amor, quell’ è natura che per piacer di novo in voi si lega","Und wenn die Seele, so gerichtet, zu diesem Ding wendet, ist dieser Akt Liebe, es ist eine natürliche Haltung, die in erster Linie bindet in euch für die angenehme Sache"
" Poi, come ’l foco movesi in altura per la sua forma ch’è nata a salire là dove più in sua matera dura, ","Dann, wie das Feuer steigt nach oben durch seine Natur, die ihn treibt, um dorthin zu steigen, wo seine Materie dauert länger ,"
" così l’animo preso entra in disire, ch’è moto spiritale, e mai non posa fin che la cosa amata il fa gioire","so nährt die Seele der Liebe die Sehnsucht, die eine Bewegung des Geistes ist, und hört nicht auf, solange ihm das geliebte Ding Freude bereitet."
 Or ti puote apparer quant’ è nascosa la veritate a la gente ch’avvera ciascun amore in sé laudabil cosa,"Jetzt kannst du verstehen, wie weit die Wahrheit vor denen verborgen ist, die behaupten, jede Liebe sei lobenswert für sich selbst."
" però che forse appar la sua matera sempre esser buona, ma non ciascun segno è buono, ancor che buona sia la cera»","Denn vielleicht ist seine Materie immer gut, aber nicht jedes Siegel ist gut, auch wenn das Wachs gut ist."
" «Le tue parole e ’l mio seguace ingegno», rispuos’ io lui, «m’hanno amor discoverto, ma ciò m’ha fatto di dubbiar più pregno","Ich antwortete: ""Deine Worte und mein schlauer Verstand, dir zu folgen, haben mir die Natur der Liebe erklärt, aber das veranlaßt mich noch mehr, zu zweifeln."
" ché, s’amore è di fuori a noi offerto e l’anima non va con altro piede, se dritta o torta va, non è suo merto»","Denn wenn uns die Liebe von der äußeren Wirklichkeit geboten wird und die Seele nicht umhin kann, euch zu verleiten, so ist es nicht sein Verdienst oder seine Schuld, ob sie richtig oder falsch handelt."
 Ed elli a me,Und er zu mir
" «Quanto ragion qui vede, dir ti poss’ io","Ich kann dir sagen, was die menschliche Vernunft versteht"
" da indi in là t’aspetta pur a Beatrice, ch’è opra di fede","durch alles, was darüber hinausgeht, sende ich dich zu Beatrice; denn das ist das Thema des Glaubens."
" Ogne forma sustanzïal, che setta è da matera ed è con lei unita, specifica vertute ha in sé colletta, ","Jede Seele, die von der Materie getrennt ist und gleichzeitig mit ihr verbunden ist, hat in sich eine besondere Bestimmung aufgenommen,"
" la qual sanza operar non è sentita, né si dimostra mai che per effetto, come per verdi fronde in pianta vita","die nicht gewarnt wird, wenn sie nicht handelt, noch sichtbar ist, wenn sie nicht wirkt, wie das Leben in der Pflanze durch die grünen Blätter zu sehen ist."
" Però, là onde vegna lo ’ntelletto de le prime notizie, omo non sape, e de’ primi appetibili l’affetto, ","Darum weiß der Mensch nicht, woher die Erkenntnis der ersten Erkenntnis und die Liebe zu den ersten Besitztümern kommt,"
 che sono in voi sì come studio in ape di far lo mele,"die in euch versinnbildlicht sind wie in der Biene die Fähigkeit, Honig zu produzieren"
 e questa prima voglia merto di lode o di biasmo non cape,und diese erste Neigung ist weder Lob noch Schmach wert.
" Or perché a questa ogn’ altra si raccoglia, innata v’è la virtù che consiglia, e de l’assenso de’ tener la soglia","Nun, damit sich alle anderen an diese Bestimmung halten, ist in euch eine Tugend geboren, die Ratschläge gibt, die die Zustimmung zum Handeln gibt oder verweigert."
" Quest’ è ’l principio là onde si piglia ragion di meritare in voi, secondo che buoni e rei amori accoglie e viglia","Dies ist der Anfang, wo in euch die Verdienste oder die Schmach geboren werden, je nachdem, ob er die guten und die schlechten Lieben prüft und scheidet."
" Color che ragionando andaro al fondo, s’accorser d’esta innata libertate","Jene, die die Sache durchdachten, erkannten diese angeborene Freiheit."
 però moralità lasciaro al mondo,Darum machten sie für die Welt Moral.
" Onde, poniam che di necessitate surga ogne amor che dentro a voi s’accende, di ritenerlo è in voi la podestate","Wenn ihr also eingesteht, daß jede Liebe in euch geboren wird, so habt ihr die Macht, sie zu zügeln."
" La nobile virtù Beatrice intende per lo libero arbitrio, e però guarda che l’abbi a mente, s’a parlar ten prende»","Beatrice nennt diese edle Tugend ""freier Wille,"" also pass auf, dich daran zu erinnern, wenn sie dir davon erzählen sollte."""
" La luna, quasi a mezza notte tarda, facea le stelle a noi parer più rade, fatta com’ un secchion che tuttor arda","Als der Mond schon Mitternacht war, verdunkelte er die Sterne, wie ein paar glänzende Kupferstücke."
 e correa contro ’l ciel per quelle strade che ’l sole infiamma allor che quel da Roma tra ’ Sardi e ’ Corsi il vede quando cade,"und ging durch den Himmel im Gegensatz zu dem, der von der Sonne gegangen ist, wenn er zwischen Sardinien und Korsika untergeht, für den, der von Rom aus schaut."
" E quell’ ombra gentil per cui si noma Pietola più che villa mantoana, del mio carcar diposta avea la soma","Und die edle Seele, die Pietole berühmt ist als jede Stadt des Mantua, hatte sich von der Last der Erklärung befreit, die ich ihm auferlegt hatte."
" per ch’io, che la ragione aperta e piana sovra le mie quistioni avea ricolta, stava com’ om che sonnolento vana","Und ich, der ich die klaren Gedanken über diese Dinge in meinem Sinn gesammelt hatte, war wie ein Mann, der im Schlaf vergeblich ist."
 Ma questa sonnolenza mi fu tolta subitamente da gente che dopo le nostre spalle a noi era già volta,"Aber meine Schläfrigkeit wurde plötzlich von Seelen unterbrochen, die hinter unseren Schultern liefen."
" E quale Ismeno già vide e Asopo lungo di sè di notte furia e calca, pur che i Teban di Bacco avesser uopo, ","Und wie die Flüsse Ismeno und Asop nachts eine Menge sahen, die wütend auf ihrem Weg lief, als die Texaner Bach brauchten,"
" cotal per quel giron suo passo falca, per quel ch’io vidi di color, venendo, cui buon volere e giusto amor cavalca","auf die gleiche Weise in diesem Rahmen, wer von gutem Willen geritten ist und gerechte Liebe beugte seinen eigenen Schritt , wie ich sah, dass diese Seelen zu tun"
" Tosto fur sovr’ a noi, perché correndo si movea tutta quella turba magna",Bald waren sie bei uns; denn all diese große Volksmenge rannte hin und her
 e due dinanzi gridavan piangendo,Und zwei schreiten vor den andern und weinten.
 «Maria corse con fretta a la montagna,Maria rannte schnell in die Berge
" e Cesare, per soggiogare Ilerda, punse Marsilia e poi corse in Ispagna»","Und Cäsar schlug Marseille, um Ilerda zu unterwerfen, und lief nach Spanien."
" «Ratto, ratto, che ’l tempo non si perda per poco amor», gridavan li altri appresso, ","Die anderen hinter ihnen schrien: Schnell, schnell, verschwenden wir keine Zeit für schlechte Liebe,"
 «che studio di ben far grazia rinverda»,"Lassen wir die Gnade wieder blühen, indem wir uns bemühen, Gutes zu tun"
" «O gente in cui fervore aguto adesso ricompie forse negligenza e indugio da voi per tepidezza in ben far messo, ","Die Menschen, in denen jetzt eine inbrünstige Inbrunst vielleicht die Nachlässigkeit und die lauwarme Liebe ausgleicht, die ihr in das Tun des Guten setztet,"
" questi che vive, e certo i’ non vi bugio, vuole andar sù, pur che ’l sol ne riluca","Dieser, der lebt, und ich lüge euch nicht, will hinaufgehen, sobald die Sonne wieder scheint."
 però ne dite ond’ è presso il pertugio»,"Also sagt uns, wo der nächste Durchgang ist."
 Parole furon queste del mio duca,Das sind die Worte meines Führers.
 e un di quelli spirti disse,Und einer von diesen Geistern sprach:
" «Vieni di retro a noi, e troverai la buca",Du kommst hinter uns her und wirst den Weg finden.
" Noi siam di voglia a muoverci sì pieni, che restar non potem","Wir sind so voller Bewegung, dass wir nicht aufhören können."
" però perdona, se villania nostra giustizia tieni","Darum vergib uns, wenn du glaubst, daß unsere Rechtschaffenheit unfreundlich ist."
" Io fui abate in San Zeno a Verona sotto lo ’mperio del buon Barbarossa, di cui dolente ancor Milan ragiona","Ich war der Abt der Basilika San Zeno in Verona, unter dem Reich des guten Federico Barbarossa, von dem Mailand noch heute bedauert Leid"
" E tale ha già l’un piè dentro la fossa, che tosto piangerà quel monastero, e tristo fia d’avere avuta possa","Und ein solcher ist schon fast gestorben, und bald wird er dieses Kloster bereuen, und es wird traurig sein, dass er Macht über ihn gehabt hat."
" perché suo figlio, mal del corpo intero, e de la mente peggio, e che mal nacque, ha posto in loco di suo pastor vero»","Denn er hat ihn als seinen Abt hingestellt, anstatt dessen, was er tun sollte, seinen Sohn, der im Leibe und Verstand verderbt ist und böse geboren ist."
" Io non so se più disse o s’ei si tacque, tant’ era già di là da noi trascorso","Ich weiß nicht, ob er noch mehr hinzufügte oder schwieg, er war schon weit weg von uns."
" ma questo intesi, e ritener mi piacque",Aber ich hörte dies und wollte es schreiben
 E quei che m’era ad ogne uopo soccorso disse,"Und der, der meine Hilfe war, sagte unter allen Umständen:"
 «Volgiti qua,■Werfen Sie sich hier raus.
 vedine due venir dando a l’accidïa di morso»,"Hier sind zwei Seelen, die die Schuld der Schrecken schmähen"
 Di retro a tutti dicean,Hinter allen sagten sie:
" «Prima fue morta la gente a cui il mar s’aperse, che vedesse Iordan le rede sue","Das Volk, für das sich das Rote Meer öffnete, starb, bevor der Jordan seine Erben sah"
" E quella che l’affanno non sofferse fino a la fine col figlio d’Anchise, sé stessa a vita sanza gloria offerse»","Und das Volk, das die Trübsal der Reise mit Anchise nach Italien nicht ertragen konnte, verdammte sich zu einem Leben ohne Herrlichkeit."
" Poi quando fuor da noi tanto divise quell’ ombre, che veder più non potiersi, ","Und als diese Seelen so weit weg von uns waren, dass sie nicht mehr gehört werden konnten,"
" novo pensiero dentro a me si mise, del qual più altri nacquero e diversi","in meinem Sinn wurde ein neuer Gedanke geboren, aus dem andere und andere geboren wurden."
" e tanto d’uno in altro vaneggiai, che li occhi per vaghezza ricopersi, e ’l pensamento in sogno trasmutai","und ich irrte mich von einem zum andern, daß ich meine Augen verschlossen und meine Gedanken in Träume verwandelte."
" Ne l’ora che non può ’l calor dïurno intepidar più ’l freddo de la luna, vinto da terra, ","In der Stunde, in der die Hitze des Tages die Kälte der Mondstrahlen, ausgelöscht von der Kälte der Erde, nicht mehr nachlassen kann"
 e talor da Saturno ,"und manchmal von dem des Saturn,"
" —quando i geomanti lor Maggior Fortuna veggiono in orïente, innanzi a l’alba, surger per via che poco le sta bruna—,","wenn die Geomanten die Gestalt des Glücks Maior sehen, das im Osten vor Sonnenaufgang aufsteigt und bald vom Sonnenlicht verschwommen wird,"
"  mi venne in sogno una femmina balba, ne li occhi guercia, e sovra i piè distorta, con le man monche, e di colore scialba","Ich sah in meinem Traum eine stotternde Frau, mit schiefen Augen und lahmen Füßen, mit zerrissenen Händen und schmutzigen Farben."
 Io la mirava,Ich schaute sie an.
" e come ’l sol conforta le fredde membra che la notte aggrava, così lo sguardo mio le facea scorta la lingua, ","und wie die Sonne die kühlen Glieder in der Nacht erwärmt, so machte mein Blick ihre Zunge lose,"
" e poscia tutta la drizzava in poco d’ora, e lo smarrito volto, com’ amor vuol, così le colorava","Und er lenkte ihren Körper in kurzer Zeit und färbte ihr ein zerbrochenes Gesicht von der Farbe, die die Liebe verlangt."
" Poi ch’ell’ avea ’l parlar così disciolto, cominciava a cantar sì, che con pena da lei avrei mio intento rivolto","Da sie eine lose Rede gekauft hatte, fing sie an zu singen, daß ich mit Mühe meine Aufmerksamkeit von ihr ablenke."
" «Io son», cantava, «io son dolce serena, che ’ marinari in mezzo mar dismago","Ich bin eine süße Meerjungfrau, die die Matrosen mitten im Meer fasziniert."
 tanto son di piacere a sentir piena,Ich bin so nett zu hören
 Io volsi Ulisse del suo cammin vago al canto mio,"Ich entfremdete Odysseus, wenn auch eifrig auf seinem Weg, mit meinem Gesang"
" e qual meco s’ausa, rado sen parte","Und wer sich daran gewöhnt, bei mir zu sein, verlässt mich selten,"
 sì tutto l’appago»,Ich hänge ihn so sehr an.
" Ancor non era sua bocca richiusa, quand’ una donna apparve santa e presta lunghesso me per far colei confusa","Und sein Mund war noch nicht verschlossen, als neben mir eine heilige und ermahnende Frau erschien, die das andere verwirren wollte."
" «O Virgilio, Virgilio, chi è questa?», fieramente dicea","Sie hat stolz gesagt: Virgilio, Virgilio, wer ist das?"
 ed el venìa con li occhi fitti pur in quella onesta,Und er näherte sich und hielt seinen Blick auf die Ehrlichkeit gerichtet
" L’altra prendea, e dinanzi l’apria fendendo i drappi, e mostravami ’l ventre",Virgil nahm die andere und riss ihr das Kleid auf der Vorderseite und zeigte mir meinen Bauch.
 quel mi svegliò col puzzo che n’uscia,"und weckte mich mit dem Gestank, der aus ihm hervorging."
" Io mossi li occhi, e ’l buon maestro",Ich schaute und der gute Lehrer
" «Almen tre voci t’ho messe», dicea, ","Ich habe dich mindestens dreimal angerufen, sagte er,"
 «Surgi e vieni,"Steh auf und komm,"
 troviam l’aperta per la qual tu entre»,"Wir finden den Schritt, um zum nächsten Rahmen zu gelangen."
" Sù mi levai, e tutti eran già pieni de l’alto dì i giron del sacro monte, e andavam col sol novo a le reni","Und ich stand auf, und alle Rahmen des heiligen Berges wurden von der Sonne erleuchtet, die schon hoch war, daß wir mit der Sonne hinter dem Rücken gingen."
" Seguendo lui, portava la mia fronte come colui che l’ha di pensier carca, che fa di sé un mezzo arco di ponte","Als ich Virgil folgte, hielt ich die Stirn so niedrig wie der, der sie mit Gedanken beladen hatte, daß sie einem halben Brückenbogen gleicht."
 quand’ io udi’ ,als ich hörte
 «Venite qui si varca» ,"Kommen Sie, die Passage ist hier."
" parlare in modo soave e benigno, qual non si sente in questa mortal marca","mit einer so sanften und gütigen Stimme, die man in dieser sterblichen Welt nie hört"
" Con l’ali aperte, che parean di cigno, volseci in sù colui che sì parlonne tra due pareti del duro macigno","Und der, der zu uns redete und die weißen Flügel aufmachte wie ein Schwan, führte uns hoch zwischen den zwei Felswänden des Berges."
" Mosse le penne poi e ventilonne, ‘Qui lugent’ affermando esser beati, ch’avran di consolar l’anime donne","Und er zog die Federn auf und windete und sagte, die Weinenden seien selig; denn sie werden die Seelen haben, die trösten."
" «Che hai che pur inver’ la terra guati?», la guida mia incominciò a dirmi, ","Mein Führer fing an, mir zu sagen, was du hast, was du nur nach unten siehst?"
 poco amendue da l’angel sormontati,"da wir hinaufgestiegen waren, wo wir dem Engel begegnet waren,"
 E io,Und ich
" «Con tanta sospeccion fa irmi novella visïon ch’a sé mi piega, sì ch’io non posso dal pensar partirmi»","Ein Traum, den ich hatte und der mich nachdenkt, drängt mich, voller Zweifel zu gehen, denn ich kann mich nicht von ihm abwenden."
" «Vedesti», disse, «quell’antica strega che sola sovr’ a noi omai si piagne","Er sagte: ""Du hast die alte Hexe gesehen, die die einzige Sünde ist, die über uns bestraft wird."""
 vedesti come l’uom da lei si slega,"Du hast gesehen, wie sich der Mensch davon befreien kann."
" Bastiti, e batti a terra le calcagne","Das reicht dir, und jetzt beeil dich."
 li occhi rivolgi al logoro che gira lo rege etterno con le rote magne»,"schaue auf den Ruf des ewigen Königs, der sich mit himmlischen Rädern dreht."
" Quale ’l falcon, che prima a’ pié si mira, indi si volge al grido e si protende per lo disio del pasto che là il tira, tal mi fec’ io","Wie der Falke, der zuerst auf den Boden schaut und sich dann dem Ruf seines Herrn zuwendet und fliegt nach der Lust der Speise, die ihn anzieht, so tat ich es."
" e tal, quanto si fende la roccia per dar via a chi va suso, n’andai infin dove ’l cerchiar si prende","Und ich ging mit dieser Mühe hinauf die ganze Treppe, die durch den Felsen gegraben war, bis der V. Rahmen begann."
" Com’ io nel quinto giro fui dischiuso, vidi gente per esso che piangea, giacendo a terra tutta volta in giuso","Als ich im fünften Rahmen war, sah ich Seelen weinen und liegen alle mit dem Gesicht auf den Boden."
" ‘Adhaesit pavimento anima mea’ sentia dir lor con sì alti sospiri, che la parola a pena s’intendea","Ich spürte, daß sie sagten: ""Meine Seele hat sich an den Erdboden geklammert,"" und sie seufzten so tief, daß ihre Worte kaum verstanden wurden."
" «O eletti di Dio, li cui soffriri e giustizia e speranza fa men duri, drizzate noi verso li alti saliri»","O Seelen, die Gott erwählt hat, deren Schmerzen durch Gerechtigkeit und Hoffnung härter gemacht werden, zeigt uns den Weg zum nächsten Rahmen."
" «Se voi venite dal giacer sicuri, e volete trovar la via più tosto, le vostre destre sien sempre di fori»","Wenn ihr lauft, ohne daß ihr euch niederlegen wollt und den Weg schneller finden wollt, so geht ihr mit der rechten Flanke zum äußeren Teil des Rahmens."
" Così pregò ’l poeta, e sì risposto poco dinanzi a noi ne fu","Also betete Virgilio, und so wurde er nicht weit von uns geantwortet."
" per ch’io nel parlare avvisai l’altro nascosto, e volsi li occhi a li occhi al segnor mio","Und da ich erkannte, daß diese Seele etwas anderes sagen wollte, blickte ich auf meinen Meister."
 ond’ elli m’assentì con lieto cenno ciò che chiedea la vista del disio,"und sprach zu mir mit einem fröhlichen Gerede, daß ich tun könne, was ich von meinem Angesicht verlangte."
" Poi ch’io potei di me fare a mio senno, trassimi sovra quella creatura le cui parole pria notar mi fenno, dicendo","Als ich tun konnte, was ich wollte, trug ich mich auf diese Seele, deren Worte mir zuvor erlaubt hatten, sie zu finden, indem ich sagte:"
" «Spirto in cui pianger matura quel sanza ’l quale a Dio tornar non pòssi, sosta un poco per me tua maggior cura","O Geist, in dem Tränen das reifen lassen, ohne das man nicht zu Gott zurückkehren kann, stoppe einen Augenblick für mich deine größte Sorge."
" Chi fosti e perché vòlti avete i dossi al sù, mi dì, e se vuo’ ch’io t’impetri cosa di là ond’ io vivendo mossi»","Sag mir, wer du warst und warum du den Rücken nach oben gerichtet hast, und wenn du willst, dass ich etwas für dich in der Welt bekomme, aus der ich lebe, dann komme ich."
 Ed elli a me,Und er zu mir
" «Perché i nostri diretri rivolga il cielo a sé, saprai","Und du wirst erfahren, warum der Himmel unsere Schenkel zu sich wendet,"
 ma prima scias quod ego fui successor Petri,"Aber zuerst sollst du wissen, daß ich der Nachfolger des Petrus war."
" Intra Sïestri e Chiaveri s’adima una fiumana bella, e del suo nome lo titol del mio sangue fa sua cima","Zwischen Sestri Levante und Chiavari steigt ein schöner Fluss hinab, und mein Haus legt seinen Namen auf den oberen Teil seines Adelswappens"
" Un mese e poco più prova’ io come pesa il gran manto a chi dal fango il guarda, che piuma sembran tutte l’altre some","Ich versuchte für etwas mehr als einen Monat, wie er den päpstlichen Mantel wiegt denen, die ihn vor Verderbtheit bewahren, so daß jedes andere Amt zum Vergleich leicht zu sein scheint wie eine Feder."
