,Purgatorio,Parafrasi
3480,Anima fatta la virtute attiva,"Divenuta anima, la potenza formativa del seme , "
3481,"qual d’una pianta, in tanto differente,","simile a pianta, ma differente poiché l’anima del feto deve evolversi ,"
3482,"che questa è in via e quella è già a riva,","mentre quella della pianta è compiuta , "
3483,"tanto ovra poi, che già si move e sente,","opera poi tanto che già si muove e sente, "
3484,come spungo marino; e indi imprende,come una spugna marina; e da quello stadio comincia a sviluppare
3485,ad organar le posse ond’ è semente.,gli organi delle facoltà sensitive che ha generato .
3486,"Or si spiega, figliuolo, or si distende","Figliolo, la potenza derivata dal cuore paterno ora "
3487,"la virtù ch’è dal cor del generante,","si espande in larghezza e ora in lunghezza  , "
3488,dove natura a tutte membra intende.,fin dove la natura ritiene necessario costruire tutte le membra. 
3489,"Ma come d’animal divegna fante,",Ma come il feto da essere vivente  diventi essere parlante  
3490,"non vedi tu ancor: quest’ è tal punto,",ancora non lo vedi: questo è un punto così difficile 
3491,"che più savio di te fé già errante,",che un filosofo più sapiente di te  
3492,sì che per sua dottrina fé disgiunto,"fu già tratto in inganno,  tanto che nella sua riflessione filosofica "
3493,"da l’anima il possibile intelletto,","separò  dall’anima  l’intelletto possibile,"
3494,perché da lui non vide organo assunto.,perché non trovò nessun organo fisico corrispondente a esso.
3495,Apri a la verità che viene il petto;,Apri il tuo cuore  alla verità che sto per dirti
3496,"e sappi che, sì tosto come al feto","e sappi che, non appena nel feto si è perfezionata l’organizzazione  "
3497,"l’articular del cerebro è perfetto,","del cervello , Dio  si rivolge verso il feto"
3498,lo motor primo a lui si volge lieto,compiacendosi di quell’opera così perfetta della natura 
3499,"sovra tant’ arte di natura, e spira","e infonde un intelletto nuovo, pieno di virtù,"
3500,"spirito novo, di vertù repleto,",che assimila al proprio essere 
3501,"che ciò che trova attivo quivi, tira",tutte le potenze che trova attive nel feto  e
3502,"in sua sustanzia, e fassi un’alma sola,","diventa un’anima sola, che non solo vive e sente,"
3503,che vive e sente e sé in sé rigira.,ma ha coscienza di sé e del proprio operare .
3504,"E perché meno ammiri la parola,","E perché tu meno ti stupisca per quanto detto, "
3505,"guarda il calor del sole che si fa vino,","guarda come il calore del sole si trasforma in vino, "
3506,giunto a l’omor che de la vite cola.,quando si è congiunto con l’umore che scorre nella vite.
3507,"Quando Làchesis non ha più del lino,","Quando la Parca Làchesi non ha più lino ,"
3508,"solvesi da la carne, e in virtute"," lascia la carne, e potenzialmente porta"
3509,ne porta seco e l’umano e ’l divino:,con sé le virtù umane e divine: 
3510,l’altre potenze tutte quante mute;,le facoltà umane  private  dei loro organi e quindi inattive; 
3511,"memoria, intelligenza e volontade","la memoria, l’intelligenza e la volontà, invece, "
3512,in atto molto più che prima agute.,potenziate  molto più di prima nel loro primo attuarsi .
3513,"Sanza restarsi, per sé stessa cade","L’anima, senza indugio , per impulso naturale "
3514,mirabilmente a l’una de le rive;,raggiunge miracolosamente la riva dell’Acheronte o del Tevere:
3515,quivi conosce prima le sue strade.,qui per la prima volta conosce la sua sorte . 
3516,"Tosto che loco lì la circunscrive,","Appena l’anima raggiunge il luogo assegnatole,"
3517,la virtù formativa raggia intorno,la virtù formativa si irradia nell’aria nello
3518,così e quanto ne le membra vive.,stesso modo e misura con cui faceva con le parti del corpo .
3519,"E come l’aere, quand’ è ben pïorno,","E come l’aria, quando è carica di umidità , "
3520,"per l’altrui raggio che ’n sé si reflette,","per i raggi del sole  che si riflettono su di essa,"
3521,di diversi color diventa addorno;,"diventa adorna dei colori dell’iride,"
3522,così l’aere vicin quivi si mette,così l’aria si dispone intorno all’anima assumendo 
3523,e in quella forma ch’è in lui suggella,quella forma che in essa  imprime  la virtù informativa 
3524,virtüalmente l’alma che ristette;,irradiata dall’anima che ivi si è stabilita ; 
3525,e simigliante poi a la fiammella,e simile poi alla fiammella che segue il fuoco 
3526,"che segue il foco là ’vunque si muta,","ovunque esso si sposti, il nuovo corpo aereo  segue l’anima. "
3527,segue lo spirto sua forma novella.,Poiché dal corpo aereo  l’anima
3528,"Però che quindi ha poscia sua paruta,","trae la sua parvenza , è chiamata ombra; "
3529,è chiamata ombra; e quindi organa poi,e da questo corpo aereo  
3530,ciascun sentire infino a la veduta.,forma poi tutti gli organi sensoriali fino alla vista.
3531,Quindi parliamo e quindi ridiam noi;,Per mezzo di questo corpo aereo  parliamo 
3532,quindi facciam le lagrime e ’ sospiri,e ridiamo noi spiriti; di qui sgorgano le lacrime 
3533,che per lo monte aver sentiti puoi.,e i sospiri che hai sentito percorrendo la montagna.
3534,Secondo che ci affliggono i disiri,"A seconda di come ci stimolano i desideri e gli altri sentimenti,"
3535,"e li altri affetti, l’ombra si figura;",il corpo aereo si atteggia; e questa è la causa di quel fenomeno
3536,e quest’ è la cagion di che tu miri».,che ha destato la tua meraviglia ».
3537,E già venuto a l’ultima tortura,Eravamo già giunti all’ultima cornice ;
3538,"s’era per noi, e vòlto a la man destra,","e avevamo rivolto i nostri passi verso destra,"
3539,ed eravamo attenti ad altra cura.,e la nostra attenzione era volta verso un altro problema. 
3540,"Quivi la ripa fiamma in fuor balestra,","Qui la parete del monte sprigiona con violenza  una fiamma,"
3541,e la cornice spira fiato in suso,mentre la cornice esterna soffia un vento 
3542,che la reflette e via da lei sequestra;,che la fa ripiegare  e la tiene lontana dall’orlo ;
3543,ond’ ir ne convenia dal lato schiuso,per cui dovevamo camminare dalla parte esterna  uno dietro l’altro; 
3544,ad uno ad uno; e io temëa ’l foco,"e io avevo paura del fuoco a sinistra , "
3545,"quinci, e quindi temeva cader giuso.",e di cadere nel precipizio a destra . 
3546,Lo duca mio dicea: «Per questo loco,Intanto la mia guida diceva: «Procedendo in questo luogo 
3547,"si vuol tenere a li occhi stretto il freno,","si devono tenere gli occhi fermi , "
3548,però ch’errar potrebbesi per poco».,perché basterebbe un piccolo errore per precipitare».
3549,‘Summae Deus clementïae’ nel seno,Sentii spiriti che cantavano ‘Dio di somma
3550,"al grande ardore allora udi’ cantando,","clemenza’ in mezzo alla gran fiamma, tanto che fui"
3551,che di volger mi fé caler non meno;,non meno desideroso di voltarmi ; 
3552,e vidi spirti per la fiamma andando;,e vidi anime che camminavano attraverso le fiamme; 
3553,per ch’io guardava a loro e a’ miei passi,"per cui contemporaneamente osservavo loro e badavo ai miei passi,"
3554,compartendo la vista a quando a quando.,dividendo  i miei sguardi di qua e di là.
3555,"Appresso il fine ch’a quell’ inno fassi,","Dopo aver finito l’inno, gridavano con forza : "
3556,gridavano alto: ‘Virum non cognosco’;,‘Non conosco uomo’; poi ricominciavano 
3557,indi ricominciavan l’inno bassi.,a cantare l’inno con voce più bassa.
3558,"Finitolo, anco gridavano: «Al bosco","Quando lo avevano di nuovo finito, gridavano:"
3559,"si tenne Diana, ed Elice caccionne","«Diana rimase nel bosco, e ne cacciò Callisto "
3560,che di Venere avea sentito il tòsco».,che aveva provato il veleno  dell’amore ».
3561,Indi al cantar tornavano; indi donne,Poi riprendevano a cantare l’inno; 
3562,gridavano e mariti che fuor casti,e ancora esaltavano gridando i nomi di mogli e di mariti 
3563,come virtute e matrimonio imponne.,che furono casti come impongono la virtù e gli obblighi del matrimonio.
3564,E questo modo credo che lor basti,E questo comportamento credo che per loro duri 
3565,per tutto il tempo che ’l foco li abbruscia:,così  per tutto il tempo che saranno bruciati dal fuoco:
3566,con tal cura conviene e con tai pasti,con simile pena e con tali nutrimenti spirituali  è necessario
3567,che la piaga da sezzo si ricuscia.,che alla fine  la ferita del peccato si cicatrizzi .
3568,"Mentre che sì per l’orlo, uno innanzi altro,","Mentre procedevamo così lungo il margine esterno della cornice , "
3569,"ce n’andavamo, e spesso il buon maestro","uno davanti all’altro, e spesso il mio buon maestro mi diceva: "
3570,diceami: «Guarda: giovi ch’io ti scaltro»;,"«Stai attento: ti sia utile che io ti avverta dei pericoli », "
3571,"feriami il sole in su l’omero destro,","Mi colpiva  dal lato  destro il sole, "
3572,"che già, raggiando, tutto l’occidente","che già diffondendo i suoi raggi, trasformava l’intera parte occidentale "
3573,mutava in bianco aspetto di cilestro;,del cielo da azzurrina in bianca; e io facevo apparire 
3574,e io facea con l’ombra più rovente,più rosseggiante la fiamma con la mia ombra; 
3575,parer la fiamma; e pur a tanto indizio,"e solo per un indizio così piccolo vidi molte anime,"
3576,"vidi molt’ ombre, andando, poner mente.","mentre camminavano, rivolgermi la loro attenzione ."
3577,Questa fu la cagion che diede inizio,Questa fu la causa che diede loro l’occasione 
3578,loro a parlar di me; e cominciarsi,di parlare di me; e tra loro cominciarono a dire:
3579,a dir: «Colui non par corpo fittizio»;,«Questo non sembra un corpo apparente »;
3580,"poi verso me, quanto potëan farsi,","poi alcuni di essi  si accostarono  a me,"
3581,"certi si fero, sempre con riguardo","per quanto potevano avanzare, facendo sempre attenzione  "
3582,di non uscir dove non fosser arsi.,a non uscire dalle fiamme nelle quali ardevano.
3583,"«O tu che vai, non per esser più tardo,","«O tu che procedi dietro agli altri, non perché più lento , "
3584,"ma forse reverente, a li altri dopo,","ma forse in segno di reverenza, rispondi a me"
3585,rispondi a me che ’n sete e ’n foco ardo.,che brucio nella sete  e nel fuoco . 
3586,Né solo a me la tua risposta è uopo;,Né solo a me è necessaria  la tua risposta; 
3587,ché tutti questi n’hanno maggior sete,poiché tutte queste anime avvertono una sete maggiore 
3588,che d’acqua fredda Indo o Etïopo.,di quanta  non ne abbiano d’acqua fresca  gli abitanti dell’India o dell’Etiopia. 
3589,Dinne com’ è che fai di te parete,Dicci come accade che tu impedisca col corpo
3590,"al sol, pur come tu non fossi ancora","il passaggio   dei raggi del sole, "
3591,di morte intrato dentro da la rete».,proprio come se non fossi ancora caduto nella rete della morte».
3592,Sì mi parlava un d’essi; e io mi fora,"Così mi diceva uno di essi; e io mi sarei subito  presentato, "
3593,"già manifesto, s’io non fossi atteso",se la mia attenzione non fosse stata attirata  
3594,ad altra novità ch’apparve allora;,da un fatto nuovo che apparve in quel momento; 
3595,ché per lo mezzo del cammino acceso,poiché al centro della via invasa dalle fiamme una schiera
3596,"venne gente col viso incontro a questa,",di anime venne in senso contrario a quella con cui
3597,la qual mi fece a rimirar sospeso.,"parlavo, e tale vista mi rese attento a guardarle con stupore ."
3598,Lì veggio d’ogne parte farsi presta,Nel punto in cui s’incontrano  vedo da entrambe 
3599,ciascun’ ombra e basciarsi una con una,le schiere tutte le anime 
3600,"sanza restar, contente a brieve festa;","affrettare il passo e baciarsi reciprocamente senza fermarsi, "
3601,così per entro loro schiera bruna,contente di questo rapido rito d’amore;
3602,"s’ammusa l’una con l’altra formica,","nello stesso modo, all’interno della loro fila scura"
3603,forse a spïar lor via e lor fortuna.,"una formica avvicina il muso a quello dell’altra, "
3604,"Tosto che parton l’accoglienza amica,",forse per chieder notizie del cammino e dei frutti del loro lavoro. 
3605,"prima che ’l primo passo lì trascorra,","Non appena  interrompono  l’incontro amichevole, "
3606,sopragridar ciascuna s’affatica:,"prima che abbiano compiuto il primo passo che li allontana da lì,"
3607,la nova gente: «Soddoma e Gomorra»;,ciascuna si sforza a gridare più che può: l’ombre
3608,"e l’altra: «Ne la vacca entra Pasife,","arrivate per ultime: «Sodoma e Gomorra», e le altre:"
3609,perché ’l torello a sua lussuria corra».,"«Pasife entra nella vacca, perché il giovane toro  corra  la sua lussuria»."
3610,"Poi, come grue ch’a le montagne Rife",Poi come le gru che volano in parte verso
3611,"volasser parte, e parte inver’ l’arene,","i monti Rifei e in parte verso i deserti , per"
3612,"queste del gel, quelle del sole schife,","fuggire  le une il gelo e le altre il sole,"
3613,"l’una gente sen va, l’altra sen vene;","così una delle due schiere di anime si allontana,"
3614,"e tornan, lagrimando, a’ primi canti","e l’altra si avvicina; e ricominciano, piangendo, a"
3615,e al gridar che più lor si convene;,cantare l’inno di prima e a gridare  più convenienti ;
3616,"e raccostansi a me, come davanti,",e a me si riavvicinarono quelle stesse anime 
3617,"essi medesmi che m’avean pregato,","che prima mi avevano pregato di parlare, "
3618,attenti ad ascoltar ne’ lor sembianti.,dimostrandosi  interessate ad ascoltarmi.
3619,"Io, che due volte avea visto lor grato,","Io, che per due volte avevo capito ciò "
3620,incominciai: «O anime sicure,"che queste anime gradivano conoscere , cominciai:"
3621,"d’aver, quando che sia, di pace stato,","«O anime sicure di raggiungere, quando sarà il momento, "
3622,non son rimase acerbe né mature,"la condizione di beatitudine , le mie membra "
3623,"le membra mie di là, ma son qui meco",non sono rimaste sulla terra prematuramente  
3624,col sangue suo e con le sue giunture.,"né in età avanzata , ma sono qui con me con il loro sangue e con la loro rete di nervi. "
3625,Quinci sù vo per non esser più cieco;,Da qui salgo per riacquistare la luce ; 
3626,"donna è di sopra che m’acquista grazia,",nel cielo c’è una donna che mi procura la grazia 
3627,per che ’l mortal per vostro mondo reco.,per cui posso portare il mio corpo mortale attraverso l’oltretomba .
3628,Ma se la vostra maggior voglia sazia,Ma augurandovi che  possa essere presto 
3629,"tosto divegna, sì che ’l ciel v’alberghi","soddisfatto  il vostro più ardente desiderio, "
3630,"ch’è pien d’amore e più ampio si spazia,",così che vi accolga il cielo che è pieno d’amore e si estende 
3631,"ditemi, acciò ch’ancor carte ne verghi,","senza limiti, ditemi, in modo che io possa scriverne , "
3632,"chi siete voi, e chi è quella turba",chi siete voi e chi è quella schiera di anime  che
3633,che se ne va di retro a’ vostri terghi».,procede in direzione opposta  alle vostre spalle ».
3634,Non altrimenti stupido si turba,"Non diversamente si turba stupefatto  il montanaro,"
3635,"lo montanaro, e rimirando ammuta,","e guardandosi intorno ammutolisce , "
3636,"quando rozzo e salvatico s’inurba,","quando rozzo e selvatico entra in città per la prima volta , "
3637,che ciascun’ ombra fece in sua paruta;,così si mostrò nel suo aspetto  ogni spirito; 
3638,"ma poi che furon di stupore scarche,","ma dopo che si furono liberate  dello stupore, "
3639,"lo qual ne li alti cuor tosto s’attuta,","che negli animi nobili presto si smorza ,"
3640,"«Beato te, che de le nostre marche»,","«Beato te, che dalla visita alle nostre contrade »"
3641,"ricominciò colei che pria m’inchiese,",ricominciò l’ombra che prima mi aveva rivolto la domanda  
3642,"«per morir meglio, esperïenza imbarche!","«immagazzini  esperienza, per poi morire in grazia di Dio!"
3643,"La gente che non vien con noi, offese","La turba di anime che non cammina nella nostra direzione, "
3644,"di ciò per che già Cesar, trïunfando,","si rese colpevole  di quel peccato per il quale Cesare, "
3645,“Regina” contra sé chiamar s’intese:,"celebrando il trionfo, sentì i soldati chiamarlo per scherno ‘Regina’: "
3646,"però si parton “Soddoma” gridando,","perciò si allontanano gridando ‘Sodoma’,"
3647,"rimproverando a sé com’ hai udito,","rinfacciandosi il peccato, come hai udito,"
3648,e aiutan l’arsura vergognando.,e accrescono l’efficacia della pena  con la vergogna.
3649,Nostro peccato fu ermafrodito;,Il nostro peccato fu bisessuale ;
3650,"ma perché non servammo umana legge,","ma poiché non osservammo  la giusta misura della ragione, "
3651,"seguendo come bestie l’appetito,","seguendo l’istinto sessuale come bestie, "
3652,"in obbrobrio di noi, per noi si legge,","a titolo di vergogna per noi stessi , "
3653,"quando partinci, il nome di colei",quando ci dividiamo ricordiamo gridando il nome di Pasife  
3654,che s’imbestiò ne le ’mbestiate schegge.,che agì come una bestia dentro i legni lavorati a forma di animale .
3655,Or sai nostri atti e di che fummo rei:,Ora sai la ragione del nostro comportamento e di che cosa fummo colpevoli: 
3656,"se forse a nome vuo’ saper chi semo,","se forse vuoi sapere per nome chi siamo, "
3657,"tempo non è di dire, e non saprei.","non è questo il momento per farlo, e non saprei elencarli. "
3658,Farotti ben di me volere scemo:,Tuttavia  soddisferò il tuo desiderio  di mie notizie: 
3659,"son Guido Guinizzelli, e già mi purgo","sono Guido Guinizzelli; e sono già nel Purgatorio,"
3660,per ben dolermi prima ch’a lo stremo».,per essermi pentito prima di giungere in fin di vita ».
3661,Quali ne la tristizia di Ligurgo,"Come i due figli di Isifile, nella disgrazia  di Licurgo, "
3662,"si fer due figli a riveder la madre,","corsero ad abbracciare  la madre, "
3663,"tal mi fec’ io, ma non a tanto insurgo,","così mi trovai anch’io, ma non ebbi il coraggio "
3664,quand’ io odo nomar sé stesso il padre,"di giungere a tanto, quando udii presentarsi l’iniziatore "
3665,mio e de li altri miei miglior che mai,e maestro mio  e degli altri poeti migliori di me
3666,rime d’amore usar dolci e leggiadre;,che in ogni tempo  scrissero rime d’amore soavi ed eleganti; 
3667,e sanza udire e dir pensoso andai,e per molto tempo  senza ascoltare né
3668,"lunga fïata rimirando lui,","parlare camminai pensieroso, contemplandolo,"
3669,"né, per lo foco, in là più m’appressai.",ma a causa del fuoco non ebbi il coraggio di avvicinarmi di più.
3670,"Poi che di riguardar pasciuto fui,","Quando fui sazio  di contemplarlo,"
3671,tutto m’offersi pronto al suo servigio,"mi dichiarai pronto ad accontentare ogni suo desiderio,"
3672,con l’affermar che fa credere altrui.,col giuramento  che induce gli altri a credere.
3673,"Ed elli a me: «Tu lasci tal vestigio,",Ed egli mi disse: «Tu lasci una tale impronta  nella mia memoria 
3674,"per quel ch’i’ odo, in me, e tanto chiaro,","e così intensa , per quello che ho appena udito,"
3675,che Letè nol può tòrre né far bigio.,che il Letè non potrà cancellarla  né rendere sbiadita . 
3676,"Ma se le tue parole or ver giuraro,","Ma se le tue parole ora hanno giurato il vero, "
3677,dimmi che è cagion per che dimostri,dimmi qual è  la ragione per cui dimostri con parole 
3678,nel dire e nel guardar d’avermi caro».,e con sguardi di volermi così bene».
3679,"E io a lui: «Li dolci detti vostri,","E io dissi a lui: «Le vostre rime dolci, che,"
3680,"che, quanto durerà l’uso moderno,","finché durerà la letteratura in volgare , "
3681,faranno cari ancora i loro incostri».,renderanno più preziosi i manoscritti che le conservano ».
3682,"«O frate», disse, «questi ch’io ti cerno","«O fratello», disse, «questo spirito che ti indico  col dito», "
3683,"col dito», e additò un spirto innanzi,","e additò un’anima che camminava davanti a lui,"
3684,«fu miglior fabbro del parlar materno.,«fu il più alto artefice nella sua lingua volgare. 
3685,Versi d’amore e prose di romanzi,Superò  tutti i poeti lirici amorosi e i romanzieri in prosa;
3686,soverchiò tutti; e lascia dir li stolti,e lascia parlare gli sciocchi  che ritengono 
3687,che quel di Lemosì credon ch’avanzi.,il poeta del Limosino superiore  a lui. 
3688,"A voce più ch’al ver drizzan li volti,",Costoro indirizzano il loro interesse 
3689,e così ferman sua oppinïone,"più alla fama corrente  che alla verità, "
3690,prima ch’arte o ragion per lor s’ascolti.,e così stabiliscono la loro opinione prima di ascoltare l’arte e la ragione. 
3691,"Così fer molti antichi di Guittone,","Così fecero molti poeti della vecchia generazione con Guittone,"
3692,"di grido in grido pur lui dando pregio,","celebrando la sua opera  di bocca in bocca,"
3693,fin che l’ha vinto il ver con più persone.,"finché, dal confronto con poeti migliori, ha prevalso la verità."
3694,"Or se tu hai sì ampio privilegio,","Ora, giacché  tu hai un privilegio così alto "
3695,che licito ti sia l’andare al chiostro,"che ti consente di andare nel convento ,"
3696,"nel quale è Cristo abate del collegio,","in cui Cristo è l’autorità suprema della comunità ,"
3697,"falli per me un dir d’un paternostro,","recita a lui per me un Padre nostro, fino al punto in cui è utile  "
3698,"quanto bisogna a noi di questo mondo,","a noi anime del Purgatorio , "
3699,dove poter peccar non è più nostro».,dove non abbiamo la possibilità  di peccare».
3700,"Poi, forse per dar luogo altrui secondo","Poi, forse per cedere il posto a un altro che lo seguiva "
3701,"che presso avea, disparve per lo foco,","e che aveva vicino, sparì attraverso il fuoco"
3702,come per l’acqua il pesce andando al fondo.,come sparisce nell’acqua il pesce che si dirige verso il fondo. 
3703,"Io mi fei al mostrato innanzi un poco,",Io mi accostai un poco  all’ombra
3704,e dissi ch’al suo nome il mio disire,"Che mi aveva additato , e dissi che il mio"
3705,apparecchiava grazïoso loco.,desiderio preparava un’accoglienza grata  al suo nome.
3706,El cominciò liberamente a dire:,Egli cominciò senza esitazione a dire:
3707,"«Tan m’abellis vostre cortes deman,","«Tanto mi piace la vostra cortese domanda, che"
3708,qu’ieu no me puesc ni voill a vos cobrire.,io non posso e non voglio celarmi a te. 
3709,"Ieu sui Arnaut, que plor e vau cantan;","Io sono Arnaldo, che piango e vado cantando;"
3710,"consiros vei la passada folor,","afflitto vedo la passata follia , e vedo gioioso "
3711,"e vei jausen lo joi qu’esper, denan.",davanti me  il giorno che aspetto con speranza . 
3712,"Ara vos prec, per aquella valor","Quindi  vi prego, in nome di quella Grazia"
3713,"que vos guida al som de l’escalina,","che vi guida al sommo della scala purgatoriale, "
3714,sovenha vos a temps de ma dolor!».,che al tempo opportuno  vi sovvenga del mio dolore!». 
3715,Poi s’ascose nel foco che li affina.,Poi si nascose nel fuoco che purifica  le anime .
3716,Sì come quando i primi raggi vibra,Il sole occupava la stessa posizione  
3717,"là dove il suo fattor lo sangue sparse,",che assume quando irradia  i suoi primi raggi 
3718,"cadendo Ibero sotto l’alta Libra,","là dove Cristo  sparse il suo sangue ,"
3719,"e l’onde in Gange da nona rïarse,",mentre il fiume Ebro  si trova sotto la costellazione della Libra 
3720,"sì stava il sole; onde ’l giorno sen giva,",e le acque del Gange sono riarse dal mezzogiorno ; 
3721,come l’angel di Dio lieto ci apparse.,perciò il giorno tramontava allorché l’angelo di Dio apparve radioso. 
3722,"Fuor de la fiamma stava in su la riva,","Stava sul ciglio della cornice, fuori dalle fiamme e cantava:"
3723,e cantava ‘Beati mundo corde!’,‘Beati i puri di cuore!’ con una voce molto 
3724,in voce assai più che la nostra viva.,più armoniosa  di quella umana .
3725,"Poscia «Più non si va, se pria non morde,",Poi aggiunse non appena ci avvicinammo a lui: 
3726,"anime sante, il foco: intrate in esso,","«Non si può andare oltre, anime sante, "
3727,"e al cantar di là non siate sorde»,",se prima il fuoco non vi fa sentire il morso ardente :
3728,ci disse come noi li fummo presso;,entrate in esso e prestate attenzione al canto  che proviene dall’altra parte delle fiamme »; 
3729,"per ch’io divenni tal, quando lo ’ntesi,","perciò, non appena udii le sue parole, divenni simile a colui"
3730,qual è colui che ne la fossa è messo.,che viene calato nella fossa .
3731,"In su le man commesse mi protesi,","Con le mani protese in avanti mi sporsi,"
3732,guardando il foco e imaginando forte,guardando le fiamme e immaginando con tremenda
3733,umani corpi già veduti accesi.,lucidità  corpi umani visti in terra  arsi vivi.
3734,Volsersi verso me le buone scorte;,Le mie buone guide  si volsero verso
3735,"e Virgilio mi disse: «Figliuol mio,","di me; e Virgilio mi disse: «Figliuolo mio, qui in Purgatorio"
3736,"qui può esser tormento, ma non morte.","ci può essere solo tormento, ma non morte."
3737,"Ricorditi, ricorditi! E se io","Ricordati, ricordati! E se io ti guidai portandoti in"
3738,"sovresso Gerïon ti guidai salvo,","salvo persino sulla groppa  di Gerione,"
3739,che farò ora presso più a Dio?,che cosa non farò adesso che siamo ancora più vicino a Dio? 
3740,Credi per certo che se dentro a l’alvo,"Credi pure con certezza che, anche se tu rimanessi "
3741,"di questa fiamma stessi ben mille anni,","nel seno  di questa fiamma per mille anni,"
3742,non ti potrebbe far d’un capel calvo.,non ti potrebbe privare  di un solo capello.
