,Purgatorio,Parafrasi
2160,"«Io ti seguiterò quanto mi lece»,","«Io ti verrò dietro finché mi è permesso »,"
2161,"rispuose; «e se veder fummo non lascia,","rispose, «e se il fumo non permette di vederci, "
2162,l’udir ci terrà giunti in quella vece».,l’udito ci terrà uniti invece della vista».
2163,Allora incominciai: «Con quella fascia,Allora cominciai: «Sto salendo verso la cima
2164,"che la morte dissolve men vo suso,","del monte con quel corpo che la morte fa svanire,"
2165,e venni qui per l’infernale ambascia.,e sono arrivato qui attraversando i tormenti dell’Inferno. 
2166,"E se Dio m’ha in sua grazia rinchiuso,","E se è vero che Dio mi ha accolto nella sua grazia, "
2167,tanto che vuol ch’i’ veggia la sua corte,"tanto da volere che io contempli la sua corte celeste, "
2168,"per modo tutto fuor del moderno uso,","in un modo del tutto insolito per i tempi moderni, "
2169,"non mi celar chi fosti anzi la morte,","non nascondermi chi fosti prima di morire, ma dimmelo, "
2170,"ma dilmi, e dimmi s’i’ vo bene al varco;",e dimmi pure se sono sulla strada giusta per il passo ; 
2171,e tue parole fier le nostre scorte».,e le tue parole saranno le nostre guide ».
2172,"«Lombardo fui, e fu’ chiamato Marco;","«Fui Lombardo, e di nome Marco; fui esperto"
2173,"del mondo seppi, e quel valore amai",delle cose del mondo e amai quelle virtù verso le
2174,al quale ha or ciascun disteso l’arco.,quali nessuno ora tende più il suo arco. La strada
2175,Per montar sù dirittamente vai».,che stai facendo per salire è quella giusta». 
2176,"Così rispuose, e soggiunse: «I’ ti prego","Così rispose, e poi aggiunse: "
2177,che per me prieghi quando sù sarai».,«Ti prego di pregare per me quando sarai in Cielo».
2178,E io a lui: «Per fede mi ti lego,E io gli risposi: «Mi impegno per giuramento
2179,di far ciò che mi chiedi; ma io scoppio,"di fare quello che mi domandi; ma io scoppio, se non"
2180,"dentro ad un dubbio, s’io non me ne spiego.",riesco a liberarmi di un dubbio che mi tormenta. 
2181,"Prima era scempio, e ora è fatto doppio","Prima il mio dubbio era semplice, ma ora è raddoppiato"
2182,"ne la sentenza tua, che mi fa certo","per via delle tue parole, le quali mi assicurano, in"
2183,"qui, e altrove, quello ov’ io l’accoppio.","questa cornice e nell’altra, quel fatto a cui io le associo."
2184,Lo mondo è ben così tutto diserto,Il mondo è proprio del tutto spoglio di ogni
2185,"d’ogne virtute, come tu mi sone,","virtù, come mi dici chiaramente, ed è ripieno e coperto"
2186,e di malizia gravido e coverto;,di malvagità; ma ti prego di indicarmene la
2187,"ma priego che m’addite la cagione,","causa, in modo che la veda bene e possa rivelarla"
2188,sì ch’i’ la veggia e ch’i’ la mostri altrui;,ad altri; poiché alcuni la attribuiscono agli influssi
2189,"ché nel cielo uno, e un qua giù la pone».","degli astri, altri all’umano volere»."
2190,"Alto sospir, che duolo strinse in «uhi!»,","Prima di rispondermi, emise un sospiro profondo che,"
2191,"mise fuor prima; e poi cominciò: «Frate,","per il dolore, si trasformò in un «uhi!»; poi cominciò: "
2192,"lo mondo è cieco, e tu vien ben da lui.","«Fratello, il mondo è cieco e tu  mostri di venire da esso. "
2193,Voi che vivete ogne cagion recate,"Voi che vivete sulla terra, riconducete "
2194,"pur suso al cielo, pur come se tutto","ogni causa solo all’influsso degli astri, "
2195,movesse seco di necessitate.,proprio come se il movimento del cielo determinasse necessariamente tutto. 
2196,"Se così fosse, in voi fora distrutto","Se così fosse, sarebbe  annullato in voi il libero arbitrio, "
2197,"libero arbitrio, e non fora giustizia","e non sarebbe giusto essere premiati per avere bene operato, "
2198,"per ben letizia, e per male aver lutto.",e puniti per avere commesso il male.
2199,Lo cielo i vostri movimenti inizia;,Gli astri influiscono sulle tendenze iniziali di
2200,"non dico tutti, ma, posto ch’i’ ’l dica,","ciascuno; non dico tutte, ma, posto che lo dica, vi"
2201,"lume v’è dato a bene e a malizia,",è stata elargita la luce della ragione per discernere
2202,"e libero voler; che, se fatica","il bene dal male, e la libera volontà; che, anche se"
2203,"ne le prime battaglie col ciel dura,",incontra difficoltà nelle prime lotte con le influenze
2204,"poi vince tutto, se ben si notrica.","astrali, alla fine vince ogni contrasto, se è ben alimentata."
2205,A maggior forza e a miglior natura,"Voi dipendete, come esseri liberi, da una"
2206,liberi soggiacete; e quella cria,forza maggiore e una natura migliore; ed è quella
2207,"la mente in voi, che ’l ciel non ha in sua cura.","che ha creato in voi l’anima intellettiva, che non è"
2208,"Però, se ’l mondo presente disvia,","governata dall’influsso dei cieli. Perciò, se l’attuale"
2209,"in voi è la cagione, in voi si cheggia;","società è traviata, la causa è in voi, in voi va ricercata;"
2210,e io te ne sarò or vera spia.,io stesso te ne darò ora una vera informazione.
2211,Esce di mano a lui che la vagheggia,"L’anima esce dalle mani di Dio, che l’ama "
2212,"prima che sia, a guisa di fanciulla","prima ancora che sia creata, come una"
2213,"che piangendo e ridendo pargoleggia,","fanciullina che piange e ride puerilmente, semplice"
2214,"l’anima semplicetta che sa nulla,","e ingenua, ancora ignara di ogni cosa, tranne che,"
2215,"salvo che, mossa da lieto fattore,","creata da Dio, somma letizia, si volge a ciò che le"
2216,volontier torna a ciò che la trastulla.,arreca diletto .
2217,Di picciol bene in pria sente sapore;,Inizialmente sente il gusto dei piccoli piaceri;
2218,"quivi s’inganna, e dietro ad esso corre,","qui s’inganna, e corre dietro a essi, a meno che una"
2219,se guida o fren non torce suo amore.,guida o un freno non raddrizzino la sua naturale tendenza. 
2220,Onde convenne legge per fren porre;,Perciò fu necessario imporre la legge come freno; 
2221,"convenne rege aver, che discernesse","di qui la necessità di avere un sovrano, che, della vera città,"
2222,de la vera cittade almen la torre.,fosse in grado di discernere almeno la torre più alta.
2223,"Le leggi son, ma chi pon mano ad esse?","Le leggi ci sono, ma chi le fa rispettare? "
2224,"Nullo, però che ’l pastor che procede,","Nessuno, perché il papa, che come un pastore guida il"
2225,"rugumar può, ma non ha l’unghie fesse;","gregge dei fedeli, sa ruminare, ma non ha lo zoccolo bipartito ; "
2226,"per che la gente, che sua guida vede","perciò l’umanità, che vede la sua guida spirituale mirare  "
2227,"pur a quel ben fedire ond’ ella è ghiotta,","a quei beni mondani di cui essa stessa è avida, "
2228,"di quel si pasce, e più oltre non chiede.","si sazia di questi, senza cercare altro."
2229,Ben puoi veder che la mala condotta,Puoi ora comprendere chiaramente che il malgoverno 
2230,"è la cagion che ’l mondo ha fatto reo,","è la causa che ha reso malvagi gli uomini, "
2231,e non natura che ’n voi sia corrotta.,e non la natura umana guastata .
2232,"Soleva Roma, che ’l buon mondo feo,","Roma, che un tempo ordinò il mondo, era"
2233,"due soli aver, che l’una e l’altra strada","solita avere due soli, che indicavano le due strade,"
2234,"facean vedere, e del mondo e di Deo.",della felicità temporale e della beatitudine celeste.
2235,L’un l’altro ha spento; ed è giunta la spada,Ma uno ha spento l’altro; e la spada imperiale è
2236,"col pasturale, e l’un con l’altro insieme","stata unita con il pastorale religioso, e i due poteri"
2237,per viva forza mal convien che vada;,riuniti a viva forza procedono fatalmente in modo
2238,"però che, giunti, l’un l’altro non teme:","negativo; poiché, riuniti nella stessa persona, non"
2239,"se non mi credi, pon mente a la spiga,","si temono più l’un l’altro: se non mi credi, considera"
2240,ch’ogn’ erba si conosce per lo seme.,"i frutti, poiché ogni pianta si riconosce dalla qualità del seme."
2241,"In sul paese ch’Adice e Po riga,","Nella regione irrigata dal Po e dall’Adige , "
2242,"solea valore e cortesia trovarsi,","era facile trovare virtù morali e liberalità, "
2243,prima che Federigo avesse briga;,prima che Federico II entrasse in contrasto
2244,or può sicuramente indi passarsi,con il Papato; ora può passare con sicurezza di
2245,"per qualunque lasciasse, per vergogna","lì chiunque tralasci, per vergogna , "
2246,di ragionar coi buoni o d’appressarsi.,di parlare o di avvicinarsi a persone oneste.
2247,Ben v’èn tre vecchi ancora in cui rampogna,Veramente ci sono ancora tre vecchi in
2248,"l’antica età la nova, e par lor tardo",cui gli antichi usi di valore e cortesia sono un rimprovero 
2249,che Dio a miglior vita li ripogna:,"per la nuova età, e non vedono l’ora che"
2250,Currado da Palazzo e ’l buon Gherardo,"Dio li destini a miglior vita: Corrado da Palazzo, il"
2251,"e Guido da Castel, che mei si noma,","buon Gherardo e Guido da Castello, che è meglio"
2252,"francescamente, il semplice Lombardo.","noto col soprannome, foggiato alla francese, di Lombardo schietto e leale."
2253,"Dì oggimai che la Chiesa di Roma,","Puoi ormai dire che la Chiesa di Roma, per"
2254,"per confondere in sé due reggimenti,","volere unire in sé i due poteri, cade nel fango, e"
2255,"cade nel fango, e sé brutta e la soma».",insudicia il suo compito e quello che si è addossato».
2256,"«O Marco mio», diss’ io, «bene argomenti;","«O Marco mio», dissi io, «tu parli con saggezza; "
2257,e or discerno perché dal retaggio,e ora capisco chiaramente perché i sacerdoti  della tribù dei Leviti
2258,li figli di Levì furono essenti.,furono esclusi dal diritto di trasmissione ereditaria dei loro beni .
2259,Ma qual Gherardo è quel che tu per saggio,Ma chi è quel Gherardo che dici essere rimasto
2260,"di’ ch’è rimaso de la gente spenta,","come modello della generazione passata ,"
2261,in rimprovèro del secol selvaggio?».,a rimprovero della presente generazione corrotta?».
2262,"«O tuo parlar m’inganna, o el mi tenta»,","«Forse ho frainteso la tua parlata,"
2263,"rispuose a me; «ché, parlandomi tosco,","mi rispose, perchè, pur parlando toscano"
2264,par che del buon Gherardo nulla senta.,sembra che tu non sappia nulla del buon Gherardo. 
2265,"Per altro sopranome io nol conosco,","Io non saprei indicarlo con un altro soprannome, "
2266,s’io nol togliessi da sua figlia Gaia.,a meno di ricavarlo dalla figlia Gaia. 
2267,"Dio sia con voi, ché più non vegno vosco.","Dio vi accompagni, perché io non posso più procedere con voi."
2268,Vedi l’albor che per lo fummo raia,"Vedi la luce dell’alba, che comincia a"
2269,"già biancheggiare, e me convien partirmi","irradiarsi  biancastra attraverso il fumo, e io"
2270,(l’angelo è ivi) prima ch’io li paia».,devo separarmi da voi  prima di comparirgli davanti».
2271,"Così tornò, e più non volle udirmi.",Così girò su se stesso e non volle più ascoltarmi.
2272,"Ricorditi, lettor, se mai ne l’alpe","O lettore, se mai in montagna  ti sorprese"
2273,ti colse nebbia per la qual vedessi,"la nebbia, attraverso la quale tu vedesti non diversamente dalla talpa "
2274,"non altrimenti che per pelle talpe,","attraverso la membrana che ricopre i suoi occhi,"
2275,"come, quando i vapori umidi e spessi","rammentati in quale modo, non appena i vapori umidi "
2276,"a diradar cominciansi, la spera","e densi cominciano a diradarsi, la sfera del sole debolmente "
2277,del sol debilemente entra per essi;,penetra attraverso di essi; e allora la tua fantasia  
2278,e fia la tua imagine leggera,potrà  facilmente arrivare a percepire
2279,in giugnere a veder com’ io rividi,"come io inizialmente rividi il sole, "
2280,"lo sole in pria, che già nel corcar era.",il quale stava ormai tramontando.
2281,"Sì, pareggiando i miei co’ passi fidi","Così, uguagliando il ritmo dei miei passi con"
2282,"del mio maestro, usci’ fuor di tal nube","quelli sicuri del mio maestro, uscii da tale nube alla"
2283,ai raggi morti già ne’ bassi lidi.,"luce dei raggi solari, ormai spenti nella parte bassa del monte."
2284,O imaginativa che ne rube,"O fantasia, che talvolta ci assorbi  tanto"
2285,"talvolta sì di fuor, ch’om non s’accorge","che non ci avvediamo della realtà, benché intorno a"
2286,"perché dintorno suonin mille tube,","noi risuonino mille trombe, chi ti mette in moto, visto"
2287,"chi move te, se ’l senso non ti porge?",che gli organi sensitivi non ti sollecitano? 
2288,"Moveti lume che nel ciel s’informa,","Ti suscita una luce che prende forma dal cielo, "
2289,per sé o per voler che giù lo scorge.,in maniera autonoma o per volontà divina che la indirizza verso il mondo. 
2290,De l’empiezza di lei che mutò forma,Il gesto crudele di colei che si trasformò 
2291,"ne l’uccel ch’a cantar più si diletta,","nell’uccello che si compiace più di ogni altro di cantare, "
2292,ne l’imagine mia apparve l’orma;,comparve come un’impronta nella mia fantasia ; 
2293,e qui fu la mia mente sì ristretta,"e la mia mente fu così concentrata  in questa visione, "
2294,"dentro da sé, che di fuor non venìa",che dall’esterno non giungeva alcuna impressione 
2295,cosa che fosse allor da lei ricetta.,che allora potesse essere da lei ricevuta.
2296,Poi piovve dentro a l’alta fantasia,"Poi scese dall’alto, nella mia rapita immaginazione, "
2297,"un crucifisso, dispettoso e fero","la figura di un uomo crocifisso, che sdegnoso e irato  "
2298,"ne la sua vista, e cotal si moria;","appariva, e così atteggiato  moriva ;"
2299,"intorno ad esso era il grande Assüero,","intorno a lui erano il grande re Assuero, "
2300,"Estèr sua sposa e ’l giusto Mardoceo,","sua moglie Ester e il giusto Mardocheo, "
2301,che fu al dire e al far così intero.,che fu così onesto  nelle parole e nelle opere.
2302,E come questa imagine rompeo,Non appena questa immaginazione svanì  
2303,"sé per sé stessa, a guisa d’una bulla","di per se stessa, come una bolla d’aria"
2304,"cui manca l’acqua sotto qual si feo,",alla quale venga meno la pellicola d’acqua in cui si
2305,surse in mia visïone una fanciulla,"è formata, comparve nella mia visione una fanciulla"
2306,"piangendo forte, e dicea: «O regina,","che piangeva disperatamente e diceva: «O regina, "
2307,perché per ira hai voluto esser nulla?,perché hai voluto annientarti per un impeto d’ira?
2308,Ancisa t’hai per non perder Lavina;,Ti sei uccisa per non perdere Lavinia; 
2309,"or m’hai perduta! Io son essa che lutto,","ora mi hai ugualmente perduta! Sono proprio io che piango, "
2310,"madre, a la tua pria ch’a l’altrui ruina».","madre, per la tua triste sorte prima che per quella di Turno » ."
2311,Come si frange il sonno ove di butto,Allo stesso modo in cui il sonno si interrompe quando di colpo 
2312,"nova luce percuote il viso chiuso,","una luce improvvisa  colpisce gli occhi  chiusi, "
2313,che fratto guizza pria che muoia tutto;,e anche spezzato persiste un po’ prima di svanire completamente; 
2314,così l’imaginar mio cadde giuso,così la mia visione scomparve non appena colpì 
2315,"tosto che lume il volto mi percosse,",il mio viso una luce di gran lunga superiore 
2316,maggior assai che quel ch’è in nostro uso.,a quella alla quale ci eravamo già assuefatti.
2317,"I’ mi volgea per veder ov’ io fosse,",Io mi guardavo intorno per vedere dove io
2318,"quando una voce disse «Qui si monta»,","fossi, quando una voce disse: «Qui si sale», "
2319,che da ogne altro intento mi rimosse;,distogliendomi da ogni altro pensiero; 
2320,e fece la mia voglia tanto pronta,e rese tanto ardente il mio desiderio 
2321,"di riguardar chi era che parlava,","di sapere chi avesse parlato,che mai si sarebbe quietato, "
2322,"che mai non posa, se non si raffronta.",se non di fronte alla cosa desiderata.
2323,Ma come al sol che nostra vista grava,Ma come davanti al sole che abbaglia  
2324,"e per soverchio sua figura vela,","la nostra vista e per eccesso di luce nasconde la sua figura, "
2325,così la mia virtù quivi mancava.,così in questo caso la mia capacità visiva veniva meno.
2326,"«Questo è divino spirito, che ne la","«Questo è un angelo divino, che ci indirizza"
2327,"via da ir sù ne drizza sanza prego,","verso l’alto senza alcuna preghiera da parte nostra,"
2328,e col suo lume sé medesmo cela.,nascondendosi nella sua stessa luce. 
2329,"Sì fa con noi, come l’uom si fa sego;",Egli si comporta con noi come l’uomo agisce con se stesso;
2330,"ché quale aspetta prego e l’uopo vede,",perché chi vede il bisogno altrui e attende di essere
2331,malignamente già si mette al nego.,"pregato, si dispone già nell’atteggiamento maligno del rifiuto."
2332,Or accordiamo a tanto invito il piede;,Ora affrettiamoci per assecondare un così
2333,"procacciam di salir pria che s’abbui,","alto invito; cerchiamo di salire prima che faccia buio,"
2334,"ché poi non si poria, se ’l dì non riede».","poiché dopo non si potrebbe, fino a quando non"
2335,"Così disse il mio duca, e io con lui",ritorna  la luce del giorno». Così disse la mia
2336,volgemmo i nostri passi ad una scala;,guida; e insieme ci dirigemmo verso una scala; e
2337,"e tosto ch’io al primo grado fui,","appena io giunsi al primo gradino , "
2338,senti’mi presso quasi un muover d’ala,sentii accanto a me quasi il movimento di un’ala 
2339,e ventarmi nel viso e dir: ‘Beati,e un soffio di vento sul viso e una voce che diceva: 
2340,"pacifici, che son sanz’ ira mala!’.","‘Beati i pacifici, che sono senza ira cattiva!’ ."
2341,Già eran sovra noi tanto levati,"Già gli ultimi raggi del sole, ai quali poi segue"
2342,"li ultimi raggi che la notte segue,","la notte, si erano sollevati tanto al di sopra di noi, che"
2343,che le stelle apparivan da più lati.,da vari punti del cielo apparivano le stelle. 
2344,"‘O virtù mia, perché sì ti dilegue?’,","‘O vigore  mio, perché ti dilegui così?’, dicevo tra me"
2345,"fra me stesso dicea, ché mi sentiva","e me, poiché mi accorgevo che la forza delle mie"
2346,la possa de le gambe posta in triegue.,gambe era temporaneamente sospesa.
2347,Noi eravam dove più non saliva,"Noi ci trovavamo alla fine  della scala, "
2348,"la scala sù, ed eravamo affissi,","ed eravamo fermi , proprio"
2349,pur come nave ch’a la piaggia arriva.,come una nave che è arrivata alla riva.
2350,"E io attesi un poco, s’io udissi","E io un poco prestai attenzione, se mai"
2351,alcuna cosa nel novo girone;,udissi qualche suono in questa nuova cornice; 
2352,"poi mi volsi al maestro mio, e dissi:","poi mi rivolsi al mio maestro, e dissi: «Mio dolce padre,"
2353,"«Dolce mio padre, dì, quale offensione","dimmi, quale colpa viene espiata  qui, nel"
2354,si purga qui nel giro dove semo?,girone in cui ci troviamo? Se stanno fermi i nostri
2355,"Se i piè si stanno, non stea tuo sermone».","piedi, non stia fermo il tuo parlare»."
2356,"Ed elli a me: «L’amor del bene, scemo",Ed egli a me: «Proprio qui  si ripara
2357,"del suo dover, quiritta si ristora;","l’amore del bene, minore di quanto dovrebbe essere ;"
2358,qui si ribatte il mal tardato remo.,qui si compensa con colpi di remo 
2359,"Ma perché più aperto intendi ancora,",più veloci il lento vogare per la vita.
2360,"volgi la mente a me, e prenderai","Ma perché tu possa capire ancora più chiaramente,"
2361,alcun buon frutto di nostra dimora».,"volgi a me l’attenzione, e ricaverai qualche vantaggio dalla nostra sosta»."
2362,"«Né creator né creatura mai»,","Egli cominciò a dire: «Figliuolo, né il Creatore "
2363,"cominciò el, «figliuol, fu sanza amore,","né creatura alcuna furono mai senza amore,"
2364,o naturale o d’animo; e tu ’l sai.,naturale o d’elezione ; e tu lo sai bene.
2365,"Lo naturale è sempre sanza errore,",L’amore naturale è sempre senza errore; 
2366,ma l’altro puote errar per malo obietto,"ma l’altro può sbagliare o perché si dirige al male, "
2367,o per troppo o per poco di vigore.,oppure per eccesso o carenza di intensità.
2368,"Mentre ch’elli è nel primo ben diretto,","Finché l’amore d’animo è diretto verso il bene supremo, "
2369,"e ne’ secondi sé stesso misura,","e si modera nei beni terreni, "
2370,esser non può cagion di mal diletto;,non può essere causa di piacere peccaminoso; 
2371,"ma quando al mal si torce, o con più cura","ma quando devia verso il male, o corre verso il bene rispettivamente "
2372,"o con men che non dee corre nel bene,","con maggiore o minore premura di quanto è giusto, "
2373,contra ’l fattore adovra sua fattura.,"allora, pur essendo creatura di Dio, opera contro il suo Creatore. "
2374,Quinci comprender puoi ch’esser convene,Di qui puoi comprendere che necessariamente 
2375,amor sementa in voi d’ogne virtute,l’amore è all’origine di ogni azione virtuosa 
2376,e d’ogne operazion che merta pene.,e di ogni operazione degna di essere punita.
2377,"Or, perché mai non può da la salute","Ora, poiché l’amore non può mai distogliere "
2378,"amor del suo subietto volger viso,","lo sguardo dal bene  del soggetto amante,"
2379,da l’odio proprio son le cose tute;,ogni creatura è tutelata  dall’odio contro se stessa; 
2380,"e perché intender non si può diviso,",e poiché nessun essere si può considerare 
2381,"e per sé stante, alcuno esser dal primo,","separato dal Creatore , e di per sé autonomo, "
2382,da quello odiare ogne effetto è deciso.,qualunque creatura è impedita  dall’odiare Dio.
2383,"Resta, se dividendo bene stimo,","Non rimane che concludere, se suddividendo giudico correttamente, "
2384,che ’l mal che s’ama è del prossimo; ed esso,"che si può desiderare solo il male del prossimo; questo desiderio, "
2385,amor nasce in tre modi in vostro limo.,"in voi uomini creati dal fango, si manifesta in tre modi."
2386,"È chi, per esser suo vicin soppresso,","C’è chi spera di primeggiare quando è abbattuto il suo prossimo, "
2387,"spera eccellenza, e sol per questo brama","spera eccellenza, e per questo solo brama "
2388,ch’el sia di sua grandezza in basso messo;,che sia deposto dalla sua grandezza;
2389,"è chi podere, grazia, onore e fama","C’è chi teme di perdere favore, onore e gloria, "
2390,"teme di perder perch’ altri sormonti,","quando un altro si innalza sopra di lui, "
2391,onde s’attrista sì che ’l contrario ama;,per cui si rattrista tanto da desiderare il contrario; 
2392,"ed è chi per ingiuria par ch’aonti,","e c’è chi, per un’offesa ricevuta, "
2393,"sì che si fa de la vendetta ghiotto,","manifestamente si sdegna a tal punto da diventare avido di vendetta, "
2394,e tal convien che ’l male altrui impronti.,e in tale esasperazione consegue che prepari il male altrui.
2395,Questo triforme amor qua giù di sotto,Questo triplice amore si sconta nelle sottostanti cornici; 
2396,"si piange: or vo’ che tu de l’altro intende,","adesso desidero che ti renda conto dell’altro amore, "
2397,che corre al ben con ordine corrotto.,che si dirige verso il bene in misura non giusta.
2398,Ciascun confusamente un bene apprende,Ogni creatura conosce vagamente un
2399,"nel qual si queti l’animo, e disira;","bene, nel quale l’animo si appaghi, e aspira a esso;"
2400,per che di giugner lui ciascun contende.,perciò ognuno si sforza  di raggiungerlo.
2401,Se lento amore a lui veder vi tira,Se un amore debole vi sospinge a conoscerlo o
2402,"o a lui acquistar, questa cornice,","a raggiungerlo, questa cornice vi punisce, dopo"
2403,"dopo giusto penter, ve ne martira.",un giusto pentimento. L’altro bene è tale che non
2404,Altro ben è che non fa l’uom felice;,"rende l’uomo felice; non procura la felicità, "
2405,"non è felicità, non è la buona","né contiene l’essenza divina, da cui nascono  "
2406,"essenza, d’ogne ben frutto e radice.",e si sviluppano  tutti gli altri beni. 
2407,"L’amor ch’ad esso troppo s’abbandona,","L’amore che si concede con eccessivo ardore a questi beni , "
2408,di sovr’ a noi si piange per tre cerchi;,è punito nelle tre cornici successive ; 
2409,"ma come tripartito si ragiona,","ma come si presenti razionalmente diviso in tre parti, "
2410,"tacciolo, acciò che tu per te ne cerchi».","non lo rivelo, perché tu possa ricercarlo da solo »."
2411,Posto avea fine al suo ragionamento,L’eletto maestro  aveva posto termine 
2412,"l’alto dottore, e attento guardava",alla sua dimostrazione e osservava attentamente
2413,ne la mia vista s’io parea contento;,i miei occhi per vedere se apparivo soddisfatto; 
2414,"e io, cui nova sete ancor frugava,","e io, che ero stimolato  ancora da un nuovo desiderio di sapere, "
2415,"di fuor tacea, e dentro dicea: ‘Forse","esteriormente tacevo, ma dentro di me dicevo: "
2416,lo troppo dimandar ch’io fo li grava’.,‘Forse le troppe domande che gli rivolgo lo infastidiscono’. 
2417,"Ma quel padre verace, che s’accorse","Ma quel vero padre, che si accorse"
2418,"del timido voler che non s’apriva,","del timido desiderio  che non si manifestava,"
2419,"parlando, di parlare ardir mi porse.","prendendo la parola, mi incoraggiò a parlare."
2420,"Ond’ io: «Maestro, il mio veder s’avviva","Allora dissi: «Maestro, il mio intelletto "
2421,"sì nel tuo lume, ch’io discerno chiaro","si rischiara tanto alla luce della tua sapienza, "
2422,quanto la tua ragion parta o descriva.,che  distinguo chiaramente ciò che il tuo ragionamento formula  o analizza . 
2423,"Però ti prego, dolce padre caro,","Perciò ti prego, caro dolce padre, "
