Original,Translate_IT_1
"In quella parte del giovanetto anno che 'l sole i crin sotto l'Aquario tempra e già le notti al mezzo dì sen vanno, quando la brina in su la terra assempra l'imagine di sua sorella bianca, ma poco dura a la sua penna tempra, lo villanello a cui la roba manca, si leva, e guarda, e vede la campagna biancheggiar tutta","In quel periodo dell’anno appena iniziato, in cui il Sole intiepidisce i raggi sotto l’Acquario e le notti si avvicinano alla durata dei giorni (=dal 21 gennaio al 18 febbraio), quando la brina sulla Terra è l’imma-gine della neve, la sua bianca sorella, anche se ben presto si scioglie, il contadino, a cui manca il forag-gio, si alza e guarda fuori, e vede tutta la campagna imbiancata"
" ond'ei si batte l'anca, ritorna in casa, e qua e là si lagna, come 'l tapin che non sa che si faccia"," Perciò si batte il fianco disperato, ritor-na in casa e si lagna andando qua e là, come un po-veraccio che non sa che cosa fare"
" poi riede, e la speranza ringavagna, veggendo 'l mondo aver cangiata faccia in poco d'ora, e prende suo vincastro e fuor le pecorelle a pascer caccia"," Poi ritorna fuori e riacquista la speranza, poiché vede che il mondo in poco tempo ha cambiato faccia e la brina si è sciol-ta"
" Così mi fece sbigottir lo mastro quand'io li vidi sì turbar la fronte, e così tosto al mal giunse lo 'mpiastro", Prende il suo bastone e spinge le pecore fuori dell’ovile a pascolare
" ché, come noi venimmo al guasto ponte, lo duca a me si volse con quel piglio dolce ch'io vidi prima a piè del monte"," Allo stesso modo il maestro mi fece sbigottire quan-do io lo vidi con la fronte così turbata, e altrettanto rapidamente giunse il rimedio al male, perché, come noi venimmo al ponte franato, la mia guida si rivolse a me con l’aspetto dolce che io vidi la prima volta ai piedi del colle"
" Le braccia aperse, dopo alcun consiglio eletto seco riguardando prima ben la ruina, e diedemi di piglio"," Osservò con attenzione la frana, pre-se una decisione tra sé e sé, quindi aprì le braccia e mi afferrò saldamente per farmi salire"
" E come quei ch'adopera ed estima, che sempre par che 'nnanzi si proveggia, così, levando me sù ver' la cima d'un ronchione, avvisava un'altra scheggia dicendo: “Sovra quella poi t'aggrappa"," E, come chi si mette all’opera e valuta il da farsi, e mostra di a-vere sempre una soluzione pronta, così, mentre mi trascinava verso la cima di un masso sporgente, a-docchiava un’altra roccia e mi diceva: «Aggràppati poi a quella, ma prima controlla se è tanto solida da reggerti"
 ma tenta pria s'è tal ch'ella ti reggia”,"» La via non era adatta a gente che indossava il man-tello di piombo, poiché noi a malapena, egli leggero ed io spinto da lui, potevamo salire di sporgenza in sporgenza"
" Non era via da vestito di cappa, ché noi a pena, ei lieve e io sospinto, potavam sù montar di chiappa in chiappa"," E, se non fosse che da quella parte del-l’argine più che dall’altra il pendio era più breve, non so lui, ma io mi sarei fermato"
" E se non fosse che da quel precinto più che da l'altro era la costa corta, non so di lui, ma io sarei ben vinto"," Ma, poiché Ma-lebolge declina tutta verso l’apertura del pozzo che si trova nella parte più bassa dell’inferno, la posi-zione di ciascuna bolgia fa sì che l’argine esterno sia più alto e quello interno più basso"
" Ma perché Malebolge inver' la porta del bassissimo pozzo tutta pende, lo sito di ciascuna valle porta che l'una costa surge e l'altra scende"," Alla fine noi ve-nimmo in cima alla frana, dove l’ultima roccia è ca-duta"
 noi pur venimmo al fine in su la punta onde l'ultima pietra si scoscende," Io non avevo più fiato nei polmoni, quando ar-rivai su, e non potevo procedere oltre, perciò, appe-na arrivato, mi sedetti"
" La lena m'era del polmon sì munta quand'io fui sù, ch'i' non potea più oltre, anzi m'assisi ne la prima giunta"," «Ora non devi fermarti a riposare» disse il maestro, «poiché sedendo su piume né stando sotto coltri si acquista fama"
" “Omai convien che tu così ti spoltre”, disse 'l maestro"," E chi passa la sua vita senza di essa, sulla Terra lascia di sé una traccia simile al fumo nell’aria e alla schiuma nell’acqua"
" “ché, seggendo in piuma, in fama non si vien, né sotto coltre"," Perciò àlzati su, vinci l’affanno del respiro con la forza d’animo che vince ogni resistenza, se non si accascia per terra con il suo corpo mortale"
" sanza la qual chi sua vita consuma, cotal vestigio in terra di sé lascia, qual fummo in aere e in acqua la schiuma"," Conviene salire una scala più lunga, non basta essersi allontanati da questi dannati"
 E però leva sù," E, se tu mi capisci, fa’ in modo che il mio consiglio ti sia utile"
" vinci l'ambascia con l'animo che vince ogne battaglia, se col suo grave corpo non s'accascia","» Allora mi alzai, mostrando di avere più fiato di quanto non mi sentivo in corpo, e dissi: «Vai avanti, perché io sono forte e ardito…» I dannati della settima bolgia Prendemmo la via su per il ponte roccioso, che era impervio, stretto e malagevole, e assai più ripido di quello precedente"
 Più lunga scala convien che si saglia," Andavo avanti parlando, per non apparire affaticato, quando dall’altra bolgia uscì una voce che pronunciava parole confuse"
 non basta da costoro esser partito," Non so che cosa disse, anche se ero già in cima al ponte che so-vrastava la bolgia, ma chi parlava sembrava che si stesse muovendo"
" Se tu mi 'ntendi, or fa sì che ti vaglia”"," Io guardavo in giù, ma i miei oc-chi, per quanto attenti, non potevano andare sino al fondo a causa del buio"
" Leva' mi allor, mostrandomi fornito meglio di lena ch'i' non mi sentia, e dissi: “Va, ch'i' son forte e ardito”"," Allora dissi: «O maestro, cerca di arrivare sull’altro argine che cinge la bolgia e scendiamo dal ponte, perché da qui io odo le voci ma non capisco le parole, guardo in basso e non vedo nulla"
" Su per lo scoglio prendemmo la via, ch'era ronchioso, stretto e malagevole, ed erto più assai che quel di pria","» «Non ti do altra risposta» disse, «se non invitandoti ad agire, perché alla giusta domanda deve seguire l’azione fatta in silenzio»"
 Parlando andava per non parer fievole," Noi discendemmo il ponte dalla parte in cui si con-giunge con l’ottava bolgia, poi la bolgia mi apparve ben visibile"
" onde una voce uscì de l'altro fosso, a parole formar disconvenevole"," Dentro vidi un terribile groviglio di serpenti, di specie talmente diverse che il solo ricor-do mi rimescola il sangue"
" Non so che disse, ancor che sovra 'l dosso fossi de l'arco già che varca quivi"," La Libia non si deve più vantare con la sua sabbia, poiché, se produce cheli-dri, iacule, faree, cencri e anfisibene, non mostrò mai tanti animali velenosi e dannosi con tutta l’Etiopia né con la regione sopra il Mar Rosso (=l’Arabia)"
 ma chi parlava ad ire parea mosso," In mezzo a questa crudele e tristissima abbondanza correvano genti nude e spaventate, sen-za speranza di trovare un rifugio o la pietra dell’invisibilità"
" Io era vòlto in giù, ma li occhi vivi non poteano ire al fondo per lo scuro"," Dietro le spalle avevano le mani legate con serpi, che ficcavano la coda e il capo lungo le reni e poi si annodavano sul ventre"
" per ch'io: “Maestro, fa che tu arrivi da l'altro cinghio e dismontiam lo muro", Vanni Fucci come l’Araba Fenice All’improvviso un serpente si avventò sopra un dan-nato che era dalla nostra parte e lo morse là dove il collo incontra le spalle
" ché, com'i' odo quinci e non intendo, così giù veggio e neente affiguro”"," Non si scrissero mai una “O” né una “I” così velocemente come quello si ac-cese, bruciò e, cadendo a terra, divenne tutto cenere"
" “Altra risposta”, disse, “non ti rendo se non lo far"," Ma, dopo che fu a terra così distrutto, la cenere si raccolse da sola e il dannato ritornò subito nel suo aspetto precedente"
 ché la dimanda onesta si de' seguir con l'opera tacendo”," Così i saggi narrano che la feni-ce muore e poi rinasce, quando si avvicina ai cin-quecento anni di età"
" Noi discendemmo il ponte da la testa dove s'aggiugne con l'ottava ripa, e poi mi fu la bolgia manifesta: e vidivi entro terribile stipa di serpenti, e di sì diversa mena che la memoria il sangue ancor mi scipa"," Nella sua vita non si nutre di erba né di biada, ma soltanto di gocce di incenso e di resina profumata, e le sue bende funebri sono di nardo e di mirra"
 Più non si vanti Libia con sua rena," E come colui che cade e non sa come, se per la forza di un demone che lo tira a terra o per l’epilessia che lo colpisce, quando si rialza si guarda intorno, tutto smarrito per la grave angoscia che ha provato"
" ché se chelidri, iaculi e faree produce, e cencri con anfisibena, né tante pestilenzie né sì ree mostrò già mai con tutta l'Etïopia né con ciò che di sopra al Mar Rosso èe"," E, guardandosi intorno, sospira"
" Tra questa cruda e tristissima copia corrëan genti nude e spaventate, sanza sperar pertugio o elitropia: con serpi le man dietro avean legate", Così era il peccatore dopo che si era rialzato
" quelle ficcavan per le ren la coda e 'l capo, ed eran dinanzi aggroppate"," Oh, potenza di Dio, quanto sei severa, perché, per far giustizia, colpisci con punizioni così dure"
" Ed ecco a un ch'era da nostra proda, s'avventò un serpente che 'l trafisse là dove 'l collo a le spalle s'annoda", La mia guida do-mandò poi al dannato chi era
" Né O sì tosto mai né I si scrisse, com'el s'accese e arse, e cener tutto convenne che cascando divenisse", Ed egli rispose: «Io precipitai dalla Toscana in questa bolgia crudele poco tempo fa
" e poi che fu a terra sì distrutto, la polver si raccolse per sé stessa e 'n quel medesmo ritornò di butto"," Mi piacque vivere da bestia e non da uomo, proprio come il bastardo che fui"
" Così per li gran savi si confessa che la fenice more e poi rinasce, quando al cinquecentesimo anno appressa"," Io sono Vanni Fucci, detto il Bestia, e Pistoia mi fu degna tana»"
" erba né biado in sua vita non pasce, ma sol d'incenso lagrime e d'amomo, e nardo e mirra son l'ultime fasce"," 5 7 Ed io alla mia guida: «Digli che non scappi e domandagli quale colpa lo scaraventò qui tra i ladri, perché io lo conobbi come uomo sanguinario e rissoso"
" E qual è quel che cade, e non sa como, per forza di demon ch'a terra il tira, o d'altra oppilazion che lega l'omo, quando si leva, che 'ntorno si mira tutto smarrito de la grande angoscia ch'elli ha sofferta, e guardando sospira: tal era 'l peccator levato poscia","» Il peccatore comprese le mie parole e non lo nasco-se, drizzò verso di me l’animo e il volto e divenne rosso d’ira e di vergogna"
" Oh potenza di Dio, quant'è severa, che cotai colpi per vendetta croscia"," La predizione di Vanni Fucci Poi disse: «Provo più dolore di farmi trovare in questa mise-revole condizione, in cui tu mi vedi, che di esserme-ne andato dalla vita mortale"
 Lo duca il domandò poi chi ello era, Io non posso negare quello che tu chiedi
" per ch'ei rispuose: “Io piovvi di Toscana, poco tempo è, in questa gola fiera"," Io sono messo tra i ladri perché rubai gli arredi preziosi dalla sacrestia del duomo di Pistoia, e il furto fu attribuito a torto ad altri"
" Vita bestial mi piacque e non umana, sì come a mul ch'i' fui"," Ma, affinché tu non possa godere di avermi visto in que-sto stato, se mai uscirai da questi luoghi oscuri, apri le orecchie e ascolta la mia predizione: prima Pi-stoia caccerà in esilio i guelfi neri, poi sarà Firenze a cacciare i guelfi bianchi e a cambiar governo"
" son Vanni Fucci bestia, e Pistoia mi fu degna tana”"," Marte farà uscire dalla Val di Magra (=dalla Luni-giana) un fulmine (=Moroello Malaspina, guelfo ne-ro), che sarà circondato da nere nubi"
" E ïo al duca: “Dilli che non mucci, e domanda che colpa qua giù 'l pinse"," E come un u-ragano impetuoso e inarrestabile si abbatterà sopra Campo Piceno, vicino a Pistoia, spazzerà via rapi-damente la nebbia e colpirà con violenza ogni guel-fo bianco"
 ch'io 'l vidi omo di sangue e di crucci”, Te l’ho detto per farti soffrire
" E 'l peccator, che 'ntese, non s'infinse, ma drizzò verso me l'animo e 'l volto, e di trista vergogna si dipinse",»
