Original,Translate_IT_1
"“ ”, cominciò Pluto con la voce chioccia","«O papa Satana, o papa Satana alfa"
" e quel savio gentil, che tutto seppe, disse per confortarmi: “Non ti noccia la tua paura",» cominciò Plu-to con voce gracchiante
" ché, poder ch'elli abbia, non ci torrà lo scender questa roccia”"," Quel saggio gentile, che seppe ogni cosa, per confortarmi disse: «Non ti nuoccia la tua paura, poiché, per potere che egli abbia, non ci impedirà di scendere giù nell’in-ferno»"
" Poi si rivolse a quella 'nfiata labbia, e disse: “Taci, maladetto lupo"," Poi si rivolse a quel volto gonfio d’ira e disse: «Taci, o maledetto lupo"
 consuma dentro te con la tua rabbia, E consuma dentro di te la tua rabbia
" Non è sanza cagion l'andare al cupo: vuolsi ne l'alto, là dove Michele fé la vendetta del superbo strupo”"," Non è senza causa il nostro viaggio verso il fondo dell’inferno: si vuole così in cielo, dove l’arcangelo Michele vendicò il più grave peccato di Lucifero, la sua sconfinata superbia"
" Quali dal vento le gonfiate vele caggiono avvolte, poi che l'alber fiacca, tal cadde a terra la fiera crudele","» Come le vele gonfiate dal vento cadono ravvolte, poiché l’albero della nave si spezza, così cadde a terra la belva crudele"
" Così scendemmo ne la quarta lacca, pigliando più de la dolente ripa che 'l mal de l'universo tutto insacca"," Scendemmo nel quarto cerchio, procedendo più in basso in quella dolorosa voragine che raccoglieva tutto il male dell’universo"
 Ahi giustizia di Dio," Ahi, o giustizia di Dio, chi mai ammassa tante nuove pene e tanti tormenti quanti ne vidi io qui? E perché, se siamo nati per il cielo, le nostre colpe ci straziano in tal modo? Gli avari e i prodighi Come fa l’onda del mar Ionio sopra il paese sicilia-no di Cariddi, che s’infrange contro quella che pro-viene dal mar Tirreno, così qui la gente è costretta a ballare in tondo"
" tante chi stipa nove travaglie e pene quant'io viddi? e perché nostra colpa sì ne scipa? Come fa l'onda là sovra Cariddi, che si frange con quella in cui s'intoppa, così convien che qui la gente riddi"," Qui io vidi gente più numerosa che altrove, che da una parte e dall’altra, con grandi ur-la, faceva rotolare massi che spingeva con il petto"
" Qui vid'i' gente più ch'altrove troppa, e d'una parte e d'altra, con grand' urli, voltando pesi per forza di poppa"," Si scontravano con violenza, poi ciascun dannato, voltandosi indietro, si rivolgeva all’altro gridando: «Perché tieni stretto il denaro?» e «Tu perché lo sprechi?»"
 Percotëansi 'ncontro," Così tornavano indietro per il cerchio, o-scuro da ogni parte, al punto opposto, gridando anch’essi parole ingiuriose"
" e poscia pur lì si rivolgea ciascun, voltando a retro, gridando: “Perché tieni?” e “Perché burli?”"," Poi, quand’era giunto, ciascun dannato si volgeva indietro e ripercorreva il suo mezzo cerchio fino al nuovo scontro"
" Così tornavan per lo cerchio tetro da ogne mano a l'opposito punto, gridandosi anche loro ontoso metro"," Con il cuo-re traboccante d’angoscia, dissi: «O maestro mio, dimmi che gente è questa e dimmi se furono tutti chierici questi dannati che hanno la chierica qui alla nostra sinistra…» Ed egli a me: «Tutti costoro furono prodighi, videro in modo di-storto con la ragione nella vita terrena e non fecero mai alcuna spesa con misura"
" poi si volgea ciascun, quand'era giunto, per lo suo mezzo cerchio a l'altra giostra"," La loro voce lo abbaia molto chiaramente, quando giungono ai due punti opposti del cerchio, dove la colpa contraria li divi-de"
" E io, ch'avea lo cor quasi compunto, dissi: “Maestro mio, or mi dimostra che gente è questa, e se tutti fuor cherci questi chercuti a la sinistra nostra”"," Questi altri che non hanno il coperchio di capelli sul capo, furono avari: furono chierici, papi e cardi-nali"
" Ed elli a me: “Tutti quanti fuor guerci sì de la mente in la vita primaia, che con misura nullo spendio ferci", Su di essi l’avarizia ha esercitato tutto il suo potere»
" Assai la voce lor chiaro l'abbaia, quando vegnono a' due punti del cerchio dove colpa contraria li dispaia"," Ed io: «O maestro, tra costoro io dovrei ben riconoscere alcuni, che s’insozzarono di questi due vizi"
" Questi fuor cherci, che non han coperchio piloso al capo, e papi e cardinali, in cui usa avarizia il suo soperchio”","» Ed egli a me: «In testa hai un pensiero sbagliato: la vita dissenna-ta, che li fece sozzi, ora impedisce di riconoscerli"
" E io: “Maestro, tra questi cotali dovre' io ben riconoscere alcuni che furo immondi di cotesti mali”"," Cozzeranno in eterno gli uni contro gli altri: gli ava-ri risorgeranno dalla tomba con il pugno chiuso, i prodighi con i capelli tagliati"
" Ed elli a me: “Vano pensiero aduni: la sconoscente vita che i fé sozzi, ad ogne conoscenza or li fa bruni"," Lo spreco di denaro e l’attaccamento al denaro hanno tolto loro il mondo bello del paradiso, e li hanno posti in questa zuffa: quale essa sia, non aggiungo altre parole"
" In etterno verranno a li due cozzi: questi resurgeranno del sepulcro col pugno chiuso, e questi coi crin mozzi"," La Fortuna Ora, o figlio, puoi vedere la breve permanenza nelle nostre mani dei beni che sono affidati alla Fortuna, per i quali l’umana gente si affanna"
" Mal dare e mal tener lo mondo pulcro ha tolto loro, e posti a questa zuffa: qual ella sia, parole non ci appulcro"," Tutto l’oro che è e che fu sotto la Luna, sulla Terra, non potrebbe acquietare neppure una di queste anime sofferenti»"
" Or puoi, figliuol, veder la corta buffa d'i ben che son commessi a la fortuna, per che l'umana gente si rabuffa"," «O maestro mio» io dissi, «ora dimmi anche: che cos’è questa Fortuna, di cui tu mi parli, che ha i beni del mondo tra i suoi artigli?» E quello a me: «O creature sciocche, quanta ignoranza vi danneg-gia"
" ché tutto l'oro ch'è sotto la luna e che già fu, di quest'anime stanche non poterebbe farne posare una”", Ora voglio che tu assimili bene le mie parole
" “Maestro mio”, diss'io, “or mi dì anche: questa fortuna di che tu mi tocche, che è, che i ben del mondo ha sì tra branche?”"," Colui il cui sapere supera tutto (=Dio) creò i cieli e diede loro chi li conduce (=le intelligenze angeli-che), in modo che ogni cielo risplenda come tutti gli altri, poiché diffonde la stessa quantità di luce"
" E quelli a me: “Oh creature sciocche, quanta ignoranza è quella che v'offende"," Allo stesso modo per le ricchezze terrene dispose un’intelligenza generale e una guida, che a tempo debito trasferisse i beni vani di gente in gente e da una famiglia all’altra, al di là delle resistenze fatte dagli uomini"
 Or vo' che tu mia sentenza ne 'mbocche," Perciò una gente diventa ricca, un’altra diventa povera, in base al giudizio della Fortuna, che è nascosto, come il serpente tra l’erba"
" Colui lo cui saver tutto trascende, fece li cieli e diè lor chi conduce sì, ch'ogne parte ad ogne parte splende, distribuendo igualmente la luce"," Il vostro sapere non la può contrastare: essa provve-de, giudica e attua i suoi disegni, come fanno le al-tre intelligenze angeliche"
" Similemente a li splendor mondani ordinò general ministra e duce che permutasse a tempo li ben vani di gente in gente e d'uno in altro sangue, oltre la difension d'i senni umani", I suoi trasferimenti di ric-chezza non si fermano mai
" per ch'una gente impera e l'altra langue, seguendo lo giudicio di costei, che è occulto come in erba l'angue"," La necessità, cioè il vo-lere divino, la fa essere veloce"
" Vostro saver non ha contasto a lei: questa provede, giudica, e persegue suo regno come il loro li altri dèi", Così succede spesso che qualcuno muti condizione
 Le sue permutazion non hanno triegue: necessità la fa esser veloce, Questa è colei che è maltrattata anche da coloro che dovrebbero lodarla e che invece la biasimano a torto e la insultano
 sì spesso vien chi vicenda consegue, Ma lei è beata e non ode le imprecazioni: con le altre intelligenze angeliche fa girare con animo lieto la sua sfera e con i beati gode della visione di Dio
" Quest'è colei ch'è tanto posta in croce pur da color che le dovrien dar lode, dandole biasmo a torto e mala voce"," Ora discendiamo nel cerchio sottostante, ad un’angoscia maggiore"
 ma ella s'è beata e ciò non ode: con l'altre prime creature lieta volve sua spera e beata si gode, Ormai tramontano le stelle che sorgevano quando io mi mossi dal limbo
 Or discendiamo omai a maggior pieta, Non possiamo fermarci troppo a lungo
" già ogne stella cade che saliva quand'io mi mossi, e 'l troppo star si vieta”","» Il cerchio quinto: gli iracondi e gli acci-diosi Noi attraversammo il cerchio fino alla riva opposta, sopra una sorgente che bolle e si riversa in un fossa-to, l’Acherónte, che parte da essa"
 Noi ricidemmo il cerchio a l'altra riva sovr'una fonte che bolle e riversa per un fossato che da lei deriva," L’acqua era oscu-ra, piuttosto che nera, e noi, seguendo le sue onde torbide, scendemmo giù per una via malagevole"
 L'acqua era buia assai più che persa," Questo ruscello malsano sbocca nella palude chia-mata Stige, quando è disceso ai piedi di quel pendio maligno e grigio"
" e noi, in compagnia de l'onde bige, intrammo giù per una via diversa"," Io ero tutto proteso a guardare, co-sì vidi genti ricoperte di fango in quel pantano (=gli iracondi)"
" In la palude va c'ha nome Stige questo tristo ruscel, quand'è disceso al piè de le maligne piagge grige", Erano tutte nude e avevano l’aspetto sof-ferente
" E io, che di mirare stava inteso, vidi genti fangose in quel pantano, ignude tutte, con sembiante offeso"," Esse si colpivano non soltanto con le mani, ma anche con la testa, il petto e i piedi, strappandosi con i denti brandelli di carne"
" Queste si percotean non pur con mano, ma con la testa e col petto e coi piedi, troncandosi co' denti a brano a brano"," Il buon maestro disse: «O figlio, ora vedi le anime che furono vinte dall’ira"
" Lo buon maestro disse: “Figlio, or vedi l'anime di color cui vinse l'ira"," Voglio anche che tu creda per certo che sot-to l’acqua c’è gente (=gli accidiosi), che sospira e fa 2 1 gorgogliare quest’acqua in superficie, come ti dice lo sguardo ovunque tu lo volgi"
" e anche vo' che tu per certo credi che sotto l'acqua è gente che sospira, e fanno pullular quest'acqua al summo, come l'occhio ti dice, u' che s'aggira"," Immersi nel fango, dicono: “Noi fummo tristi nell’aria dolce che il Sole rallegra, poiché portammo dentro l’animo il fumo dell’accidia e fummo indolenti e negligenti"
" Fitti nel limo dicon: ""Tristi fummo ne l'aere dolce che dal sol s'allegra, portando dentro accidïoso fummo: or ci attristiam ne la belletta negra""", Ora ci rattristiamo nella nera fanghiglia”
" Quest'inno si gorgoglian ne la strozza, ché dir nol posson con parola integra”"," Fanno gorgoglia-re questo lamento nella gola, poiché non lo possono dire con parole chiare»"
" Così girammo de la lorda pozza grand'arco, tra la ripa secca e 'l mézzo, con li occhi vòlti a chi del fango ingozza"," Così costeggiammo quella sozza palude facendo un grande arco tra l’argine roccioso e il pantano, con gli occhi rivolti a chi s’ingózza di fango"
 Venimmo al piè d'una torre al da sezzo, Alla fine venimmo ai piedi di una torre
,
